,title,authors,total time,yields,ingredients,instructions,images,host,nutrients,ratings
74,Easy OREO® Cheesecake,,270,16 serving(s),"['1 (18 ounce) package OREO Chocolate Sandwich Cookies, divided', '1/4 cup butter, melted', '4 (8 ounce) packages PHILADELPHIA Cream Cheese, softened', '1 cup sugar', '1 teaspoon vanilla', ""1 cup BREAKSTONE'S or KNUDSEN Sour Cream"", '4 eggs']","Preheat oven to 325 degrees F if using a silver 9-inch springform pan (or to 300 degrees F if using a dark nonstick 9-inch springform pan). Place 30 of the cookies in resealable plastic bag. Flatten bag to remove excess air, then seal bag. Finely crush cookies by rolling a rolling pin across the bag. Place in bowl. Add butter; mix well. Press firmly onto bottom of pan.
Beat cream cheese, sugar and vanilla in large bowl with electric mixer on medium speed until well blended. Add sour cream; mix well. Add eggs, 1 at a time, beating just until blended after each addition. Chop or crush remaining cookies. Gently stir 1-1/2 cups of the chopped cookies into cream cheese batter. Pour over crust; sprinkle with the remaining chopped cookies.
Bake 1 hour and 10 min. or until center is almost set. Cool. Refrigerate 3 hours or overnight. Cut into 16 pieces. Store leftover cheesecake in refrigerator.",https://images.media-allrecipes.com/images/79591.png,allrecipes.com,,
75,Lentils with Smoked Sausage and Carrots,,,4 serving(s),"['2 tablespoons cooking oil', '1 onion, chopped', '3 cloves garlic, minced', '3 carrots, halved lengthwise and cut crosswise into 3/4-inch pieces', '2 1/3 cups lentils', '1 quart water', '1 1/4 teaspoons salt', '1 bay leaf', '1 teaspoon dried thyme', '1 pound smoked sausage, cut diagonally into 3/4-inch slices', '3 tablespoons chopped fresh parsley']","In a large saucepan, heat the oil over moderately low heat. Add the onion, garlic, and carrots. Cook, stirring occasionally, until the onion is translucent, about 5 minutes.
Add the lentils, water, salt, bay leaf, and thyme. Bring to a boil, reduce the heat, and simmer, partially covered, until the lentils are almost tender, about 20 minutes. Discard the bay leaf.
Stir in the smoked sausage and parsley. Cook until the lentils are just tender but not falling apart and the sausage is warm, about 10 minutes longer.",https://images.media-allrecipes.com/images/79591.png,allrecipes.com,"{'calories': '932 calories;', 'fatContent': '44.2', 'carbohydrateContent': '77.8', 'proteinContent': '55.1', 'cholesterolContent': '77', 'sodiumContent': '2478'}",
76,Strawberry Heart Pillows,,70,16 serving(s),"['1 sheet frozen puff pastry, thawed', '1/3 cup strawberry jam or preserves', '1 cup thawed COOL WHIP Whipped Topping, divided', '4 large strawberries, each cut into 4 slices', ""1 (1 ounce) square BAKER'S Semi-Sweet Baking Chocolate, melted""]","Preheat oven to 350 degrees F. Unfold pastry. Cut into 16 hearts with 2-inch heart-shaped cookie cutter. Place on ungreased baking sheets.
Bake 20 min. or until golden brown. Remove to wire racks; cool completely.
Cut each heart horizontally in half. Spread 1 tsp. of the jam onto bottom half of each heart; top with 1 Tbsp. of the whipped topping and a strawberry slice. Cover with tops of hearts. Drizzle with chocolate. Serve immediately. Or, cover and refrigerate up to 1 hour.",https://images.media-allrecipes.com/images/79591.png,allrecipes.com,,
77,Filipino Fish Lumpia (Bangus Lumpia),lola,60,25 lumpia,"['1 milkfish (bangus)', '1 tablespoon soy sauce', '¼ lemon', '2 tablespoons olive oil', '1 onion, chopped', '2 cloves garlic, chopped', '1 cup frozen peas', '1 carrot, cut into matchsticks', '1 (1.5 ounce) box raisins', '1 stalk celery, diced', 'salt and ground black pepper to taste', '25 lumpia wrappers', 'oil for frying']","Remove scales, gills, and internal organs from bangus. Wash the inside of the fish. Slice open the backside to expose the meat. Pour soy sauce on top; squeeze lemon over the meat.
Pour enough water into a pot to cover the bangus. Bring to a boil. Add the bangus and boil until fish is no longer pink, 10 to 12 minutes.
Let bangus cool until safe to handle, at least 10 minutes. Remove bones.
Heat olive oil in a skillet over medium-high heat. Saute onion and garlic until onion is translucent, about 5 minutes. Add the fish meat, peas, carrot, raisins, and celery. Season filling with salt and pepper.
Wrap 1 tablespoon of the fish filling in a lumpia wrapper. Continue until remaining filling and wrappers are used up.
Heat vegetable oil in a deep saucepan over medium-high heat. Fry lumpias in batches in the hot oil until just light brown, 5 to 7 minutes per batch.",https://www.allrecipes.com/img/misc/og-default.png,allrecipes.com,,-1
78,Greek Easter Roast Lamb and Orzo,CartoonJunkie33,240,12 servings,"['1 (6 pound) bone-in leg of lamb', '3 cups mashed tomatoes', '1 medium onion, finely chopped', '½ cup olive oil', '3 teaspoons dried oregano', '2 teaspoons salt', '2 teaspoons ground black pepper', '1 lemon, juiced', '6 cups water', '1 pound uncooked orzo pasta', '½ pound feta cheese']","Preheat the oven to 325 degrees F (165 degrees C).
Place lamb in a roasting pan. Add mashed tomatoes, onion, olive oil, oregano, salt, pepper, and lemon juice. Combine and make sure lamb is well coated. Cover pan with a lid or aluminum foil.
Bake in the preheated oven for about 3 hours. Remove from the oven and remove aluminum foil; leave oven on.
Add water and orzo directly to the roasting pan. Return to the hot oven and bake until pasta is cooked and very little liquid remains, 30 minutes to 1 hour. Add feta cheese and mix until melted and combined.",https://imagesvc.meredithcorp.io/v3/mm/image?url=https%3A%2F%2Fstatic.onecms.io%2Fwp-content%2Fuploads%2Fsites%2F43%2F2021%2F04%2F02%2F270393_GreekEasterRoastLambandOrzo_005_MFS.jpg,allrecipes.com,,-1
79,Honey Nut Dipped Chicken,patti,560,8 servings,"['¼ cup honey', '2 tablespoons Worcestershire sauce', '2 tablespoons vegetable oil', '1 tablespoon lemon juice', '1 ¼ teaspoons salt', '2 ½ pounds assorted chicken parts, skinned', 'cooking spray', '½ cup crushed corn flakes cereal', '⅓ cup chopped walnuts', '½ teaspoon salt']","Mix honey, Worcestershire sauce, vegetable oil, lemon juice, and salt in a bowl, stirring until salt has dissolved. Place chicken into marinade, turn chicken pieces over to coat, and cover bowl. Marinate chicken in refrigerator for 24 hours, turning once.
Preheat oven to 350 degrees F (175 degrees C). Line a 9x13-inch baking dish with aluminum foil and spray foil with cooking spray.
Mix corn flake crumbs with walnuts and 1/2 teaspoon salt in a shallow bowl. Remove chicken pieces from marinade, discarding the used marinade, and press into crumb mixture to coat. Arrange chicken into prepared baking dish.
Bake in the preheated oven until chicken meat is no longer pink inside, the juices run clear, and chicken is browned, about 1 hour. An instant-read meat thermometer inserted into the thickest piece of chicken should read at least 160 degrees F (70 degrees C).",https://imagesvc.meredithcorp.io/v3/mm/image?url=https%3A%2F%2Fimages.media-allrecipes.com%2Fuserphotos%2F1081705.jpg,allrecipes.com,,4.0
80,Holiday Egg Nog,,,8 serving(s),"['4 eggs', '1 (14 ounce) can EAGLE BRAND® Sweetened Condensed Milk (NOT evaporated milk)', '3 cups milk', '1/2 teaspoon vanilla extract', 'Dash salt', 'Nutmeg']","In large mixer bowl, beat eggs. Gradually beat in remaining ingredients. Chill. Garnish with nutmeg. Refrigerate leftovers.",https://images.media-allrecipes.com/userphotos/250x250/992940.jpg,allrecipes.com,"{'calories': '312 calories;', 'fatContent': '9.7', 'carbohydrateContent': '20.4', 'proteinContent': '8.2', 'cholesterolContent': '118', 'sodiumContent': '191'}",4.13
81,Gluten-Free Cocoa Coconut Cupcakes,intoleranceisbliss,40,15 cupcakes,"['1 cup self-rising gluten-free flour', '½ cup brown sugar', '1 tablespoon brown sugar', '2 tablespoons unsweetened cocoa powder', '1 teaspoon gluten-free baking powder', '3 eggs', '½ cup dairy-free margarine', '2 tablespoons olive oil', '2 tablespoons lactose-free milk', ""2 tablespoons creamed coconut, roughly chopped (such as Patak's®)""]","Preheat oven to 375 degrees F (190 degrees C). Grease 15 muffin cups or line cups with paper liners.
Combine flour, 1/2 cup plus 1 tablespoon brown sugar, cocoa powder, and baking powder in a large bowl. Mix in eggs, margarine, olive oil, and milk until there are no lumps and batter has a thick texture. Stir in chopped creamed coconut.
Spoon batter into the prepared muffin cups, filling each almost to the top.
Bake in the preheated oven until tops spring back when lightly pressed, 20 to 25 minutes.",https://www.allrecipes.com/img/misc/og-default.png,allrecipes.com,,-1
82,Black Forest Braised Pork Chops,,25,4 serving(s),"['2 tablespoons Market Pantry™ Butter', '1 (20 ounce) package boneless pork chops center cut', '1 (8 ounce) package sliced fresh mushrooms', '1/2 cup chopped onion', '1 clove garlic, chopped', '1/2 teaspoon salt', '2 tablespoons flour', '1 cup beer', '2 tablespoons chopped fresh parsley']","Melt butter in a large skillet over medium high heat. Brown both sides of pork chops in butter. Remove chops.
Add mushrooms, onion, garlic and salt to pan. Cook, stirring occasionally for 2 to 3 minutes or until onion has softened. Stir in flour until well mixed. Stir beer into vegetables, mixing well.
Return pork chops and any accumulated juices to pan. Bring to a boil, reduce heat, cover and simmer 7 to 8 minutes or until internal temperature reaches 160 degrees F. Stir in parsley.",https://images.media-allrecipes.com/images/79591.png,allrecipes.com,"{'calories': '334 calories;', 'fatContent': '15.9', 'carbohydrateContent': '9.3', 'proteinContent': '33.4', 'cholesterolContent': '110', 'sodiumContent': '407'}",4.67
83,Crab Spread I,L. Gerken,5,12 to 15 servings,"['1 (8 ounce) package cream cheese, softened', '1 (6 ounce) can crab meat, drained', '1 (12 ounce) jar cocktail sauce', '1 lemon, juiced']","Place cream cheese on large plate. Cover with crabmeat, squeeze juice of one lemon over the crabmeat. Pour cocktail sauce over top of the entire concoction.",https://imagesvc.meredithcorp.io/v3/mm/image?url=https%3A%2F%2Fimages.media-allrecipes.com%2Fuserphotos%2F7742911.jpg,allrecipes.com,,4.36
84,Hot Fudge Sauce II,Erin Nesbit,20,8 servings,"['4 (1 ounce) squares unsweetened chocolate', '1 cup white sugar', '⅛ teaspoon salt', '1 tablespoon butter', '1 cup heavy cream', '½ teaspoon vanilla extract']","Place chocolate in a microwave safe bowl and cook on high 1 to 2 minutes, stirring frequently, until mostly melted. Transfer to a heavy-bottomed saucepan over low heat and stir in sugar, salt and butter. Stir in cream, a little at a time until smooth. Heat through, without boiling, then remove from heat and stir in vanilla. Store in refrigerator.",https://imagesvc.meredithcorp.io/v3/mm/image?url=https%3A%2F%2Fimages.media-allrecipes.com%2Fuserphotos%2F61306.jpg,allrecipes.com,,4.73
85,Farm Mouse Cookies,,30,24 serving(s),"['1 cup creamy peanut butter', '1/2 cup butter or margarine, softened', '1/2 cup sugar', '1/2 cup packed brown sugar', '1 egg', '1 teaspoon vanilla extract', '1 1/2 cups all-purpose flour', '1/2 teaspoon baking soda', 'Peanut halves', 'Black shoestring licorice, cut into 2-1/2-inch pieces']","In a mixing bowl, cream peanut butter, butter and sugars. Beat in egg and vanilla. Combine flour and baking soda; gradually add to creamed mixture. Cover and chill dough for 1 hour or overnight.
Roll into 1-in. balls. Pinch one end, forming a teardrop shape. Place 2 in. apart on ungreased baking sheets; press to flatten. For ears, press two peanuts into each cookie near the pointed end. Using a toothpick, make a 1/2-in.-deep hole for the tail in the end opposite the ears. Bake at 350 degrees F for 8-10 minutes or until golden. While cookies are warm, insert licorice for tails. Cool on wire racks.",https://images.media-allrecipes.com/userphotos/250x250/981976.jpg,allrecipes.com,"{'calories': '192 calories;', 'fatContent': '10.3', 'carbohydrateContent': '21.8', 'proteinContent': '4.4', 'cholesterolContent': '18', 'sodiumContent': '116'}",5.0
86,7UP Cherry Merry Mint Punch,7UP,,25 servings,"['1 quart pineapple sherbet', '1 (2 liter) bottle 7UP® Cherry', ""6 ounces Rose's® Mojito"", '1 cup white rum']","Add the ingredients to 1 gallon punch bowl
Garnish the punch bowl with lemon and lime slices.",https://imagesvc.meredithcorp.io/v3/mm/image?url=https%3A%2F%2Fimages.media-allrecipes.com%2Fuserphotos%2F985927.jpg,allrecipes.com,,4.33
87,Hawaiian Wings,kimmi,65,8 servings,"['¾ cup soy sauce', '⅓ cup white sugar', '4 green onions, chopped', '3 cloves garlic, minced', '2 tablespoons toasted sesame seeds', '2 tablespoons rice wine vinegar', '1 tablespoon sesame oil', '1 teaspoon red pepper flakes, or more to taste', '½ lemon, juiced', '2 pounds small chicken wings', '1 cup all-purpose flour', '2 cups coconut oil']","Combine soy sauce, sugar, green onions, garlic, toasted sesame seeds, rice vinegar, sesame oil, red pepper flakes, and lemon juice in a small saucepan. Bring to a boil and continue to boil briefly, 2 to 3 minutes. Reduce heat to low and keep warm.
Pat chicken dry. Place flour in a shallow dish; dip chicken wings into flour, coating thoroughly. Shake off excess and set aside on a plate.
Heat coconut oil over medium heat in a wok or Dutch oven to 350 degrees F (175 degrees C). Lower 5 to 6 wings one at a time into the hot oil using tongs or a slotted spoon, making sure not to overcrowd or splash hot oil. Cook the wings until browned, crispy, and no longer pink in the centers, 7 to 8 minutes per side.
Transfer cooked wings to the saucepan using tongs; coat wings in sauce and let soak for 3 to 4 minutes. Continue working in batches until all chicken is fried and soaked in sauce. Transfer sauced wings to a plate to drain excess. Serve hot or at room temperature.",https://imagesvc.meredithcorp.io/v3/mm/image?url=https%3A%2F%2Fimages.media-allrecipes.com%2Fuserphotos%2F6855761.jpg,allrecipes.com,,5.0
88,Red Curry Ham Gratin,Allrecipes Allstars,95,8 servings,"['1 ¼ cups whipping cream', '¼ cup Greek yogurt', '2 tablespoons red curry paste', '1 tablespoon honey', '1 pound spiral-sliced ham', '2 ½ cups Yukon gold potatoes, thinly sliced', '1 cup sliced leek', '½ teaspoon salt', '1 teaspoon ground black pepper, divided', '2 cups shredded Monterey Jack cheese', '1 green onion, thinly sliced']","Preheat the oven to 350 degrees F (175 degrees C). Grease a 3-quart baking dish.
Stir together whipping cream, yogurt, curry paste, and honey; pour half into the dish. Arrange ham, potatoes, and leek in an overlapping layer, then top with remaining whipping cream mixture. Sprinkle with salt, 1/2 teaspoon pepper, and cheese.
Bake, covered with aluminum foil, for 40 minutes. Uncover and continue baking until potatoes are tender and top is golden brown, about 20 minutes more. Let stand for 15 minutes. Garnish with remaining black pepper and green onion.",https://imagesvc.meredithcorp.io/v3/mm/image?url=https%3A%2F%2Fimages.media-allrecipes.com%2Fuserphotos%2F5570585.jpg,allrecipes.com,,5.0
89,Holiday Dressing,Louise,165,16 servings,"['1 (7.5 ounce) package dry cornbread mix', '1 cup butter', '2 onions, chopped', '1 green bell pepper, chopped', '6 stalks celery, chopped', '1 pound pork sausage', '16 slices white bread', '2 teaspoons dried sage', '1 teaspoon dried thyme', '1 teaspoon poultry seasoning', '1 teaspoon salt', '½ teaspoon ground black pepper', '½ cup chopped fresh parsley', '2 eggs', '4 cups chicken stock']","Prepare corn bread as directed on package. Cool, and crumble.
Melt butter in a large skillet over medium heat. Cook onions, bell pepper, and celery in butter until tender, but not brown. In another pan, cook sausage over medium-high heat until evenly browned.
Place corn bread and bread slices in a food processor. Pulse until they turn into a crumbly mixture. Transfer mixture to a large bowl. Season with sage, thyme, poultry seasoning, salt, and pepper. Mix in chopped parsley, cooked vegetables, and sausage with drippings. Stir in eggs and chicken stock. This mixture should be a bit mushy. Transfer to a greased 9x13 inch pan.
Bake at 325 degrees F (165 degrees C) for 1 hour.",https://imagesvc.meredithcorp.io/v3/mm/image?url=https%3A%2F%2Fimages.media-allrecipes.com%2Fuserphotos%2F738891.jpg,allrecipes.com,,4.69
90,Baked French Toast with Orange Syrup,,32,4 serving(s),"['Nonstick cooking spray', '2 eggs, slightly beaten', '1 cup reduced fat milk', '1 teaspoon vanilla extract', '1/8 teaspoon ground cinnamon', '8 (1/2-inch-thick) slices French bread', '1/4 teaspoon finely shredded orange peel', '1/2 cup orange juice', '1 tablespoon honey', '1 teaspoon cornstarch', '1/8 teaspoon ground cinnamon', 'Sifted powdered sugar (optional)']","Heat oven to 450 degrees F.
Coat a large baking sheet with cooking spray. In a pie plate combine eggs, LACTAID(R) Reduced Fat Milk, vanilla, and 1/8 teaspoon ground cinnamon. Soak bread slices in egg mixture for about 1 minute per side. Place on prepared baking sheet.
Bake in a 450 degree F oven about 6 minutes or until bread is lightly browned. Turn bread over and bake 5 to 8 minutes more or until slightly puffed.
For orange syrup, stir together orange peel, orange juice, honey, cornstarch, and 1/8 teaspoon cinnamon. Cook and stir until thickened and bubbly. Cook and stir 2 minutes more. Remove from heat.
Sift powdered sugar over toast, if desired. Serve with warm orange syrup.",https://images.media-allrecipes.com/images/79591.png,allrecipes.com,"{'calories': '189 calories;', 'fatContent': '4.3', 'carbohydrateContent': '28.5', 'proteinContent': '8.9', 'cholesterolContent': '98', 'sodiumContent': '257'}",
91,Carrot Cake with Chai-Flavored Cream Cheese Frosting,Kasmira Bresett,120,1 9-inch layer cake,"['2 cups all-purpose flour', '2 ½ teaspoons ground cinnamon', '2 teaspoons baking soda', '½ teaspoon ground nutmeg', '½ teaspoon ground allspice', '½ teaspoon salt', '1 cup lightly packed brown sugar', '¾ cup olive oil', '½ cup applesauce', '½ cup white sugar', '1 ½ teaspoons vanilla extract', '4 large eggs', '3 cups grated carrots', '1 cup raisins', '½ cup unsalted butter', '1 (8 ounce) package cream cheese, softened', '2 teaspoons vanilla extract', '½ teaspoon ground cinnamon', '½ teaspoon ground cardamom', '¼ teaspoon ground ginger', '¼ teaspoon ground nutmeg', '¼ teaspoon ground allspice', '3 ½ cups powdered sugar', '2 tablespoons toasted chopped pecans']","Preheat the oven to 350 degrees F (175 degrees C). Generously grease and flour two 9-inch round cake pans.
Whisk flour, cinnamon, baking soda, nutmeg, allspice, and salt together in a medium bowl.
Whisk brown sugar, oil, applesauce, and white sugar together in a separate bowl. Whisk in eggs, one at a time, until combined. Switch to a large rubber spatula and scrape the sides and bottom of the bowl. Add dry ingredients in 3 parts, gently stirring until incorporated and batter is smooth. Stir in carrots and raisins. Divide batter evenly between the prepared cake pans.
Bake in the preheated oven until the tops of the cakes spring back when lightly touched and a toothpick inserted in the centers comes out clean, 30 to 40 minutes. Remove from the oven and cool in the pans for 15 minutes before turning out onto cooling racks to cool completely, about 30 minutes. If you find that a cake layer is stuck to the bottom of the pan, leave the cake pan upside down and allow gravity to do its thing.
While the cake is cooling, prepare the frosting. Melt butter in a skillet over medium-low heat. Cook, stirring occasionally until lightly browned, about 10 minutes.
Transfer browned butter to a bowl. Add cream cheese and vanilla and beat with an electric mixer until smooth. Mix in cinnamon, cardamom, ginger, nutmeg, and allspice. Add powdered sugar, 1 cup at a time until desired taste and consistency.
Frost cooled cake with cream cheese frosting and toasted pecans.",https://imagesvc.meredithcorp.io/v3/mm/image?url=https%3A%2F%2Fimages.media-allrecipes.com%2Fuserphotos%2F8927564.jpg,allrecipes.com,,-1
92,Beefy Jalapeno Corn Bake,,75,12 serving(s),"['1 pound ground beef', '2 eggs', '1 (14.75 ounce) can cream-style corn', '1 cup milk', '1/2 cup vegetable oil', '1 cup cornmeal', '3 tablespoons all-purpose flour', '1 1/2 teaspoons baking powder', '3/4 teaspoon salt', '4 cups shredded Cheddar cheese, divided', '1 medium onion, chopped', '4 jalapeno peppers, seeded and finely chopped']","In a skillet, cook beef over medium heat until no longer pink; drain and set aside. In a bowl, beat eggs, corn, milk and oil. Combine the cornmeal, flour, baking powder and salt; add to egg mixture and mix well.
Pour half of the batter into a greased 13-in. x 9-in. x 2-in. baking dish. Sprinkle with 2 cups cheese; top with the beef, onion and jalapenos. Sprinkle with remaining cheese; top with remaining batter.
Bake, uncovered, at 350 degrees F for 55-60 minutes or until a toothpick inserted into corn bread topping comes out clean. Serve warm. Refrigerate any leftovers.",https://images.media-allrecipes.com/userphotos/250x250/988389.jpg,allrecipes.com,,4.0
93,Crab Cakes with Red Chili Mayonnaise,,,8 serving(s),"['1 cup mayonnaise', '4 teaspoons chili garlic sauce', '3 1/2 teaspoons fresh lemon juice', '3 tablespoons olive oil', '1/2 cup chopped red bell pepper', '1/2 cup chopped celery', '1/2 cup chopped red onion', '2 tablespoons chopped seeded jalapeno chili', '1 pound crabmeat, coarsely chopped', '1 large egg, beaten to blend', '5 cups fresh breadcrumbs, made from crustless French bread']","Mix mayonnaise, chili-garlic sauce, and 1 1/2 teaspoons lemon juice in small bowl. Cover and refrigerate chili mayonnaise.
Heat 1 tablespoon oil in heavy medium skillet over medium-high heat. Add bell pepper, celery, onion, and jalapeno; saute 3 minutes. Transfer to large bowl. Mix in crab, egg, 1/2 cup chili mayonnaise, and remaining 2 teaspoons lemon juice, then 1 1/2 cups breadcrumbs. Form crab mixture into eight 1/2-inch-thick cakes, using 1/2 cup for each. Dredge cakes in remaining 3 1/2 cups breadcrumbs, turning to coat. Place on baking sheet. Cover and refrigerate at least 1 hour and up to 8 hours.
Heat remaining 2 tablespoons oil in heavy large skillet over medium heat. Working in batches, add crab cakes and cook until golden brown and cooked through, about 4 minutes per side. Transfer to plates. Serve, passing remaining chili mayonnaise separately.",https://images.media-allrecipes.com/images/79591.png,allrecipes.com,"{'calories': '399 calories;', 'fatContent': '29.2', 'carbohydrateContent': '18', 'proteinContent': '16.1', 'cholesterolContent': '77', 'sodiumContent': '691'}",
94,Easy Eggnog Pancakes,Jennifer Buxe Rogers,20,4 servings,"['2 teaspoons vegetable oil, or as needed', '1 cup all-purpose flour', '1 tablespoon white sugar', '1 teaspoon baking powder', '½ teaspoon baking soda', '¼ teaspoon salt', '1 ¼ cups eggnog']","Heat vegetable oil in a griddle or shallow frying pan over medium heat.
Whisk flour, sugar, baking powder, baking soda, and salt together in a bowl; stir eggnog into flour mixture until batter is smooth.
Pour enough batter into the heated griddle to make a 4- to 5-inch circle. Cook until bubbles appear around the edges and bottom is browned, about 5 minutes. Flip and cook until other side is evenly browned, about 5 more minutes. Repeat with remaining batter.",https://imagesvc.meredithcorp.io/v3/mm/image?url=https%3A%2F%2Fimages.media-allrecipes.com%2Fuserphotos%2F4457558.jpg,allrecipes.com,,4.37
95,Shrimp and Catfish Gumbo,STACYLYNN130,90,10 servings,"['¼ cup cooking oil', '1 large onion, chopped', '1 bell pepper, chopped', '2 stalks celery, chopped', '2 cloves garlic, minced', '4 cubes beef bouillon', '6 cups hot water', '1 (28 ounce) can diced tomatoes, undrained', '1 (16 ounce) package frozen sliced okra', '4 cups shrimp, peeled and deveined', '2 teaspoons salt', '¼ teaspoon cayenne pepper', '½ teaspoon dried thyme', '2 bay leaves', '1 teaspoon dry crab boil', '2 pounds catfish fillets, cut into 1 inch pieces']","Warm oil in a skillet over medium heat. Stir in onion, bell pepper, celery, and garlic. Cook until soft, about 10 minutes.
Dissolve bouillon cubes in hot water. Pour into skillet. Stir tomatoes, okra, and shrimp into skillet. Season with salt, cayenne pepper, thyme, bay leaves, and crab boil. Bring to a boil; cover, and simmer 30 minutes.
Place fish in skillet, return to boil; cover, and simmer 15 minutes more. Remove bay leaves, and serve.",https://imagesvc.meredithcorp.io/v3/mm/image?url=https%3A%2F%2Fimages.media-allrecipes.com%2Fuserphotos%2F8052249.jpg,allrecipes.com,,4.5
