,title,authors,total time,yields,ingredients,instructions,images,host,nutrients,ratings
26,KELLOGG'S* RICE KRISPIES* Cherry Fluff Pie,,200,8 serving(s),"['2 tablespoons margarine or butter', '1/4 cup light corn syrup', '1 cup semi-sweet chocolate morsels', ""2 cups KELLOGG'S* RICE KRISPIES* cereal"", '1 (10 ounce) jar maraschino cherries', '1/2 cup low-fat milk', '1 (5.1 ounce) package vanilla instant pudding mix', '1 cup whipped cream or frozen whipped topping thawed']","In 2-quart saucepan, cook margarine, corn syrup and chocolate morsels over low heat, stirring constantly, until smooth and blended. Remove from heat. Add KELLOGG'S* RICE KRISPIES* cereal. Stir until well coated. With back of spoon, press cereal mixture evenly in bottom and up side of 9-inch pie pan coated with cooking spray. Chill.
Drain cherries, reserving liquid. Chop cherries. Set aside. Measure 1/2 cup cherry liquid, discarding remainder.
In large mixing bowl, combine cherry liquid, milk and pudding mix with wire whip, mixing until smooth and combined. Fold in cherries and whipped topping. Spread in chilled crust. Chill 3 hours or over night before serving. Garnish with chocolate curls, if desired.",https://images.media-allrecipes.com/userphotos/250x250/993007.jpg,allrecipes.com,"{'calories': '327 calories;', 'fatContent': '11.6', 'carbohydrateContent': '57.1', 'proteinContent': '2.6', 'cholesterolContent': '1', 'sodiumContent': '368'}",
27,EZ Meatloaf,MISSY MALLOW,75,8 servings,"['2 pounds lean ground beef', '1 (6 ounce) package dry bread stuffing mix', '2 eggs', '1 cup water', '1 onion, chopped', '1 (28 ounce) jar pasta sauce']","Preheat oven to 350 degrees F (175 degrees C).
In a large bowl, combine the ground beef, dry bread stuffing mix, eggs, water and onion. Mix thoroughly.
Shape into 2 small loaves, or 1 large loaf. Put into a 9x13 inch baking dish and cover with pasta sauce.
Bake, uncovered, in the preheated oven for 45 minutes to 1 hour.",https://imagesvc.meredithcorp.io/v3/mm/image?url=https%3A%2F%2Fimages.media-allrecipes.com%2Fuserphotos%2F785546.jpg,allrecipes.com,,4.4
28,Chunky Cheesecake Brownies,bakergirl,55,16 servings,"['1 (8 ounce) package cream cheese, softened', '¼ cup white sugar', '1 egg', '1 cup semisweet chocolate chips', '¼ cup butter', '1 cup semisweet chocolate chips', '½ cup white sugar', '2 eggs', '⅔ cup all-purpose flour', '½ teaspoon baking powder', '¼ teaspoon salt']","Preheat oven to 350 degrees F (175 degrees C). Grease a 9-inch square baking pan.
Combine cream cheese with 1/4 cup sugar and 1 egg in a mixing bowl; beat until smooth. Stir 1 cup chocolate chips into the cream cheese mixture. Set aside.
Fill a saucepan with water and bring to a boil. Turn the heat off, and set a heatproof mixing bowl over the water. In the mixing bowl, combine butter with the remaining cup of chocolate chips; stir until just melted and blended together. Stir in the remaining 1/2 cup sugar and 2 eggs, then sift together flour, baking powder, and salt; stir into chocolate until evenly blended.
Pour half of the batter into the prepared baking pan. Spread the cream cheese mixture over the chocolate layer. Top with remaining chocolate mixture (this doesn't need to completely cover the cream cheese layer). Using a knife, swirl the top chocolate layer into the cream cheese to make a marble pattern.
Bake in preheated oven at 350 degrees F (175 degrees C) for 25 to 30 minutes, or until top is crinkled and edges pull away from sides of the pan. Cool thoroughly. Cut into 12 to 16 squares. Store in the refrigerator or freeze.",https://imagesvc.meredithcorp.io/v3/mm/image?url=https%3A%2F%2Fimages.media-allrecipes.com%2Fuserphotos%2F865377.jpg,allrecipes.com,,4.55
29,Quick Chicken and Noodles,Christine Thompson,,8 servings,"['4 skinless, boneless chicken breasts', '¼ teaspoon garlic powder', '2 cups chicken broth', '½ teaspoon dried basil', '⅛ teaspoon ground black pepper', '2 cups frozen mixed vegetables, thawed', '1 (16 ounce) package wide egg noodles']","In a medium skillet, saute chicken breasts over medium high heat for about 10 minutes, or until browned. If the chicken sticks at all, you can add a little of the broth. When chicken is browned, remove from skillet and cut into 1 inch cubes. Sprinkle with garlic powder.
In the same skillet heat the broth, basil, pepper and vegetables. Bring to a boil. Stir in the uncooked noodles and return the chicken to the skillet. Reduce heat to low. Cover skillet and simmer all together, stirring occasionally, for 10 minutes or until chicken meat is no longer pink and noodles are soft. Serve.",https://imagesvc.meredithcorp.io/v3/mm/image?url=https%3A%2F%2Fimages.media-allrecipes.com%2Fuserphotos%2F2458241.jpg,allrecipes.com,,3.72
30,Great Hot Crab Dip,SHERIMA1,40,12 servings,"['1 (8 ounce) package cream cheese, softened', '¼ pound crabmeat', '1 tablespoon minced onion', '¼ cup mayonnaise', '2 tablespoons cocktail sauce', '½ teaspoon prepared horseradish', '½ cup sliced almonds']","Preheat oven to 350 degrees F (175 degrees C).
In a mixing bowl, combine the softened cream cheese, crabmeat, onion, mayonnaise, cocktail sauce and horseradish. Mix thoroughly.
Place mixture in a small casserole dish. Top mixture with sliced almonds. Bake in a preheated oven for 30 minutes or until bubbly",https://imagesvc.meredithcorp.io/v3/mm/image?url=https%3A%2F%2Fimages.media-allrecipes.com%2Fuserphotos%2F966479.jpg,allrecipes.com,,4.48
31,The Best Meatloaf,DENELLE,80,6 servings,"['½ cup milk', '1 cup soft bread crumbs', '1 ½ pounds ground beef', '1 ¼ teaspoons salt', 'ground black pepper to taste', '1 egg, slightly beaten', '3 tablespoons steak sauce, (e.g. Heinz 57)', '1 onion, chopped', '½ cup diced green bell pepper', '¼ cup steak sauce, or more to taste']","Preheat oven to 350 degrees F (175 degrees C). Lightly grease an 8 1/2 x 4 1/2 inch loaf pan.
Combine milk and soft bread crumbs in a small bowl and allow to soften, about 5 minutes.
In a mixing bowl, combine the ground beef, salt, pepper, egg, 3 tablespoons steak sauce, chopped onion, and green bell pepper. Add bread crumb mixture, and mix with your hands until all ingredients are combined.
Pat the the mixture into the prepared loaf pan. Brush the top with additional steak sauce.
Bake in the preheated oven for 1 hour or until done. Allow to stand 5 minutes before slicing.",https://imagesvc.meredithcorp.io/v3/mm/image?url=https%3A%2F%2Fimages.media-allrecipes.com%2Fuserphotos%2F4558014.jpg,allrecipes.com,,4.55
32,White Bean and Chicken Chili,,,2 serving(s),"['1 tablespoon olive oil', '2 scallions, sliced', '1 clove garlic, minced', '3/4 teaspoon chile powder', '1/2 teaspoon cumin', '1 (15 ounce) can white beans, rinsed', '1/2 (14.5 ounce) can diced tomatoes, drained', '3/4 cup chicken broth', '3/4 cup leftover cooked chicken breast meat, shredded', 'Tabasco sauce to taste (optional)']","In a medium saucepan, heat oil on medium high. Add scallions (saving some greens for garnish) and garlic and saute until golden. Add chile powder and cumin. Saute for 1 minute. Add white beans, tomatoes, and broth. Simmer 15 minutes until liquid is slightly reduced. Stir in chicken and simmer 5 minutes more.
Season with Tabasco and garnish with scallion greens. If desired, serve with baked tortilla chips (recipe no. 13) and low-fat sour cream.",https://images.media-allrecipes.com/images/79591.png,allrecipes.com,,
33,Pistachio Cake,TheRecycleChef,80,16 servings,"['1 (15.25 ounce) package yellow cake mix', '1 cup vegetable oil', '1 cup club soda', '3 eggs', '1 (3 ounce) package instant pistachio pudding mix', '1 ½ cups milk', '1 (3 ounce) package instant pistachio pudding mix', '1 (1.3 ounce) envelope dry whipped topping mix (such as Dream Whip®)']","Preheat oven to 350 degrees F (175 degrees C). Grease and flour a fluted tube pan (such as Bundt®).
Beat cake mix, vegetable oil, club soda, eggs, and 1 package pistachio pudding mix together in a bowl until blended; pour into the prepared pan.
Bake in the preheated oven until a toothpick inserted in the cake comes out clean, 30 to 40 minutes. Turn cake onto a cooling rack and cool completely.
Beat milk, 1 package pistachio pudding mix, and whipped topping mix together in a bowl using an electric mixer on high until frosting forms stiff peaks. Spread frosting on cake.",https://imagesvc.meredithcorp.io/v3/mm/image?url=https%3A%2F%2Fimages.media-allrecipes.com%2Fuserphotos%2F4469525.jpg,allrecipes.com,,4.75
34,Banana Boat,CW Thorn,10,1 banana boat,"['1 banana, halved lengthwise', '4 (1.5 ounce) bars milk chocolate candy', '6 miniature marshmallows']","Lay a square of aluminum foil onto a flat surface. Put the banana halves side-by-side in the center of the foil with the cut-sides facing upwards. Arrange chocolate pieces and marshmallows onto one of the banana halves and sandwich between the two halves. Wrap foil around the banana to secure together.
Place the foil packet directly on the hot coals of your campfire and cook until the chocolate and marshmallow are melted, 2 to 3 minutes.
Remove packet from fire and let cool a few minutes before serving directly from the foil packet.",https://imagesvc.meredithcorp.io/v3/mm/image?url=https%3A%2F%2Fimages.media-allrecipes.com%2Fuserphotos%2F2269147.jpg,allrecipes.com,,3.67
35,Brown Bag-Roasted Asparagus,Tony,35,4 servings,"['1 pound fresh asparagus, trimmed', 'sea salt and ground black pepper to taste', 'brown paper bag', '½ lemon, juiced', '½ lemon, sliced into rounds', '3 tablespoons extra-virgin olive oil, or as needed', '1 bay leaf']","Preheat the oven to 350 degrees F (175 degrees C).
Place asparagus inside the paper bag. Season with salt and pepper and drizzle with lemon juice. Place lemon slices and bay leaf in the bag. Drizzle olive oil all over asparagus and rub some olive oil on the outside of the bag. Close bag tightly and place on a baking sheet.
Roast on the center rack of the preheated oven until asparagus is tender, about 15 minutes. Open the bag carefully, remove and discard bay leaf, and empty onto a serving platter.",https://imagesvc.meredithcorp.io/v3/mm/image?url=https%3A%2F%2Fimages.media-allrecipes.com%2Fuserphotos%2F7756965.jpg,allrecipes.com,,-1
36,Potato Latkes from Simply Potatoes®,Simply Potatoes,25,6 servings,"['1 (20 ounce) package Simply Potatoes® Shredded Hash Browns', ""½ cup Better'n Eggs®"", '⅓ cup whole wheat flour*', '¼ cup finely chopped green onion', '¼ teaspoon ground black pepper', '1 teaspoon salt', '¼ teaspoon baking powder']","In large bowl stir together Simply Potatoes, Better'n Eggs, flour, green onion, pepper, salt, and baking powder.
Heat 1 tablespoon oil in a 12-inch nonstick skillet over medium heat.
Cook 4 latkes at a time: spread 1/4 cup potato mixture for each latke into 3 1/2-inch circles in skillet.
Cook 4 to 5 minutes, turning once. Repeat with remaining potato mixture and add oil to skillet as needed. Season with salt and pepper if desired.",https://imagesvc.meredithcorp.io/v3/mm/image?url=https%3A%2F%2Fimages.media-allrecipes.com%2Fuserphotos%2F990354.jpg,allrecipes.com,,4.33
37,Corned Beef for Sandwiches in a Slow Cooker,Cynthia Cliffen,375,10 servings,"['1 (4 pound) corned beef brisket, seasoning packet discarded', '1 tablespoon whole black peppercorns', '4 whole cloves', '¼ teaspoon cayenne pepper', '1 pinch ground cinnamon', '1 (15 ounce) can dark Irish stout beer (such as Guinness®)', '2 medium heads garlic, cloves separated', '4 leaf (blank)s bay leaves']","Place brisket, fat-side down, into a slow cooker. Cover with hot water and cook on High for 1 hour. Drain and discard water from the slow cooker.
Add peppercorns, cloves, cayenne, and cinnamon to a tea ball or spice bag. Place in the slow cooker with beer, garlic cloves, and bay leaves. Add more water to just cover the brisket.
Cook on Medium for 5 hours. Remove brisket carefully; it will be very tender and may fall apart or break in half. Let meat rest before slicing.",https://imagesvc.meredithcorp.io/v3/mm/image?url=https%3A%2F%2Fimages.media-allrecipes.com%2Fuserphotos%2F3322933.jpg,allrecipes.com,,-1
38,World's Best Queso Dip,Red Gold,12,12 servings,"['1 (10 ounce) can RED GOLD® Petite Diced Tomatoes & Green Chilies', '1 pound pasteurized prepared cheese product, cubed']","Microwave Method: In microwave safe bowl, combine tomatoes and cheese. Microwave on HIGH for 5 minutes or until cheese is melted; stir after 2 minutes; remove from oven and stir to combine.
Conventional Method: In large saucepan, combine tomatoes and cheese. Stir over low heat until cheese melts.",https://imagesvc.meredithcorp.io/v3/mm/image?url=https%3A%2F%2Fimages.media-allrecipes.com%2Fuserphotos%2F4588519.jpg,allrecipes.com,,4.22
39,Sesame Asparagus,,15,4 serving(s),"['1 1/2 teaspoons sesame oil', '1 pound thin asparagus, trimmed and cut diagonally into 1-inch pieces', '1 1/2 teaspoons soy sauce', '1 teaspoon sugar']","Heat oil in a large, nonstick skillet over medium heat. Add asparagus and stir-fry until it begins to soften, 1 1/2 to 2 minutes.
Add soy sauce and stir-fry for 1 minute. Add sugar and stir-fry another 30 seconds. Remove from heat and serve.",https://images.media-allrecipes.com/images/79591.png,allrecipes.com,"{'calories': '44 calories;', 'fatContent': '1.9', 'carbohydrateContent': '5.6', 'proteinContent': '2.6', 'cholesterolContent': '0', 'sodiumContent': '114'}",
40,Honey-Lime Pork Chops,,35,6 serving(s),"['1/2 cup lime juice', '1/2 cup reduced-sodium soy sauce', '2 tablespoons honey', '2 garlic cloves, minced', '6 (4 ounce) boneless pork loin chops', 'SAUCE:', '3/4 cup reduced-sodium chicken broth', '1 garlic clove, minced', '1 1/2 teaspoons honey', '1/2 teaspoon lime juice', '1/8 teaspoon browning sauce', 'Dash pepper', '2 teaspoons cornstarch', '2 tablespoons water']","In a large resealable plastic bag, combine the first four ingredients. Add pork chops. Seal bag and turn to coat; refrigerate for 8 hours or overnight. Drain and discard marinade. Grill chops, covered, over medium heat or broil 4 in. from the heat for 6-7 minutes on each side or until juices run clear.
For sauce, combine the broth, garlic, honey, lime juice, browning sauce and pepper in a small saucepan. Bring to a boil. Combine cornstarch and water until smooth; stir into broth mixture. Return to a boil; cook and stir for 1-2 minutes or until thickened. Serve with pork chops.",https://images.media-allrecipes.com/userphotos/250x250/991608.jpg,allrecipes.com,,4.29
41,Steak and Potato Tacos with Poblano Chilies,Potato Goodness,45,12 servings,"['2 tablespoons olive oil, divided', '1 large onion, sliced', '2 poblano chilies - stemmed, seeded, sliced', '12 ounces white potatoes, quartered lengthwise, cut crosswise into 1/4-inch thick slices', '1 (12 ounce) flank steak', 'Garlic powder', 'Chile powder', '12 (6 inch) corn tortillas', 'Chopped fresh cilantro', 'Pico de gallo and/or hot sauce']","Heat 1/2 tablespoon oil in heavy large non-stick skillet over medium-high heat. Add onion and chilies and saute until tender, about 10 minutes. Transfer onion mixture to bowl (do not wash skillet). Heat 1 tablespoon oil in same skillet over medium-high heat. Add potatoes and saute until golden brown and tender, about 12 minutes. Return onion mixture to skillet with potatoes and keep warm.
Meanwhile, sprinkle both sides of steak generously with garlic powder, chili powder, salt and pepper. Heat remaining 1/2 tablespoon oil in heavy large skillet over medium-high heat. Add steak and cook until browned on both sides, turning once, about 8 minutes total for medium-rare. Transfer steak to cutting board; let rest 5 minutes.
While steak rests, heat tortillas on griddle or over gas flame until warm, turning frequently with tongs.
Thinly slice steak. Top tortillas with steak and potato mixture; sprinkle with cilantro. Serve passing pico de gallo and/or hot sauce separately.",https://imagesvc.meredithcorp.io/v3/mm/image?url=https%3A%2F%2Fimages.media-allrecipes.com%2Fuserphotos%2F3859402.jpg,allrecipes.com,,4.0
42,Green Beans with Tofu and Tahini Dressing,Diana71,20,3 servings,"['¾ pound fresh green beans, trimmed', '¼ (12 ounce) package firm tofu', '1 tablespoon tahini', '1 teaspoon white miso paste', '1 ½ teaspoons soy sauce', '½ teaspoon white sugar', '⅛ teaspoon salt']","Place a steamer insert into a saucepan and fill with water to just below the bottom of the steamer. Bring water to a boil. Add green beans, cover, and steam until tender, 5 to 7 minutes. Drain, allow to cool slightly, and slice on the diagonal. Transfer to a bowl.
Mash tofu with a fork as much as possible. Mix in tahini and miso paste. Season with soy sauce, sugar, and salt. Blend with an immersion blender until it is the consistency of yogurt.
Pour dressing over green beans and mix to combine.",https://imagesvc.meredithcorp.io/v3/mm/image?url=https%3A%2F%2Fimages.media-allrecipes.com%2Fuserphotos%2F8078434.jpg,allrecipes.com,,-1
43,BBQ Sauce for Cheaters,Matt,35,3.5 cups,"['2 (18 ounce) bottles barbeque sauce', '2 (10 ounce) cans diced tomatoes with green chile peppers, drained', '2 ½ tablespoons dark molasses']","In a large saucepan over medium heat, whisk together barbeque sauce, diced tomatoes with green chile peppers and dark molasses. Simmer 30 minutes partially covered, stirring occasionally, until mixture has thickened.",https://imagesvc.meredithcorp.io/v3/mm/image?url=https%3A%2F%2Fimages.media-allrecipes.com%2Fuserphotos%2F4471584.jpg,allrecipes.com,,3.25
44,Oatmeal Sugar Cookies,Robin J.,,4 1/2 dozen,"['1 cup white sugar', '1 cup shortening', '2 eggs', '1 teaspoon vanilla extract', '1 cup rolled oats', '½ cup raisins', '1 ¾ cups all-purpose flour', '1 teaspoon baking soda', '½ teaspoon salt', '½ teaspoon ground cinnamon']","Cream sugar, shortening (may substitute 1/2 cup butter or margarine), eggs and vanilla thoroughly. Mix in remaining ingredients. Refrigerate 4 to 5 hours or overnight.
Preheat oven to 375 degrees F (190 degrees C).
Shape dough by rounded teaspoonfuls into balls. Place on ungreased baking sheet. Flatten with greased bottom of glass dipped in sugar. Bake for 10 minutes.",https://imagesvc.meredithcorp.io/v3/mm/image?url=https%3A%2F%2Fimages.media-allrecipes.com%2Fuserphotos%2F1677162.jpg,allrecipes.com,,4.22
45,Lemon Poppy Seed Puffs,,50,8 serving(s),"['1 (8 ounce) package cream cheese, softened', '1 1/4 cups sugar', '2 teaspoons grated lemon peel', '1 tablespoon lemon juice', '2 tablespoons poppy seed', '1 (16.3 ounce) can Pillsbury® Grands!® Refrigerated Buttermilk Biscuits', '1/2 cup butter, melted']","Heat oven to 375 degrees F. In medium bowl, combine cream cheese, 1/2 cup of the sugar, 1 teaspoon of the lemon peel and lemon juice; mix well. In another medium bowl, combine remaining 3/4 cup sugar, 1 teaspoon lemon peel and poppy seed; mix well.
Separate dough into 8 biscuits. Carefully split side of each biscuit halfway to form opening. Fill each opening with 2 rounded tablespoons cream cheese mixture. Press edges firmly to seal. Dip filled biscuits in melted butter; coat with poppy seed mixture. Place in ungreased jumbo nonstick muffin cups.
Bake at 375 degrees F for 13 to 17 minutes or until puffed and golden brown. Cool 10 minutes. Run knife around edge of each puff to loosen; remove from muffin cups. Serve warm. Store in refrigerator.",https://images.media-allrecipes.com/images/79591.png,allrecipes.com,"{'calories': '521 calories;', 'fatContent': '30.2', 'carbohydrateContent': '56.6', 'proteinContent': '6.6', 'cholesterolContent': '61', 'sodiumContent': '761'}",
46,Lime-Marinated Mahi Mahi,ErikaTC,35,2 servings,"['¾ cup extra-virgin olive oil', '1 clove garlic, minced', '⅛ teaspoon ground black pepper', '½ teaspoon cayenne pepper', '1 pinch salt', '2 tablespoons lime juice', '⅛ teaspoon grated lime zest', '2 (4 ounce) mahi mahi fillets', '2 twists lime zest']","Preheat an outdoor grill for medium heat, and lightly oil the grate.
Whisk the extra-virgin olive oil, minced garlic, black pepper, cayenne pepper, salt, lime juice, and grated lime zest together in a bowl to make the marinade.
Place the mahi mahi fillets in the marinade and turn to coat; allow to marinate at least 15 minutes.
Cook on the preheated grill until the fish flakes easily with a fork and is lightly browned, 3 to 4 minutes per side.
Garnish with the twists of lime zest to serve.",https://imagesvc.meredithcorp.io/v3/mm/image?url=https%3A%2F%2Fimages.media-allrecipes.com%2Fuserphotos%2F6841400.jpg,allrecipes.com,,4.49
47,Cashew Chicken,,50,4 serving(s),"['1 pound boneless skinless chicken breasts, cut into 1-inch cubes', '1 medium onion, chopped', '2 cups frozen broccoli cuts', '1 3/4 cups boiling water', '1 cup uncooked long grain rice', '1 (6 ounce) jar sliced mushrooms, drained', '1 tablespoon chicken bouillon granules', '1/2 teaspoon ground ginger', 'pepper to taste', '3/4 cup salted cashews, divided']","In a large bowl, combine the first nine ingredients. Transfer to a greased shallow 1-1/2-qt. baking dish. Cover and bake at 375 degrees F for 45-55 minutes or until rice is tender and chicken is no longer pink. Stir in 1/2 cup of cashews. Sprinkle with remaining cashews.",https://images.media-allrecipes.com/userphotos/250x250/993218.jpg,allrecipes.com,,2.33
48,Instant Pot® Leek Mashed Potatoes,Bren,55,4 servings,"['1 pound potatoes, peeled and cut into 1-inch cubes', '1 leek, white parts only, quartered lengthwise and finely sliced', '½ teaspoon coarse salt', 'water to cover', '⅓ cup milk, warmed', '2 tablespoons butter', 'salt to taste']","Combine potatoes, leek, and salt in a multi-functional pressure cooker (such as Instant Pot®). Add water to cover, about 2 cups. Close and lock the lid. Select high pressure according to manufacturer's instructions; set timer for 10 minutes. Allow about 10 minutes for pressure to build.
Release pressure using the natural-release method according to manufacturer's instructions, about 10 minutes. Carefully release remaining pressure using the quick-release method, about 5 minutes. Unlock and remove the lid. Drain potatoes well and return them to the pot.
Select Saute function. Toss potatoes until dried and starting to sizzle, about 3 minutes. Add butter; stir until melted. Add milk. Mash potatoes with the back of a wooden spoon for a rustic mash, or run them through a ricer for a smoother mash. Taste and adjust the salt.",https://imagesvc.meredithcorp.io/v3/mm/image?url=https%3A%2F%2Fimages.media-allrecipes.com%2Fuserphotos%2F5948854.jpg,allrecipes.com,,5.0
49,Peach Coffee Cake,David,65,12 servings,"['1 (29 ounce) can sliced peaches, drained and chopped', '¼ cup brown sugar', '½ tablespoon cornstarch', '3 tablespoons vegetable oil', '1 ½ cups all-purpose flour', '1 cup white sugar', '1 tablespoon baking powder', '2 lemons, zested', '2 eggs, lightly beaten', '1 teaspoon vanilla extract', '½ cup vegetable oil', '½ cup orange juice']","Preheat oven to 350 degrees F (175 degrees C). Lightly grease an 8x8 inch baking pan.
In a saucepan over low heat, mix the peaches, brown sugar, cornstarch, and 3 tablespoons vegetable oil. Cook and stir until sugar is melted and mixture is slightly thickened.
In a large bowl, mix the flour, sugar, baking powder, and lemon zest. Stir in eggs, vanilla, 1/2 cup oil, and orange juice. Mix until smooth. Pour 1/2 the batter into the prepared pan. Layer with 1/2 the peach mixture, then with remaining batter. Top with remaining peach mixture.
Bake 45 minutes in the preheated oven, or until a knife inserted in the center comes out clean.",https://imagesvc.meredithcorp.io/v3/mm/image?url=https%3A%2F%2Fimages.media-allrecipes.com%2Fuserphotos%2F1006271.jpg,allrecipes.com,,4.0
50,Cabbage Salad II,MOLSON7,260,7 servings,"['1 small head green cabbage, cored and shredded', '1 carrot, peeled and shredded', '1 small green bell pepper, seeded and chopped', '1 small onion, chopped', '3 tablespoons mayonnaise', '2 tablespoons white vinegar', '1 tablespoon sugar', '¼ teaspoon salt', '4 slices bacon']","In a large bowl, toss together the cabbage, carrot, green pepper and onion. In a small bowl, whisk together the mayonnaise, vinegar, sugar and salt. Pour over the cabbage mixture, and toss to coat. Cover and refrigerate for at least 4 hours, or overnight.
Place the bacon in a large deep skillet. Cook over medium heat until evenly browned, turning occasionally. Drain, cool and crumble. Toss crumbled bacon with salad just before serving.",https://imagesvc.meredithcorp.io/v3/mm/image?url=https%3A%2F%2Fimages.media-allrecipes.com%2Fuserphotos%2F7649318.jpg,allrecipes.com,,4.3
51,Snow Cone Topping,JONAR,3,6 servings,"['1 (4 ounce) packet sweetened tropical punch flavored drink mix powder', '¾ cup water']",Combine drink mix and water in squeeze bottle; seal and shake well to blend. Squeeze over shaved ice.,https://imagesvc.meredithcorp.io/v3/mm/image?url=https%3A%2F%2Fimages.media-allrecipes.com%2Fuserphotos%2F1944189.jpg,allrecipes.com,,4.5
