,title,authors,total time,yields,ingredients,instructions,images,host,nutrients,ratings
52,Broccoli Bacon Salad,GOURMETMOMMY,60,6 servings,"['7 strips bacon, or more to taste', '2 bunches broccoli, cut into florets', '½ cup raisins', '1 cup heavy whipping cream', '⅔ cup white sugar', '1 ½ tablespoons all-purpose flour', '3 tablespoons white vinegar', '1 egg, beaten']","Place bacon in a large skillet and cook over medium-high heat, turning occasionally, until evenly browned, about 10 minutes. Drain bacon slices on paper towels; crumble.
Combine bacon, broccoli, and raisins together in a plastic bowl with a tight-fitting lid.
Combine cream, sugar, and flour together in a skillet over medium heat; cook, whisking constantly, until sugar and flour are dissolved, 2 to 3 minutes. Slowly whisk vinegar into cream mixture until incorporated.
Whisk about 1 tablespoon cream mixture and egg together in a bowl; add about 2 more tablespoons cream mixture until egg starts to warm. Whisk egg mixture into cream mixture in skillet; cook until dressing is thickened, about 5 more minutes.
Fill a large bowl with ice and add water, creating an ice bath. Place skillet in ice bath to cool dressing.
Pour dressing over broccoli mixture. Secure lid on bowl and shake until salad is evenly coated. Refrigerate until chilled, at least 30 minutes.",https://www.allrecipes.com/img/misc/og-default.png,allrecipes.com,,-1
53,Spaghetti Bolognese,Amy Cole,60,6 servings,"['2 pounds lean ground beef', '1 large white onion, diced', '1 large portobello mushroom, diced, or more to taste', '2 (14.5 ounce) cans petite diced tomatoes', '3 (10 ounce) cans condensed tomato soup', '½ cup Worcestershire sauce', '1 ½ tablespoons garlic and herb seasoning blend (such as Mrs. Dash®)', '1 tablespoon lemon juice', '1 tablespoon minced garlic', '¼ cup chili powder', '3 tablespoons Cajun seasoning', '½ teaspoon dried basil', '¼ teaspoon vanilla extract', '¼ teaspoon black pepper', '½ teaspoon salt', '1 (16 ounce) package spaghetti', '1 ½ tablespoons extra-virgin olive oil']","Cook the ground beef in a large pot over high heat, stirring quickly and constantly until completely browned 7 to 10 minutes. Stir the onion into the beef; cook and stir until the onion begins to turn translucent, about 5 minutes more. Drain excess grease from meat mixture. Add the mushroom to the mixture; allow to cook until it begins to soften, 1 to 2 minutes. Pour the diced tomatoes and tomato soup into the pot, stir, reduce heat to medium, and bring the mixture to a simmer.
Add the Worcestershire sauce, garlic and herb seasoning blend, lemon juice, garlic, chili powder, Cajun seasoning, basil, vanilla extract, black pepper, and salt to the mixture, stirring each into the mixture before adding the next. Reduce heat to low and allow the mixture to simmer for 30 minutes.
Bring a large pot of lightly salted water to a rolling boil. Add the spaghetti and olive oil to the pot and cook the pasta at a boil until cooked through yet firm to the bite, about 12 minutes. Drain. Top with the Bolognese sauce to serve.",https://imagesvc.meredithcorp.io/v3/mm/image?url=https%3A%2F%2Fimages.media-allrecipes.com%2Fuserphotos%2F7002567.jpg,allrecipes.com,,3.25
54,Chocolate Oatmeal Stars,,25,18 serving(s),"['2/3 cup shortening', '1 cup sugar', '1 egg', '1 teaspoon vanilla extract', '1/2 teaspoon almond extract', '1 cup semisweet chocolate chips, melted', '1 cup all-purpose flour', '1 teaspoon salt', '1/2 teaspoon baking soda', '1 cup quick-cooking oats', '1 cup flaked coconut, finely chopped', 'Colored sugars or colored sprinkles']","In a mixing bowl, cream shortening and sugar. Beat in egg and extracts. Stir in melted chocolate chips. Combine flour, salt and baking soda; gradually add to the creamed mixture. Stir in oats and coconut. Cover and refrigerate for 2 hours or until easy to handle.
On a lightly floured surface, roll out to 1/8-in. thickness. Cut with a 3-in. star-shaped cookie cutter dipped in flour. Place 1 in. apart on ungreased baking sheets. Sprinkle with colored sugar or nonpareils. Bake at 350 degrees F for 7-9 minutes or until firm. Remove to wire racks to cool.",https://images.media-allrecipes.com/userphotos/250x250/473407.jpg,allrecipes.com,,4.0
55,Curried Beef Stew,,495,6 serving(s),"['2 pounds beef stew meat', '1 small onion, sliced', '1 (15 ounce) can garbanzo beans, drained and rinsed', '1 small red bell pepper, chopped', '1 cup Archer Farms® Indian-inspired simmer sauce', '1 (16 ounce) package Archer Farms frozen steamed rice', '1/2 cup Archer Farms frozen petite peas', '1/4 cup shelled pistachios, chopped']","Layer beef, onion, beans and pepper in 3 1/2- to 4-quart slow cooker. Pour simmer sauce into slow cooker; do not stir.
Cover and cook on Low 8 to 10 hours, or on High 4 to 5 hours, or until beef is tender.
Meanwhile, microwave rice as directed on package.
Just before serving, stir peas into stew. Cover and heat until peas are hot. Spoon stew over rice and sprinkle with pistachios.",https://images.media-allrecipes.com/images/79591.png,allrecipes.com,,
56,Blueberry Salsa,Liz Rosenfeld,15,3 cups,"['2 cups chopped fresh blueberries', '1 cup whole fresh blueberries', '1 tablespoon finely chopped jalapeno pepper', '⅓ cup chopped red onion', '¼ cup chopped red bell pepper', '1 fresh lime, juiced', 'salt to taste']","In a bowl, combine chopped and whole blueberries, jalepeno pepper, onion, red pepper, lime juice, and salt.",https://imagesvc.meredithcorp.io/v3/mm/image?url=https%3A%2F%2Fimages.media-allrecipes.com%2Fuserphotos%2F3709348.jpg,allrecipes.com,,4.07
57,Chicken Veronique,MAGGIEMAEWEST,75,6 servings,"['1 tablespoon olive oil', '1 tablespoon butter, melted', '¼ cup all-purpose flour', '½ teaspoon salt', '2 ½ pounds chicken, cut into pieces', '½ cup orange marmalade', '1 cup chicken stock', '1 tablespoon cornstarch', '3 tablespoons lemon juice', '½ cup green seedless grapes', 'lemon, sliced', 'Italian parsley, chopped']","Preheat oven to 375 degrees F (190 degrees C). Pour olive oil and butter into a 9x13-inch baking dish. With a spatula, spread oil and butter to cover the bottom of the baking dish.
Place the flour, salt, and chicken pieces into a large resealable plastic bag, and shake to coat lightly. Arrange chicken pieces skin-side down in a single layer in the baking dish.
Bake in preheated oven for 20 minutes. Turn chicken pieces and bake 10 minutes. Brush chicken with 1/2 marmalade, and bake until the chicken is golden brown and fork tender, about 10 to 15 minutes. Remove chicken to a serving platter, and keep warm.
Reserve 2 tablespoons of drippings to a saucepan, and place over medium-high heat. Stir in chicken stock. In a small bowl, mix together cornstarch and lemon juice; stir into stock mixture. Bring to a boil, and cook until sauce thickens, 3 to 4 minutes. Stir in remaining marmalade. Stir in grapes, and cook until heated through. Serve sauce over chicken, and garnish with lemon slices and parsley.",https://imagesvc.meredithcorp.io/v3/mm/image?url=https%3A%2F%2Fimages.media-allrecipes.com%2Fuserphotos%2F150673.jpg,allrecipes.com,,4.0
58,Cassata alla Siciliana (Sicilian Cream Tart),Traci,,1 - 9 inch layer cake,"['6 eggs', '½ cup white sugar', '1 ½ tablespoons lemon juice', '1 ½ tablespoons orange zest', '2 tablespoons sherry', '1 cup cake flour', '½ teaspoon salt', '1 ½ pounds ricotta cheese', '6 tablespoons rum', ""½ cup confectioners' sugar"", '2 (1 ounce) squares sweet chocolate, grated', '¼ cup candied cherries, chopped', '½ teaspoon ground cinnamon', '½ cup chopped toasted almonds', '¼ cup butter', ""2 ½ cups confectioners' sugar"", '2 egg whites', '1 teaspoon almond extract', '¼ cup rum', ""¼ cup confectioners' sugar for dusting""]","Preheat oven to 350 degrees F (175 degrees C).
To Make Pan di Spagna (Sponge Cake): Have the following ingredients at room temperature for at least one hour before baking; 6 eggs, lemon juice, orange zest, and sherry.
Separate 6 eggs and set the egg whites aside. Beat egg yolks until thick and lemon colored. Beat in sugar, lemon juice, orange zest, and sherry or 1 teaspoon almond extract. Beat until foamy.
Sift flour 3 times and fold into eggs yolks gently but thoroughly. Beat egg whites until foamy, add salt, and beat until stiff but not dry. Fold into yolks. Pour batter into one ungreased 9 inch spring form pan.
Bake at 350 degrees F (175 degrees C) for 50 to 60 minutes. Test by pressing lightly with finger tip, if cake springs back at once it is done. Leave cake in pan to cool, and invert on a wire rack.
Once cake is completely cool slice into 3 layers and sprinkle layers with rum.
To Make Filling: Crush ricotta very finely with hands or a potato masher, add 1/2 cup confectioner's sugar and beat for about 3 minutes until creamy. Stir in 6 tablespoons rum, grated sweet chocolate, chopped candied cherries, cinnamon and toasted almonds.
Spread ricotta filling over sponge cake layers, using half-inch of filling on each layer. Leave the top and sides of cake plain.
To Make Frosting: Cream butter with 1 cup sifted confectioners' sugar. Beat the 2 egg whites until stiff and gradually beat into the egg whites the remaining 1 1/2 cups confectioners' sugar. Fold egg whites into the butter mixture and add fold in 1 teaspoon almond extract.
Cover sides and top cake evenly with frosting. Store in refrigerator until ready to serve. Serves 10.",https://imagesvc.meredithcorp.io/v3/mm/image?url=https%3A%2F%2Fimages.media-allrecipes.com%2Fuserphotos%2F12233.jpg,allrecipes.com,,3.8
59,Turkey Cutlets with Spicy Eggplant Relish,,30,6 serving(s),"['1 (1 pound) eggplant, cut into 1-inch cubes', '1/4 cup rice vinegar', '2 tablespoons sesame oil, divided', '1 tablespoon finely chopped fresh ginger', '1 tablespoon fish sauce or soy sauce', '1 tablespoon sugar', '1 small red bell pepper, diced', '1 small green bell pepper, diced', '1 red onion, diced', '2 jalapeno peppers, seeded and very finely chopped', '1/3 cup chopped fresh cilantro', '1 1/2 pounds turkey cutlets (about 1/4 inch thick)', 'Salt and freshly ground pepper to taste']","Preheat oven to 400 degrees F. Coat a baking sheet with cooking spray. Spread eggplant on the prepared baking sheet and roast until soft, 10 to 15 minutes.
Combine vinegar, 1 tablespoon oil, ginger, fish sauce or soy sauce and sugar in a large bowl; stir to dissolve sugar. Add red and green peppers, onions, jalapenos, cilantro and the roasted eggplant; toss to combine and set aside.
Season turkey with salt and pepper. Heat 1 1/2 teaspoons oil in a nonstick skillet over medium-high heat. Add half of the turkey and saute until golden brown on the outside and no longer pink in the center, 2 to 3 minutes per side. Transfer to a platter and keep warm.
Add the remaining 1 1/2 teaspoons oil to the pan and cook the remaining turkey in the same manner. Spoon the eggplant relish over the cutlets and serve.",https://images.media-allrecipes.com/images/79591.png,allrecipes.com,"{'calories': '217 calories;', 'fatContent': '5.5', 'carbohydrateContent': '10', 'proteinContent': '31.1', 'cholesterolContent': '82', 'sodiumContent': '238'}",
60,Slow Cooker Blueberry Biscuit Cobbler,K. Nayman,185,6 servings,"['½ cup brown sugar', '1 tablespoon ground cinnamon', '1 (8 ounce) tube buttermilk biscuit dough', '⅓ cup butter, melted', '2 tablespoons all-purpose flour', '1 tablespoon brown sugar', '¼ teaspoon ground cinnamon', '2 pints fresh blueberries, washed']","Lightly grease the inside of a slow cooker.
Mix 1/2 cup brown sugar with 1 tablespoon cinnamon in a small bowl. Cut biscuits into quarters. Dip each biscuit section into the melted butter, then roll in the cinnamon-sugar mixture.
Place sugared biscuit pieces around the sides of the prepared slow cooker, forming a small wall of dough around the edges. Reserve any leftover butter.
Mix 2 tablespoons flour into the leftover butter. Add 1 tablespoon brown sugar and 1/4 teaspoon cinnamon.
Place blueberries in the center of the ring of biscuit pieces. Pour the butter and sugar mixture over the top of the blueberries.
Cook on Low until blueberries are bubbling and biscuit pieces are golden brown, about 2 hours 45 minutes.",https://imagesvc.meredithcorp.io/v3/mm/image?url=https%3A%2F%2Fimages.media-allrecipes.com%2Fuserphotos%2F8577208.jpg,allrecipes.com,,5.0
61,Pork Chops With Red Cabbage,,65,2 serving(s),"['2 boneless pork loin chops, 3/4-inch thick', '1 tablespoon vegetable oil', '1/4 cup water', '1 teaspoon cider vinegar', '3 cups shredded red cabbage', '1/2 cup applesauce', '1/4 cup jellied cranberry sauce', '1/4 teaspoon caraway seeds']","In a skillet, brown the chops in oil; remove and set aside. Add the water, vinegar and cabbage to the drippings; cover and cook over medium-low heat for 10 minutes.
Remove from the heat; stir in the applesauce, cranberry sauce and caraway seeds. Pour into a greased 11-in. x 7-in. x 2-in. baking dish; top with pork chops. Cover and bake a 350 degrees F for 50-60 minutes or until pork is tender.",https://images.media-allrecipes.com/userphotos/250x250/991193.jpg,allrecipes.com,,3.85
62,My Favorite Chicken Salad,SunnyDaysNora,75,6 servings,"['2 cooked skinless, boneless chicken breast halves, cut into cubes', '3 stalks celery, finely diced', '¾ cup chopped pecans', '½ cup mayonnaise', '2 tablespoons minced yellow onion', '1 ½ tablespoons sweet pickle relish', '2 teaspoons prepared mustard', '1 ½ teaspoons ground black pepper', '1 ½ teaspoons minced fresh dill', '1 teaspoon lemon juice', '½ teaspoon white sugar', '½ teaspoon salt', '½ teaspoon garlic powder', '½ teaspoon paprika']","Stir chicken, celery, pecans, mayonnaise, yellow onion, relish, mustard, pepper, dill, lemon juice, sugar, salt, garlic powder, and paprika in a bowl until well combined. Refrigerate at least 1 hour before serving.",https://imagesvc.meredithcorp.io/v3/mm/image?url=https%3A%2F%2Fimages.media-allrecipes.com%2Fuserphotos%2F5261952.jpg,allrecipes.com,,4.8
63,Pepper Vodka Cherry Tomatoes,Cpeltz,65,1 pint tomatoes,"['1 pint ripe cherry tomatoes', '½ cup pepper-flavored vodka', '3 tablespoons sea salt', '1 tablespoon lemon pepper']","Poke 5 or 6 holes with a wooden pick or skewer in each tomato and put in a shallow bowl. Pour vodka over tomatoes. Cover bowl with plastic wrap and marinate until the flavors blend, 1 to 2 hours.
Mix sea salt and lemon pepper in a small bowl; serve with the marinated tomatoes for dipping.",https://imagesvc.meredithcorp.io/v3/mm/image?url=https%3A%2F%2Fimages.media-allrecipes.com%2Fuserphotos%2F2229573.jpg,allrecipes.com,,4.5
64,Shrimp Scampi with Garlic Bread,,75,4 serving(s),"['1 tablespoon lemon zest', '5 tablespoons olive oil', '4 teaspoons chopped fresh oregano leaves', '4 cloves garlic, minced', '1/2 teaspoon ground black pepper', '24 fresh or frozen jumbo shrimp, shelled and deveined', '2 tablespoons lemon juice', '3 tablespoons unsalted butter', '1 (10 ounce) package Pepperidge Farm® Garlic Bread', 'Sprigs fresh oregano leaves']","Stir the lemon zest, 3 tablespoons oil, 1 teaspoon oregano, 2 teaspoons garlic and the black pepper in a shallow nonmetallic dish or a gallon size resealable plastic bag. Add the shrimp and turn to coat. Cover the dish or seal the bag and refrigerate for 30 minutes.
Heat the remaining oil in an 8-inch skillet over medium heat. Add the remaining garlic and cook and stir until tender. Stir in the lemon juice and remaining oregano. Remove the skillet from the heat. Add the butter and stir until the butter is melted. Keep warm.
Prepare the bread according to the package directions. Cut each bread half diagonally into6 (1/2-inch thick) slices.
Heat the broiler. Place the bread slices onto a baking sheet. Broil 7 inches from the heat for 2 minutes or until the bread is toasted on both sides.
Remove the shrimp from the marinade and discard the marinade. Heat the broiler. Place the shrimp on a rack in a broiler pan. Broil the shrimp 6 inches from the heat for 5 minutes or until the shrimp are cooked through,turning the shrimp over once halfway through broiling.
Place the shrimp onto a serving platter. Drizzle with the butter mixture. Serve with the bread. Garnish with the oregano sprigs.",https://images.media-allrecipes.com/userphotos/250x250/991844.jpg,allrecipes.com,"{'calories': '699 calories;', 'fatContent': '39.8', 'carbohydrateContent': '45', 'proteinContent': '41.8', 'cholesterolContent': '343', 'sodiumContent': '813'}",4.57
65,Hot Crab Spread,,105,48 serving(s),"['1 1/2 cups chopped green onions', '6 garlic cloves, minced', '1 tablespoon butter', '1 tablespoon mayonnaise', '8 cups shredded Monterey Jack cheese', '4 (6 ounce) cans crabmeat - drained, flaked and cartilage removed', 'Assorted crackers']","In a skillet, saute onions and garlic in butter until tender. Transfer to a 3-qt. slow cooker; add mayonnaise. Stir in cheese. Cover and cook on low for 30 minutes or until cheese is melted, stirring occasionally.
Stir in crab; cover and cook 1 hour longer or until heated through. Serve spread warm with crackers.",https://images.media-allrecipes.com/userphotos/250x250/985074.jpg,allrecipes.com,,3.0
66,Oven Baked Omelet with Feta and Tomatoes,Christie Paige Moser,55,8 servings,"['8 eggs, beaten', '2 cups milk', '½ teaspoon dried thyme', '1 ½ teaspoons kosher salt', '½ teaspoon pepper', '1 cup fire roasted diced tomatoes, drained', '½ cup crumbled feta cheese with basil and sun-dried tomatoes', '8 ounces Italian bread, cut into bite-size cubes']","Preheat an oven to 350 degrees F (175 degrees C). Butter a deep 9-inch baking dish.
Combine eggs, milk, thyme, salt, and pepper in a large bowl. Whisk until smooth. Stir in tomatoes and feta cheese; pour into prepared baking dish. Scatter bread pieces on top of egg mixture.
Bake in preheated oven until eggs are fully set, 40-50 minutes.",https://imagesvc.meredithcorp.io/v3/mm/image?url=https%3A%2F%2Fimages.media-allrecipes.com%2Fuserphotos%2F3677075.jpg,allrecipes.com,,3.5
67,"Cabbage, Potato, and Tomato Soup",ladykristianna,50,10 servings,"['¼ cup butter or margarine', '1 onion, chopped', '3 potatoes, diced', '3 stalks celery, chopped', '3 cloves garlic, minced', '4 cups water', '2 cubes chicken bouillon', '½ head cabbage, finely chopped', '1 (28 ounce) can whole tomatoes with basil, undrained and chopped', '½ cup ketchup', '1 teaspoon hot sauce', '1 teaspoon Italian seasoning']","Melt the butter in a large pot over medium-high heat. Cook and stir the onion, potatoes, celery, and garlic in the melted butter until the onion and celery are translucent, 5 to 7 minutes. Pour the water over the vegetable mixture; stir the chicken bouillon into the liquid until dissolved. Bring the mixture to a boil; cook at a boil until the potatoes are fork-tender, about 5 minutes.
Stir the cabbage into the boiling liquid. Reduce heat to medium. Add the tomatoes with juices, ketchup, hot sauce, and Italian seasoning; stir to combine. Allow the mixture to simmer until the flavors have a chance to mix, about 15 minutes.",https://imagesvc.meredithcorp.io/v3/mm/image?url=https%3A%2F%2Fimages.media-allrecipes.com%2Fuserphotos%2F1941878.jpg,allrecipes.com,,4.56
68,Honeycomb with Golden Syrup,Nicola,35,1 8-inch cake pan,"['1 cup white sugar', '¼ cup golden syrup', '1 tablespoon baking soda']","Grease an 8-inch square cake pan. Fill a bowl with cold water.
Bring sugar and golden syrup to a boil in a large saucepan over medium heat. Reduce heat and simmer until a small amount of syrup dropped into the water turns brittle, 10 to 15 minutes.
Remove from heat and carefully add baking soda; stir quickly until foaming subsides and mixture turns golden. Pour into prepared cake pan. Cool until set, about 15 minutes. Break into bite-size chunks to serve.",https://imagesvc.meredithcorp.io/v3/mm/image?url=https%3A%2F%2Fimages.media-allrecipes.com%2Fuserphotos%2F6848559.jpg,allrecipes.com,,4.0
69,Texas Pralines,Wendi661,30,56 pralines,"['nonstick cooking spray', '2 cups white sugar', '2 cups light corn syrup', '1 pound butter', '2 cups heavy cream', '2 teaspoons vanilla extract', '8 cups pecans']","Line 2 baking sheets with aluminum foil. Coat with nonstick cooking spray.
In a large saucepan over medium heat, combine sugar and corn syrup. Heat to 250 degrees F (120 degrees C). Remove from heat, and stir in butter until melted. Gradually stir in cream. Return to heat. Cook, stirring constantly, until temperature reaches 242 degrees F (116 degrees C). Remove from heat, and stir in vanilla and pecans.
Drop by spoonful onto prepared pans. Cool completely, then wrap with plastic.",https://imagesvc.meredithcorp.io/v3/mm/image?url=https%3A%2F%2Fimages.media-allrecipes.com%2Fuserphotos%2F2036906.jpg,allrecipes.com,,4.45
70,Brunch-Worthy Air Fryer French Toast,thedailygourmet,20,4 servings,"['⅔ cup butter pecan-flavored coffee creamer', '2 large eggs', '1 pinch salt', '4 slices brioche bread', 'nonstick cooking spray']","Preheat the oven to 200 degrees F (95 degrees C). Preheat an air fryer to 400 degrees F (200 degrees C) for 6 minutes.
Whip together coffee creamer, eggs, and salt in a shallow bowl or deep plate. Dip each slice of brioche into the mixture, shaking off excess.
Spray the air fryer basket with nonstick spray. Working in batches, place bread in the basket, making sure slices do not overlap.
Reduce air fryer to 350 degrees F (175 degrees C) and fry French toast for 7 minutes, flipping at the halfway mark. Repeat with remaining bread.
Keep cooked French toast warm in oven until batches are complete.",https://imagesvc.meredithcorp.io/v3/mm/image?url=https%3A%2F%2Fimages.media-allrecipes.com%2Fuserphotos%2F8977675.jpg,allrecipes.com,,-1
71,Easy Healthy Egg Kulambu,SuzNDannie,40,8 servings,"['2 tablespoons coconut oil', '1 large onion, chopped', '1 tomato, chopped', '2 teaspoons ground cardamom', '2 teaspoons ground coriander', '1 ½ teaspoons ground cinnamon', '1 teaspoon chopped fresh ginger root, or more to taste', '1 teaspoon chopped fresh garlic, or more to taste', '1 teaspoon ground cloves', '1 teaspoon curry powder', '½ teaspoon chili powder', '½ teaspoon ground turmeric', '½ teaspoon ground cumin', '1 cup coconut milk', 'salt to taste', '10 hard-boiled eggs, peeled and halved lengthwise']","Melt coconut oil in a pot over medium heat. Cook and stir onion, tomato, cardamom, coriander, cinnamon, ginger, garlic, cloves, curry powder, chili powder, turmeric, and cumin in hot oil until onions are tender, about 10 minutes. Remove from heat and cool briefly.
Pour onion mixture into a food processor; pulse a few times before leaving on to blend. Puree in batches until smooth.
Return pureed onion mixture to the same pot; add coconut milk. Season mixture with salt to taste, bring to a boil, reduce heat to low, and simmer until flavors combine, about 5 minutes. Stir in eggs; cook until eggs are heated through, about 5 minutes more.",https://imagesvc.meredithcorp.io/v3/mm/image?url=https%3A%2F%2Fimages.media-allrecipes.com%2Fuserphotos%2F6748284.jpg,allrecipes.com,,5.0
72,Olivada,Katie Floyd,5,1 3/4 cups,"['3 cups whole, pitted kalamata olives', '⅓ cup olive oil', '2 cloves garlic']","Place olives and garlic in an electric blender. Add olive oil in a stream while pureeing; process until mixture becomes a thick, but not to smooth paste.",https://imagesvc.meredithcorp.io/v3/mm/image?url=https%3A%2F%2Fimages.media-allrecipes.com%2Fuserphotos%2F14771.jpg,allrecipes.com,,4.13
73,Raspberry Walnut Torte,,55,16 serving(s),"['1 1/2 cups heavy whipping cream', '3 eggs', '1 1/2 cups sugar', '3 teaspoons vanilla extract', '1 3/4 cups all-purpose flour', '1 cup ground walnuts, toasted', '2 teaspoons baking powder', '1/2 teaspoon salt', 'FROSTING:', '1 1/2 cups heavy whipping cream', '1 (8 ounce) package cream cheese, softened', '1 cup sugar', '1/8 teaspoon salt', '1 teaspoon vanilla extract', '1 (12 ounce) jar raspberry preserves']","In a small mixing bowl, beat cream until stiff peaks form; set aside. In a large mixing bowl, beat eggs, sugar and vanilla until thick and lemon-colored. Combine flour, walnuts, baking powder and salt; fold into egg mixture alternately with whipped cream.
Pour into two greased and floured 9-in. round baking pans. Bake at 350 degrees F for 25-30 minutes or until a toothpick comes out clean. Cool for 10 minutes before removing from pans to wire racks to cool completely.
In a small mixing bowl, beat cream until stiff peaks form; set aside. In a large mixing bowl, beat cream cheese, sugar and salt until fluffy. Add vanilla; mix well. Fold in whipped cream.
Split each cake into two layers. Place bottom layer on serving plate; spread with about 1/2 cup frosting. Top with second cake layer; spread with half of the raspberry preserves. Repeat layers. Frost sides of cake with frosting.
Cut a small hole in the corner of a pastry or plastic bag; insert ribbon tip #47. Fill bag with remaining frosting; pipe a lattice design on top of cake. Using star tip #32, pipe stars around top and bottom edges of cake. Store in the refrigerator.",https://images.media-allrecipes.com/userphotos/250x250/992741.jpg,allrecipes.com,,4.64
