,title,authors,total time,yields,ingredients,instructions,images,host,nutrients,ratings
0,Really Easy Steak Marinade,jkergen,10,1 batch for 4 large steaks,"['½ cup Italian salad dressing', '¼ cup barbeque sauce', '3 cloves garlic, minced', '2 tablespoons soya sauce', '2 tablespoons lemon juice', '1 ½ tablespoons steak seasoning', '1 teaspoon seasoned salt', '1 teaspoon onion powder', '½ teaspoon white sugar']","Stir salad dressing, barbeque sauce, garlic, soya sauce, lemon juice, steak seasoning, seasoned salt, onion powder, and sugar in a bowl until the seasonings dissolve into the liquids.",https://imagesvc.meredithcorp.io/v3/mm/image?url=https%3A%2F%2Fimages.media-allrecipes.com%2Fuserphotos%2F3479251.jpg,allrecipes.com,,5.0
1,Johnsonville® Three Cheese Italian Style Chicken Sausage Skillet Pizza,,30,6 serving(s),"['1 (12 inch) pre-baked pizza crust', '1 1/2 cups shredded mozzarella cheese', '1 (14 ounce) jar pizza sauce', '1 (12 ounce) package Johnsonville® Three Cheese Italian Style Chicken Sausage, sliced', '1 (3.5 ounce) package sliced pepperoni']","Top pizza crust with cheese. Bake crust according to package directions. Meanwhile, in a 12-inch skillet, combine the pizza sauce, sausage and pepperoni. Bring to a simmer, stirring occasionally. Reduce heat to low. Cut pizza crust into squares; arrange over sausage mixture in skillet.",https://images.media-allrecipes.com/images/79591.png,allrecipes.com,"{'calories': '505 calories;', 'fatContent': '23.8', 'carbohydrateContent': '43', 'proteinContent': '29.6', 'cholesterolContent': '89', 'sodiumContent': '1734'}",
2,Laurielicious' Garlic Herb Focaccia Bread,Laurie Erlenmeyer,30,1 focaccia bread,"['3 tablespoons extra-virgin olive oil, divided, or to taste', '1 pound fresh pizza dough', '2 tablespoons minced garlic, or more to taste', '1 ½ teaspoons chopped fresh rosemary, or to taste', '1 ½ teaspoons chopped fresh basil, or to taste', '1 ½ teaspoons chopped fresh thyme, or to taste', '1 ½ teaspoons chopped fresh parsley, or to taste', 'salt and ground black pepper to taste']","Preheat oven to 475 degrees F (245 degrees C). Grease a rimmed baking sheet generously with 1 tablespoon olive oil.
Place pizza dough on the baking sheet and stretch to fit in an even layer. Drizzle 2 tablespoons olive oil on top; sprinkle garlic over oil. Spread garlic over the dough with your hands until evenly coated. Sprinkle rosemary, basil, thyme, parsley, salt, and black pepper on top.
Bake in the preheated oven until golden brown, 15 to 25 minutes. Slice into squares and serve.",https://imagesvc.meredithcorp.io/v3/mm/image?url=https%3A%2F%2Fimages.media-allrecipes.com%2Fuserphotos%2F3176226.jpg,allrecipes.com,,5.0
3,Double Chocolate Marble Cake,Carol,,1 -10 inch tube pan,"['6 eggs', '1 cup butter', '1 cup white sugar', '1 cup packed brown sugar', '1 teaspoon vanilla extract', '1 cup sour cream', '2 ½ cups all-purpose flour', '½ cup unsweetened cocoa powder', '¼ teaspoon salt', '1 teaspoon baking soda', '⅓ cup unsweetened cocoa powder', '½ cup white sugar']","Preheat oven to 325 degrees F (165 degrees C). Grease an flour one 10 inch tube pan.
To make marbling mixture: Combine 1/3 cup of the coca and 1/2 cup of the white sugar and mix well.
In a large bowl, beat the egg whites until stiff, and set aside.
In another bowl, cream the butter with 1 cup of the sugar and the brown sugar. Beat in the egg yolks, then the vanilla and sour cream.
In another bowl, stir together the flour, cocoa, salt, and baking soda. Beat into the creamed mixture. Stir about 1/3 of the egg whites into the batter to lighten it and then fold in the rest gently but thoroughly. Spread about 1/4 of the batter into a greased and floured tube pan and sprinkle with about 1/3 of the cocoa-sugar mixture. Continue repeating layers, ending with the batter. With a knife, lightly swirl the batter and cocoa mixture together
Bake at 325 degrees F (175 degrees C) for 1 3/4 hours, or until it tests done with a toothpick. Let cool on a rack. Makes 16 to 20 servings.",https://www.allrecipes.com/img/misc/og-default.png,allrecipes.com,,3.0
4,Mini Lunch Box Pizzas,Spiddysense0000,30,10 mini pizzas,"['¼ cup broccoli florets', '1 (10 ounce) can refrigerated biscuits', '½ cup pizza sauce', '1 cup chopped pepperoni', '¾ cup shredded Italian cheese blend']","Place a steamer insert into a saucepan and fill with water to just below the bottom of the steamer. Bring water to a boil. Add broccoli, cover, and steam until tender, 2 to 6 minutes. Chop broccoli finely.
Preheat the oven to 375 degrees F (190 degrees C).
Press each biscuit into a nonstick muffin cup.
Mix pizza sauce and broccoli together. Spoon 1 tablespoon of the sauce over each biscuit. Top with pepperoni and shredded cheese.
Bake in the preheated oven until golden brown, 10 to 13 minutes.",https://imagesvc.meredithcorp.io/v3/mm/image?url=https%3A%2F%2Fimages.media-allrecipes.com%2Fuserphotos%2F887425.jpg,allrecipes.com,,-1
5,Salad Taverna,SWEET BABOO,23,6 servings,"['8 ounces dry spinach noodles', '⅓ cup olive oil', '3 tablespoons lemon juice', '1 clove garlic, minced', '½ teaspoon green hot pepper sauce', '½ teaspoon anise seed', '½ teaspoon salt', '1 cup ricotta cheese', '2 tomatoes, coarsely chopped', '½ cup sliced black olives']","Bring a large pot of lightly salted water to a boil. Add pasta and cook for 8 to 10 minutes or until al dente; drain.
In a large bowl, whisk together olive oil, lemon juice, garlic, hot pepper sauce, anise seed and salt. Mix in cooked pasta, ricotta cheese, tomatoes, and olives. Cover, and chill.",https://imagesvc.meredithcorp.io/v3/mm/image?url=https%3A%2F%2Fimages.media-allrecipes.com%2Fuserphotos%2F1009039.jpg,allrecipes.com,,3.5
6,Fruit Cocktail Cake,Cyndi,,1 - 9 inch square cake,"['1 cup all-purpose flour', '1 cup white sugar', '1 egg', '1 teaspoon baking soda', '1 teaspoon vanilla extract', '1 (16 ounce) can fruit cocktail', '½ cup packed brown sugar']","Preheat oven to 350 degrees F (175 degrees C). Lightly grease one 9x9 inch square baking pan.
Combine the flour, white sugar, egg, baking soda, vanilla and undrained fruit cocktail. Mix until blended. Pour batter into the prepared pan and sprinkle the top with the brown sugar.
Bake at 350 degrees F (175 degrees C) for 40 minutes or until golden brown and firm.",https://imagesvc.meredithcorp.io/v3/mm/image?url=https%3A%2F%2Fimages.media-allrecipes.com%2Fuserphotos%2F1034479.jpg,allrecipes.com,,4.03
7,Greek Stew,Craig Chandler,100,6 servings,"['1 cooking spray (such as Pam®)', '2 tablespoons olive oil, divided', '2 large onions, cut into 1/2-inch dice', '4 cloves garlic, or more to taste, minced', '8 chicken thighs, or more to taste, trimmed', '2 cups dry white wine', '2 (6.5 ounce) cans tomato sauce', '½ teaspoon ground black pepper', '1 lemon, juiced', '1 drop hot pepper sauce (such as Tabasco®)', '1 pinch ground cinnamon']","Prepare a Dutch oven or large pot with cooking spray. Heat 1 tablespoon olive oil in Dutch oven over medium heat. Cook and stir onion and garlic in hot oil until onion soft and translucent, about 5 minutes. Remove onion mixture to a bowl.
Heat remaining olive oil in the pot again over medium heat. Cook chicken in hot oil, turning a few times, until browned, about 5 minutes.
Pour wine over the chicken; bring to a simmer and cook until chicken is no longer pink in the center, about 15 minutes.
Stir onion mixture, tomato sauce, black pepper, lemon juice, hot pepper sauce, and cinnamon with the simmering chicken; bring to a boil, reduce heat to low, place a cover on the pot, and cook at a simmer until the chicken is easily pulled apart, about 1 hour.",https://imagesvc.meredithcorp.io/v3/mm/image?url=https%3A%2F%2Fimages.media-allrecipes.com%2Fuserphotos%2F2231607.jpg,allrecipes.com,,4.5
8,Upside Down (Maqluba),JustCallMeD,100,6 servings,"['7 cups water', '2 onions, chopped', '1 tablespoon chopped garlic', '1 teaspoon ground cinnamon', '1 teaspoon ground turmeric', '2 teaspoons garam masala', '1 pinch salt and ground black pepper to taste', '2 cups cooking oil', '2 cups lamb meat, cut into small pieces', '1 large eggplant, cut into 3/4-inch slices', '2 zucchini, cut into 1/4-inch slices', '1 cup broccoli', '1 cup cauliflower', '1 ½ cups jasmine rice', '1 (16 ounce) container plain yogurt']","Bring to a boil the water, onion, garlic, cinnamon, turmeric, garam masala, salt, and pepper in a large pot. Add the lamb; reduce the heat to low and simmer 15 to 20 minutes. Separate the lamb from the liquid and set aside. Transfer the liquid to a bowl.
While the lamb mixture simmers, heat the oil in a large, deep skillet over medium heat. Fry the eggplant slices in the hot oil, assuring the pieces do not touch, until brown on both sides; remove to a plate lined with paper towels to drain. Use the same procedure to fry the zucchini and the cauliflower. Cook the broccoli in the oil until hot and remove to a paper towel-lined plate to drain.
Layer the lamb into the bottom of the large pot. Arrange the eggplant, zucchini, broccoli, and cauliflower on top of the lamb in layers. Pour the rice over the meat and vegetables, shaking the pot gently to allow the rice to settle into the dish. Pour the reserved cooking liquid from the lamb over the mixture until it is completely covered. Add water if needed.
Cover the pot and simmer over low heat until the rice is soft and the liquid is absorbed, 30 to 45 minutes. Remove the lid from the pot. Place a large platter over the pot and flip the pot so the dish is ""upside down"" on the platter. Serve with yogurt on the side.",https://imagesvc.meredithcorp.io/v3/mm/image?url=https%3A%2F%2Fimages.media-allrecipes.com%2Fuserphotos%2F285455.jpg,allrecipes.com,,4.25
9,Artichoke and Escargot Over Linguini,Victoria M.H.,60,4 servings,"['1 (8 ounce) package linguine pasta', '2 tablespoons butter', '1 (10 ounce) can artichoke hearts, drained and sliced', '1 (4 ounce) can sliced mushrooms, drained', '1 (7 ounce) can escargot, drained', '3 cloves garlic, chopped', '1 teaspoon dried sage', '1 pinch dried oregano', '¼ cup grated Parmesan cheese']","Bring a large pot of lightly salted water to a boil. Add the linguine, and cook until tender, about 8 minutes.
Melt half of the butter in a skillet over medium heat. Add the mushrooms and artichokes; cook and stir for a few minutes. When the mushrooms start to brown, stir in the garlic, and cook until fragrant and lightly browned.
Stir in the escargot, and season with sage and oregano. Cook for just a few minutes, as the escargot cooks really fast like shrimp. Add about half of the Parmesan cheese, and remove from the heat. Serve over linguine with remaining Parmesan cheese.",https://www.allrecipes.com/img/misc/og-default.png,allrecipes.com,,2.67
10,Sour Cream Pockets,G. Surgener,,4 dozen,"['1 ½ cups all-purpose flour', '½ cup sour cream', '¾ cup butter', '1 (21 ounce) can apple pie filling']","Mix together the flour, sour cream and butter or margarine in a large mixing bowl.
Flour a pastry board and your hands. Make dough into small balls or roll them into 2 inch squares. Add a small amount of pastry filling, any flavor you like. Fold dough diagonally and press together. If you make balls, press a small rim around the outside so the filling does not seep out.
Bake at 350 degrees F (175 degrees C) for 10 minutes and sprinkle on confectioners' sugar. A wonderful gift any time of the year.",https://imagesvc.meredithcorp.io/v3/mm/image?url=https%3A%2F%2Fimages.media-allrecipes.com%2Fuserphotos%2F6181771.jpg,allrecipes.com,,4.33
11,Ginger Noodle Bowl: The Vegan Version,JillyEnFuego,45,4 servings,"['2 tablespoons coconut oil', '2 ½ pounds bok choy, cut into bite-sized pieces', '6 cloves garlic, grated', '1 (3 inch) piece fresh ginger, grated', '3 cups shredded carrots', '2 teaspoons Chinese five-spice powder', '1 teaspoon ground cumin', '12 cups vegetable broth', '2 (2 ounce) packages cellophane noodles', '3 cups fresh bean sprouts', '5 scallions, trimmed and thinly sliced']","Heat coconut oil in a large pot over medium-high heat. Add bok choy; cook and stir until wilted, 3 to 5 minutes. Stir in garlic and ginger; cook until fragrant, about 1 minute. Add carrots, five-spice powder, and cumin.
Pour vegetable broth into the pot. Bring the soup to a boil. Add noodles; reduce heat and simmer until noodles soften, about 3 minutes. Stir in bean sprouts and scallions. Remove soup from heat; let stand until flavors combine, about 5 minutes.",https://imagesvc.meredithcorp.io/v3/mm/image?url=https%3A%2F%2Fimages.media-allrecipes.com%2Fuserphotos%2F4062430.jpg,allrecipes.com,,5.0
12,Jumbo Honey-Roasted Peanut Butter Sandwich Cookies,,70,8 serving(s),"['2 (8 ounce) packages cream cheese, softened', '1/2 cup JIF® Creamy Peanut Butter', '2 tablespoons honey', '1 cup Domino® or C&H® Confectioners Powdered Sugar', ""1 (16.5 ounce) roll Pillsbury® Create 'n Bake® refrigerated peanut butter cookies"", '3/4 cup Fisher® Honey Roasted Dry Roasted Peanuts, coarsely chopped']","In large bowl, beat cream cheese, peanut butter and honey with electric mixer on medium speed until smooth. Add powdered sugar; beat just until smooth. Cover; refrigerate at least 1 hour while baking and cooling cookies.
Heat oven to 350 degrees F. Make cookies as directed on package. Cool completely.
Spread 1/3 cup cream cheese mixture on bottom of 1 cookie; top with another cookie, bottom side down. Press cookies together slightly so cream cheese mixture just extends past edges of cookies. Roll edge of cream cheese mixture in chopped peanuts to generously coat. Repeat with remaining cookies.
Serve immediately, or store in single layer tightly covered in refrigerator up to 4 hours (cookies stored longer become very soft).",https://images.media-allrecipes.com/images/79591.png,allrecipes.com,"{'calories': '698 calories;', 'fatContent': '43.2', 'carbohydrateContent': '61.5', 'proteinContent': '17.2', 'cholesterolContent': '72', 'sodiumContent': '584'}",
13,Cranberry Tart,,50,8 serving(s),"['1 2/3 cups biscuit baking mix', '4 1/2 teaspoons sugar', '1/2 cup water', 'FILLING:', '1 cup sugar', '2 tablespoons biscuit baking mix', '2 1/2 cups fresh or frozen cranberries', '1/3 cup orange juice', '2 tablespoons butter or margarine']","In a bowl, combine biscuit mix, sugar and water. With lightly floured hands, press mixture onto the bottom and up the sides of an ungreased 9-in. fluted tart pan with a removable bottom; set aside.
In a saucepan, combine sugar and biscuit mix. Add the cranberries, orange juice and butter. Cook and stir until mixture comes to a boil. Cook 1-2 minutes longer or until thickened and bubbly. Pour over crust. Bake at 375 degrees F for 30-35 minutes or until crust is golden and filling is bubbly. Cool on a wire rack.",https://images.media-allrecipes.com/images/79591.png,allrecipes.com,,4.0
14,Cranberry Colada,,,5 serving(s),"['1/2 (10 fluid ounce) can frozen BACARDI® Mixers Pina Colada mix', '1/2 cup BACARDI® Rum', '1 cup 100% Cranberry Juice', '5 cups ice', 'Fresh cranberries for garnish']","Blend together BACARDI(R) Mixers Pina Colada mix, BACARDI(R) Rum, cranberry juice and ice for 45 to 60 seconds or until uniform.
Garnish with fresh cranberries.",https://images.media-allrecipes.com/userphotos/250x250/983491.jpg,allrecipes.com,,
15,Strawberry NILLA® Nibbles,,5,1 serving(s),"['4 Reduced Fat NILLA Wafers', '2 tablespoons thawed COOL WHIP LITE Whipped Topping, divided', '2 medium strawberries, halved']","Place wafers in single layer on small dessert plate; top each with 1-1/2 tsp. of the whipped topping and 1 strawberry half.
Serve immediately.",https://images.media-allrecipes.com/images/79591.png,allrecipes.com,,
16,Easy Oven Brown Rice,mom2threelittleones,70,3 cups,"['1 ½ cups brown rice', '1 teaspoon salt', '2 tablespoons butter', '3 cups boiling water']","Preheat oven to 400 degrees F (200 degrees C).
Place rice, salt, and butter in a casserole dish that has a cover. Pour boiling water over rice; stir.
Cover and bake in preheated oven until liquid is absorbed and rice is tender, about 1 hour. Remove from oven, fluff with fork, and serve hot.",https://imagesvc.meredithcorp.io/v3/mm/image?url=https%3A%2F%2Fimages.media-allrecipes.com%2Fuserphotos%2F1954677.jpg,allrecipes.com,,4.75
17,Walnut Pastry Dough,,15,8 serving(s),"['1/2 cup walnuts', '2 cups all-purpose flour', '2 tablespoons granulated sugar', '1 teaspoon salt', '2 tablespoons cold butter, cut into pieces', '3 tablespoons walnut oil', '6 tablespoons cold water, or as needed']","Preheat oven to 350 degrees F.
Spread walnuts in a pie pan and bake for 5 to 7 minutes, or until fragrant. Let cool.
Combine the walnuts, flour, sugar and salt in a food processor; process until the walnuts are finely chopped. Add butter and process until incorporated. Transfer to a large bowl.
Drizzle oil over the flour mixture. Use your fingertips to rub the oil into the mixture. One tablespoon at a time, add water and mix with a fork until dough is crumbly and holds together when pressed.
Divide dough into 2 pieces, 1 slightly larger than the other, and form each into a disk.",https://images.media-allrecipes.com/images/79591.png,allrecipes.com,"{'calories': '245 calories;', 'fatContent': '13.2', 'carbohydrateContent': '28', 'proteinContent': '4.4', 'cholesterolContent': '8', 'sodiumContent': '312'}",
18,Grilled Salmon Sandwiches,,20,4 serving(s),"['8 ounces red or pink salmon, well drained', '1/3 cup finely chopped celery', '2 tablespoons sweet pickle relish, well drained', '1/8 teaspoon ground pepper', '1/4 cup mayonnaise', '8 slices white or Italian bread', '1 egg, beaten', '2/3 cup milk']","In a small bowl, combine first five ingredients. Divide and spread over 4 slices of bread. Top with remaining bread slices and dip each sandwich into combine egg and milk mixture. Brown on a well-greased griddle or skillet on both sides. Serve immediately.",https://images.media-allrecipes.com/userphotos/250x250/977896.jpg,allrecipes.com,,4.08
19,Chef John's Beurre Blanc,Chef John,18,4 servings,"['½ cup dry white wine (such as Sauvignon Blanc)', '2 tablespoons lemon juice', '2 tablespoons heavy cream', '2 teaspoons very finely minced shallots', '4 ounces cold unsalted butter, cut into 1-inch cubes', 'salt to taste', '1 pinch cayenne pepper']","Place wine, lemon juice, cream, shallots, and cream in a saucepan. Bring to a simmer over medium-high heat. Reduce heat to medium, and let simmer until liquid is reduced by about 75%, 4 to 5 minutes. Reduce heat to the lowest setting and whisk in about 2 cubes of butter. Keep butter moving until it melts. When melted, add a few more cubes, whisking continuously so butter emulsifies into the wine/lemon juice mixture.
Continue to add butter, a few cubes at a time until all of it has been incorporated and the sauce has a thick, luxurious texture, 4 to 6 minutes. Remove from heat. Taste for seasonings and add a pinch of salt and cayenne, if desired. Serve immediately.",https://imagesvc.meredithcorp.io/v3/mm/image?url=https%3A%2F%2Fimages.media-allrecipes.com%2Fuserphotos%2F3489936.jpg,allrecipes.com,,4.86
20,Raspberry Ice Cooler,,5,2 serving(s),"['1 (.06 ounce) packet CRYSTAL LIGHT On The Go Drink Mix, Raspberry Ice Flavor', '1 2/3 cups water', '1/3 cup grapefruit juice']","Place drink mix in large measuring cup. Add water and juice; stir until mix is dissolved.
Serve over ice cubes in tall glasses. Garnish with lime wedge.",https://images.media-allrecipes.com/userphotos/250x250/988875.jpg,allrecipes.com,,
21,Pumpkin Soup the Easy Way,Tracy Massalski Ferrazza,505,16 servings,"['1 tablespoon butter', '1 cup chopped onion', '2 teaspoons minced garlic', '2 pounds cubed fully cooked ham', '3 (29 ounce) cans pumpkin puree', '1 (32 ounce) carton chicken broth', '⅔ cup cream', '1 teaspoon fresh thyme', '1 teaspoon ground black pepper', '½ teaspoon fresh rosemary']","Melt the butter in a skillet over medium heat. Cook the onion and garlic in the butter until soft.
Combine the onion, garlic, ham, pumpkin puree, chicken broth, cream, thyme, pepper, and rosemary in a slow cooker set to Low; cook 8 to 10 hours.",https://imagesvc.meredithcorp.io/v3/mm/image?url=https%3A%2F%2Fimages.media-allrecipes.com%2Fuserphotos%2F1939489.jpg,allrecipes.com,,3.76
22,Thanksgiving Turkey with Italian Meat Stuffing,travelrose,390,1 whole stuffed turkey,"['1 pound ground beef', '½ (1 pound) loaf day-old Italian bread', '1 large onion, chopped', '2 large stalks celery with leaves, chopped', '½ cup chopped fresh mushrooms', '4 cloves garlic, chopped, or more to taste', '1 tablespoon chopped fresh flat-leaf parsley', '½ cup freshly shredded Parmesan cheese', '1 large egg', 'salt and ground black pepper to taste', '1 (15 pound) whole turkey, neck and giblets removed', '2 tablespoons olive oil', '2 lemons, cut in half', '2 cloves garlic, chopped, or to taste', '2 teaspoons garlic powder, or to taste', '1 cup water']","Preheat oven to 400 degrees F (200 degrees C).
Place the ground beef into a skillet, and cook and stir the meat until browned and crumbly, breaking it up into chunks as it cooks, about 10 minutes. Drain grease. Place the ground beef into a large mixing bowl.
Tear the bread into rough chunks, and place into a bowl; soak bread in water until moistened, and squeeze the water out of the bread. Crumble the wet bread into the bowl with the ground beef. Mix in the onion, celery, mushrooms, 4 cloves of garlic, flat-leaf parsley, Parmesan cheese, and egg until thoroughly combined. Season with salt and black pepper.
Rinse the turkey, and pat dry with paper towels. Lightly stuff the turkey with the ground beef mixture, and place into a roasting pan with a lid. Rub the turkey with olive oil, squeeze lemons over the turkey, and sprinkle 2 more cloves of garlic, the garlic powder, and more salt and black pepper over the bird.
Roast the turkey uncovered in the preheated oven until the skin is browned, about 45 minutes. Reduce heat to 350 degrees C (175 degrees C), and cover the turkey with the lid. Continue roasting until the juices run clear and an instant-read meat thermometer inserted into the thickest part of a thigh reads 180 degrees F (80 degrees C), about 5 more hours. Baste occasionally. If the bottom of the roasting pan looks dry, pour in water.",https://www.allrecipes.com/img/misc/og-default.png,allrecipes.com,,5.0
23,Angel Hair Pasta and Crab With Alfredo Sauce,,10,4 serving(s),"['1 (9 ounce) package BUITONI® Angel Hair Pasta', '1 (10 ounce) package BUITONI® refrigerated Alfredo Sauce', '8 ounces fresh lump crabmeat or surimi', '1/4 cup shredded Parmesan cheese']","HEAT sauce and crabmeat in medium saucepan until hot; add pasta, heat through. Top with cheese.",https://images.media-allrecipes.com/userphotos/250x250/978858.jpg,allrecipes.com,"{'calories': '462 calories;', 'fatContent': '21.7', 'carbohydrateContent': '41.8', 'proteinContent': '23.2', 'cholesterolContent': '78', 'sodiumContent': '773'}",3.0
24,Salad with Hot Italian Dressing,,15,2 serving(s),"['2 cups torn leaf lettuce', '4 green onions, sliced', '2 radishes, sliced', '1 medium tomato, cut into wedges', '3 bacon strips, diced', '1 teaspoon all-purpose flour', '1/4 cup vinegar', '2 tablespoons water', '2 tablespoons sugar', '3/4 teaspoon dry Italian salad dressing mix']","Arrange the lettuce, onions, radishes and tomato in salad bowls or plates; set aside. In a small skillet, cook bacon until crisp. Remove bacon to paper towels to drain; reserve 1 tablespoon drippings. Add flour to drippings; stir until smooth. Cook over low heat for 3 minutes. Combine vinegar, water, sugar and salad dressing mix; add to skillet. Bring to a boil over medium heat; cook and stir for 2 minutes. Pour over salads. Top with bacon. Serve immediately. Refrigerate leftover dressing for up to 2 weeks.",https://images.media-allrecipes.com/userphotos/250x250/977746.jpg,allrecipes.com,,3.33
25,Pineapple Ham Loaf,nutz,125,1 meatloaf,"['1 ½ pounds ground ham', '1 ½ pounds ground pork', '2 eggs, beaten', '1 cup milk', '¾ cup crushed saltine crackers', '½ teaspoon salt', '½ teaspoon ground black pepper', '¾ cup brown sugar', '¼ cup cider vinegar', '1 teaspoon dry mustard', '1 (8 ounce) can crushed pineapple, drained']","Preheat oven to 350 degrees F (175 degrees C).
Mix ground ham, ground pork, eggs, milk, crackers, salt, and black pepper together in a bowl; form into a loaf. Transfer loaf to a loaf pan.
Mix brown sugar, cider vinegar, and dry mustard together; pour over the loaf.
Bake in preheated oven for 1 hour. Spread pineapple atop the loaf; continue baking until no longer pink in the center, about 45 minutes more. An instant-read thermometer inserted into the center should read at least 160 degrees F (70 degrees C).",https://www.allrecipes.com/img/misc/og-default.png,allrecipes.com,,1.0
