id,conversation_id,created_at,date,time,timezone,user_id,username,name,place,tweet,mentions,urls,photos,replies_count,retweets_count,likes_count,hashtags,cashtags,link,retweet,quote_url,video,near,geo,source,user_rt_id,user_rt,retweet_id,reply_to,retweet_date,translate,trans_src,trans_dest
1241798966871613440,1241777429380620288,1584902919000,2020-03-22,11:48:39,PDT,427579702,dall_ass14,Chicken Wang,,"No, YOU put individuals at risk. Why would you encourage everyone to flock to highly populated areas, already being the busiest in the state, with no foresight social distancing would be regarded. You have to force people. No options. This is on you Kate Brown.","['oregongovbrown', 'corinnchilds']",[],[],1,1,29,[],[],https://twitter.com/Dall_Ass14/status/1241798966871613440,False,,0,,,,,,,"[{'user_id': '427579702', 'username': 'Dall_Ass14'}, {'user_id': '3023272478', 'username': 'OregonGovBrown'}, {'user_id': '54261691', 'username': 'corinnchilds'}]",,,,
1241795173941567488,1241777429380620288,1584902015000,2020-03-22,11:33:35,PDT,628791644,clutchscience,"Jen Phillips, handwashing enthusiast",,We are beyond polite requests. We need decisive action and leadership now.,['oregongovbrown'],[],[],1,2,69,[],[],https://twitter.com/ClutchScience/status/1241795173941567488,False,,0,,,,,,,"[{'user_id': '628791644', 'username': 'ClutchScience'}, {'user_id': '3023272478', 'username': 'OregonGovBrown'}]",,,,
1241789080209215488,1241777429380620288,1584900562000,2020-03-22,11:09:22,PDT,15102242,cjthedj,Claudia Johnson,,It is NOT working. It’s infuriating that some of us do our part and others are thumbing their noses. Stronger action and mandates required. Stat.,['oregongovbrown'],[],[],1,3,45,[],[],https://twitter.com/CJtheDJ/status/1241789080209215488,False,,0,,,,,,,"[{'user_id': '15102242', 'username': 'CJtheDJ'}, {'user_id': '3023272478', 'username': 'OregonGovBrown'}]",,,,
1241788296021209089,1241777429380620288,1584900375000,2020-03-22,11:06:15,PDT,291982516,swimmerm0m3,Lisa Brady,,Asking politely isn’t working. Shut it down now. The mayors are asking you to this. The citizens are asking you to do this. Protecting spring break dollars is going to cost Oregonians way more lives and resources in the long run.,['oregongovbrown'],[],[],1,1,36,[],[],https://twitter.com/Swimmerm0m3/status/1241788296021209089,False,,0,,,,,,,"[{'user_id': '291982516', 'username': 'Swimmerm0m3'}, {'user_id': '3023272478', 'username': 'OregonGovBrown'}]",,,,
1241787795892396032,1241777429380620288,1584900256000,2020-03-22,11:04:16,PDT,28824524,nursemclush,K,,"You are not helping. 
Urging. Asking. It won’t work. 
Please do your job and issue a stay at home order. You are endangering our lives by not doing your job. pic.twitter.com/F8h81fjGtP",['oregongovbrown'],[],['https://pbs.twimg.com/media/ETu3aqDUUAEdo1Q.jpg'],1,4,41,[],[],https://twitter.com/nursemclush/status/1241787795892396032,False,,0,,,,,,,"[{'user_id': '28824524', 'username': 'nursemclush'}, {'user_id': '3023272478', 'username': 'OregonGovBrown'}]",,,,
1241787461279219712,1241777429380620288,1584900176000,2020-03-22,11:02:56,PDT,926990333845446656,b_fentonpdx,B Fenton,,"""Our trails and beaches were packed"".

You told people to go hiking. You said its ok to go outside for recreation. Time to stop being vague and give REAL, specific orders. You cant keep ""urging"" people to stay home. Take action.",['oregongovbrown'],[],[],7,15,214,[],[],https://twitter.com/B_FentonPDX/status/1241787461279219712,False,,0,,,,,,,"[{'user_id': '926990333845446656', 'username': 'B_FentonPDX'}, {'user_id': '3023272478', 'username': 'OregonGovBrown'}]",,,,
1241784096696569857,1241777429380620288,1584899374000,2020-03-22,10:49:34,PDT,1099698008,tebster2,Chris,,Your please are not enough. Use your powers and issue an order. Lives depend on you.,['oregongovbrown'],[],[],0,2,30,[],[],https://twitter.com/Tebster2/status/1241784096696569857,False,,0,,,,,,,"[{'user_id': '1099698008', 'username': 'Tebster2'}, {'user_id': '3023272478', 'username': 'OregonGovBrown'}]",,,,
1241782444610555905,1241777429380620288,1584898980000,2020-03-22,10:43:00,PDT,855231516942622720,pissedoffpaiute,Kat B.,,"You have to use the words SHELTER IN PLACE.
People will die.
Hospitals will overfill.
You have a chance to correct your mistake.
Why are you refusing?",['oregongovbrown'],[],[],1,2,29,[],[],https://twitter.com/PissedoffPaiute/status/1241782444610555905,False,,0,,,,,,,"[{'user_id': '855231516942622720', 'username': 'PissedoffPaiute'}, {'user_id': '3023272478', 'username': 'OregonGovBrown'}]",,,,
1241782348506468352,1241777429380620288,1584898957000,2020-03-22,10:42:37,PDT,1383497353,cgreen1483,Cathy Green,,"I wished you had told them to stay home. I live in Cannon Beach and we  have been flooded. A lot of older people live here, we just have 2 small grocery stores and no hospital. So distressing and disappointing.",['oregongovbrown'],[],[],2,2,83,[],[],https://twitter.com/cgreen1483/status/1241782348506468352,False,,0,,,,,,,"[{'user_id': '1383497353', 'username': 'cgreen1483'}, {'user_id': '3023272478', 'username': 'OregonGovBrown'}]",,,,
1241782061096030208,1241777429380620288,1584898889000,2020-03-22,10:41:29,PDT,14765807,meredithbrooks,MeredithBrooks,,Is there a #shelteringinplace order? Have you put your order for #PPEs for your thousands of #Medicalworkers on the front line? @tedwheeler @Oregonian #oregoncoronavirus @MultCoHealth @haleyjohnsenmus,"['oregongovbrown', 'tedwheeler', 'oregonian', 'multcohealth', 'haleyjohnsenmus']",[],[],1,2,28,"['#shelteringinplace', '#ppes', '#medicalworkers', '#oregoncoronavirus']",[],https://twitter.com/MeredithBrooks/status/1241782061096030208,False,,0,,,,,,,"[{'user_id': '14765807', 'username': 'MeredithBrooks'}, {'user_id': '3023272478', 'username': 'OregonGovBrown'}, {'user_id': '18708561', 'username': 'tedwheeler'}, {'user_id': '2992751', 'username': 'Oregonian'}, {'user_id': '36180193', 'username': 'MultCoHealth'}, {'user_id': '462499443', 'username': 'haleyjohnsenmus'}]",,,,
1241781692685148166,1241777429380620288,1584898801000,2020-03-22,10:40:01,PDT,475328680,michaeleverson1,Michael Everson,,"You don’t ask in a Pandemic, you TELL!

Should have set up roadblocks on all highways leading to coastal towns as early as Friday. What’s been happening at the coast this weekend was entirely predictable to anyone who gave half a glance to the weekend weather forecast. #Covid_19",['oregongovbrown'],[],[],1,4,39,['#covid_19'],[],https://twitter.com/MichaelEverson1/status/1241781692685148166,False,,0,,,,,,,"[{'user_id': '475328680', 'username': 'MichaelEverson1'}, {'user_id': '3023272478', 'username': 'OregonGovBrown'}]",,,,
1241781625601454080,1241777429380620288,1584898785000,2020-03-22,10:39:45,PDT,65830452,giveu2tictacs,The Gal,,You never mandated anything on live TV I believe it was very confusing and not direct enough . You basically said you would be looking for a stay in play order on Monday of we have to go that route,"['oregongovbrown', 'traveloregon']",[],[],0,0,22,[],[],https://twitter.com/giveu2tictacs/status/1241781625601454080,False,,0,,,,,,,"[{'user_id': '65830452', 'username': 'giveu2tictacs'}, {'user_id': '3023272478', 'username': 'OregonGovBrown'}, {'user_id': '14276094', 'username': 'TravelOregon'}]",,,,
1241780980555190272,1241777429380620288,1584898631000,2020-03-22,10:37:11,PDT,833754568236216320,meggiebaer,Megs B,,It’s time for a shelter in place order Governor.,['oregongovbrown'],[],[],0,2,23,[],[],https://twitter.com/MeggieBaer/status/1241780980555190272,False,,0,,,,,,,"[{'user_id': '833754568236216320', 'username': 'MeggieBaer'}, {'user_id': '3023272478', 'username': 'OregonGovBrown'}]",,,,
1241780871452999680,1241777429380620288,1584898605000,2020-03-22,10:36:45,PDT,2311132713,clairewhopaints,Claire Elliott,,This is clearly not working! People will continue to ignore your suggestions until it’s an official order!,['oregongovbrown'],[],[],1,2,43,[],[],https://twitter.com/ClaireWhoPaints/status/1241780871452999680,False,,0,,,,,,,"[{'user_id': '2311132713', 'username': 'ClaireWhoPaints'}, {'user_id': '3023272478', 'username': 'OregonGovBrown'}]",,,,
1241780439880105984,1241777429380620288,1584898502000,2020-03-22,10:35:02,PDT,15122033,dartastic,Jarrett Civelli,,You need to lock the state down now for  of all Oregonians. Suspend rent collection and mortgage collection. This SHOULDN’T BE A HARD DECISION. It’s what needs to be done!,['oregongovbrown'],[],[],1,1,25,[],[],https://twitter.com/Dartastic/status/1241780439880105984,False,,0,,,,,,,"[{'user_id': '15122033', 'username': 'Dartastic'}, {'user_id': '3023272478', 'username': 'OregonGovBrown'}]",,,,
1241779802605883392,1241777429380620288,1584898350000,2020-03-22,10:32:30,PDT,824513142059261957,freewomen4ever,#BoomerMama🐝😁💜,,"You are joking, right? Order #ShelterInPlace or watch the collapse of our healthcare systems in Oregon. 
You are playing with fire. Not sure why, but this is ridiculous.",['oregongovbrown'],[],[],1,5,41,['#shelterinplace'],[],https://twitter.com/freewomen4ever/status/1241779802605883392,False,,0,,,,,,,"[{'user_id': '824513142059261957', 'username': 'freewomen4ever'}, {'user_id': '3023272478', 'username': 'OregonGovBrown'}]",,,,
1241779610376794114,1241777429380620288,1584898304000,2020-03-22,10:31:44,PDT,2344300286,amber3tucker,atucker,,"This is not strong enough. Tell people “the stateof ORis now in a lockdown, Do not leave your home until further notice. Get groceries once a week. Stay home side this is an excutive command. Citations will be issued” now that is clear !! We need your help Gov Brown!",['oregongovbrown'],[],[],6,16,180,[],[],https://twitter.com/amber3tucker/status/1241779610376794114,False,,0,,,,,,,"[{'user_id': '2344300286', 'username': 'amber3tucker'}, {'user_id': '3023272478', 'username': 'OregonGovBrown'}]",,,,
1241779447604248576,1241777429380620288,1584898266000,2020-03-22,10:31:06,PDT,1088507290343202816,pdx_resists,PDX Resists 🆘,,Urging people will not do it. Haven’t you noticed? We need more drastic measures now. #LockdownOregon,['oregongovbrown'],[],[],3,1,34,['#lockdownoregon'],[],https://twitter.com/PDX_Resists/status/1241779447604248576,False,,0,,,,,,,"[{'user_id': '1088507290343202816', 'username': 'PDX_Resists'}, {'user_id': '3023272478', 'username': 'OregonGovBrown'}]",,,,
1241779398329524224,1241777429380620288,1584898254000,2020-03-22,10:30:54,PDT,741272441356324865,mariabe733,Maria becker,,You may have to take the next step! I’m in full support of you taking the steps PORTLAND mayors recommend. Let’s do it and get this over with. Otherwise we’re prolonging the inevitable.some don’t feel rules apply to them unfortunately,['oregongovbrown'],[],[],1,2,49,[],[],https://twitter.com/Mariabe733/status/1241779398329524224,False,,0,,,,,,,"[{'user_id': '741272441356324865', 'username': 'Mariabe733'}, {'user_id': '3023272478', 'username': 'OregonGovBrown'}]",,,,
1241779302774870016,1241777429380620288,1584898231000,2020-03-22,10:30:31,PDT,48247768,lillylane,Susan,,"Do you think they care? Most of us knew what was going to happen, and were hoping our leadership would make the correct decision to close the beaches for now.",['oregongovbrown'],[],[],2,1,19,[],[],https://twitter.com/lillylane/status/1241779302774870016,False,,0,,,,,,,"[{'user_id': '48247768', 'username': 'lillylane'}, {'user_id': '3023272478', 'username': 'OregonGovBrown'}]",,,,
1241778923756634116,1241777429380620288,1584898141000,2020-03-22,10:29:01,PDT,16260213,mdfor911,MDfor911,,"Shut us down Kate!  Stand up as a leader and do the right thing!  If you don’t, I and my colleagues will be endangered more, to say nothing of the difficult decisions re: rationing of care, we’ll have to make. Now is NOT the time to worry about your political career. Be a leader!",['oregongovbrown'],[],[],0,3,82,[],[],https://twitter.com/mdfor911/status/1241778923756634116,False,,0,,,,,,,"[{'user_id': '16260213', 'username': 'mdfor911'}, {'user_id': '3023272478', 'username': 'OregonGovBrown'}]",,,,
1241778871449440257,1241777429380620288,1584898128000,2020-03-22,10:28:48,PDT,2390462455,jordanherron_,Jordan,,You must stop asking politely. It is not working. If you want what is best for Oregon then SHUT IT DOWN.,['oregongovbrown'],[],[],0,2,29,[],[],https://twitter.com/JordanHerron_/status/1241778871449440257,False,,0,,,,,,,"[{'user_id': '2390462455', 'username': 'JordanHerron_'}, {'user_id': '3023272478', 'username': 'OregonGovBrown'}]",,,,
1241778785764003840,1241777429380620288,1584898108000,2020-03-22,10:28:28,PDT,2993999766,erickaleeannxox,ericka forman,,No offense but these warnings aren’t working. People don’t care and aren’t listening. Time to make it a rule LOCK IT DOWN,['oregongovbrown'],[],[],1,2,35,[],[],https://twitter.com/erickaleeannxox/status/1241778785764003840,False,,0,,,,,,,"[{'user_id': '2993999766', 'username': 'erickaleeannxox'}, {'user_id': '3023272478', 'username': 'OregonGovBrown'}]",,,,
1241778704541315072,1241777429380620288,1584898088000,2020-03-22,10:28:08,PDT,55269821,amandavisell,Amanda Visell,,Thank you. Can you make it official and shut this down?,['oregongovbrown'],[],[],1,2,119,[],[],https://twitter.com/amandavisell/status/1241778704541315072,False,,0,,,,,,,"[{'user_id': '55269821', 'username': 'amandavisell'}, {'user_id': '3023272478', 'username': 'OregonGovBrown'}]",,,,
1241778683649589254,1241777429380620288,1584898083000,2020-03-22,10:28:03,PDT,30747709,lindstorian,Dr. Lindsay Stallones Marshall,,Then have the courage to order shelter in place like your colleagues have.,['oregongovbrown'],[],[],1,1,80,[],[],https://twitter.com/lindstorian/status/1241778683649589254,False,,0,,,,,,,"[{'user_id': '30747709', 'username': 'lindstorian'}, {'user_id': '3023272478', 'username': 'OregonGovBrown'}]",,,,
1241778612073828354,1241777429380620288,1584898066000,2020-03-22,10:27:46,PDT,378421285,roguenotary,Feral Internet Matt,,May as well just issue the shelter-in-place. Excessive urging doesn’t seem effective.,"['oregongovbrown', 'sethcotlar']",[],[],2,2,97,[],[],https://twitter.com/RogueNotary/status/1241778612073828354,False,,0,,,,,,,"[{'user_id': '378421285', 'username': 'RogueNotary'}, {'user_id': '3023272478', 'username': 'OregonGovBrown'}, {'user_id': '2477854855', 'username': 'SethCotlar'}]",,,,
1241778608810504192,1241777429380620288,1584898066000,2020-03-22,10:27:46,PDT,1143784525442383872,rigober91412329,Rigoberto,,"You didn’t place a official order on Friday , that’s why people went out!!!!! Place it!!",['oregongovbrown'],[],[],2,6,85,[],[],https://twitter.com/Rigober91412329/status/1241778608810504192,False,,0,,,,,,,"[{'user_id': '1143784525442383872', 'username': 'Rigober91412329'}, {'user_id': '3023272478', 'username': 'OregonGovBrown'}]",,,,
1241778605652201472,1241777429380620288,1584898065000,2020-03-22,10:27:45,PDT,1064812279261085696,sysnootles_,sy something snootles 💛🤍💜🖤,,you're the governor. you can do more than ask nicely.,['oregongovbrown'],[],[],6,12,295,[],[],https://twitter.com/SySnootles_/status/1241778605652201472,False,,0,,,,,,,"[{'user_id': '1064812279261085696', 'username': 'SySnootles_'}, {'user_id': '3023272478', 'username': 'OregonGovBrown'}]",,,,
1241778590783401985,1241777429380620288,1584898061000,2020-03-22,10:27:41,PDT,923302084325261313,maryturnerpdx,Mary Turner,,"This was 100% foreseeable. I’m not understanding the hesitation around making an official shelter in place decree. These are hard times, but you’ve got to lead.",['oregongovbrown'],[],[],13,14,331,[],[],https://twitter.com/MaryTurnerPDX/status/1241778590783401985,False,,0,,,,,,,"[{'user_id': '923302084325261313', 'username': 'MaryTurnerPDX'}, {'user_id': '3023272478', 'username': 'OregonGovBrown'}]",,,,
1241778534353219584,1241777429380620288,1584898048000,2020-03-22,10:27:28,PDT,1366093232,glopezane,Genaro Lopez,,"You won't get very far by ""asking"" people. It needs to be enforced and there needs to be consequences.",['oregongovbrown'],[],[],2,3,69,[],[],https://twitter.com/Glopezane/status/1241778534353219584,False,,0,,,,,,,"[{'user_id': '1366093232', 'username': 'Glopezane'}, {'user_id': '3023272478', 'username': 'OregonGovBrown'}]",,,,
1241778522726600708,1241777429380620288,1584898045000,2020-03-22,10:27:25,PDT,42684355,nitemere11,Meredith Eby,,You need to make it an official order. Asking is just not cutting it. People are not listening.,['oregongovbrown'],[],[],1,1,45,[],[],https://twitter.com/nitemere11/status/1241778522726600708,False,,0,,,,,,,"[{'user_id': '42684355', 'username': 'nitemere11'}, {'user_id': '3023272478', 'username': 'OregonGovBrown'}]",,,,
1241778498634579970,1241777429380620288,1584898039000,2020-03-22,10:27:19,PDT,864239220,southofburnside,Patty,,"What you’re doing isn’t working and you know it because you have to keep saying it.  Make the hard choice and enforce a stay at home/shelter in place order.

Shut.  It.  Down.",['oregongovbrown'],[],[],1,3,57,[],[],https://twitter.com/southofburnside/status/1241778498634579970,False,,0,,,,,,,"[{'user_id': '864239220', 'username': 'southofburnside'}, {'user_id': '3023272478', 'username': 'OregonGovBrown'}]",,,,
1241778488954064896,1241777429380620288,1584898037000,2020-03-22,10:27:17,PDT,4705953757,so_caffeinated,Janis,,"You don’t reduce drunk driving by saying “Don’t drink and get behind the wheel, please?” You reduce it by making it law. 

Shut the state down! Those of us already trying to self-isolate are being put in danger by people and businesses who are not showing caution.",['oregongovbrown'],[],[],2,9,88,[],[],https://twitter.com/so_caffeinated/status/1241778488954064896,False,,0,,,,,,,"[{'user_id': '4705953757', 'username': 'so_caffeinated'}, {'user_id': '3023272478', 'username': 'OregonGovBrown'}]",,,,
1241778237497167873,1241777429380620288,1584897977000,2020-03-22,10:26:17,PDT,223335134,tommyhahs,Tommy Hahs,,"then shut it down! this is a time to lead, please do so.",['oregongovbrown'],[],[],9,18,646,[],[],https://twitter.com/TommyHahs/status/1241778237497167873,False,,0,,,,,,,"[{'user_id': '223335134', 'username': 'TommyHahs'}, {'user_id': '3023272478', 'username': 'OregonGovBrown'}]",,,,
1241778188738424832,1241777429380620288,1584897965000,2020-03-22,10:26:05,PDT,1224790189580505089,tankerdriver2,Tankerdriver,,"You need to order a shelter in place!! It's just like posting a 55 mph sign, most people don't follow the rules. The order needs to be given now, not tomorrow!!",['oregongovbrown'],[],[],9,16,365,[],[],https://twitter.com/Tankerdriver2/status/1241778188738424832,False,,0,,,,,,,"[{'user_id': '1224790189580505089', 'username': 'Tankerdriver2'}, {'user_id': '3023272478', 'username': 'OregonGovBrown'}]",,,,
1241778116999036930,1241777429380620288,1584897948000,2020-03-22,10:25:48,PDT,2358714694,superkylej,SuperKyleJ,,You didn’t issue a order Friday. You shouldn’t but you didn’t and everyone but you saw this coming. Now will you do something?,['oregongovbrown'],[],[],5,9,156,[],[],https://twitter.com/superkylej/status/1241778116999036930,False,,0,,,,,,,"[{'user_id': '2358714694', 'username': 'superkylej'}, {'user_id': '3023272478', 'username': 'OregonGovBrown'}]",,,,
1241778101446512640,1241777429380620288,1584897945000,2020-03-22,10:25:45,PDT,1241568431339528192,yikes_on_bikess,Chandra,,Make it a legal requirement. You are being too nice and too easy.,['oregongovbrown'],[],[],1,3,74,[],[],https://twitter.com/yikes_on_bikess/status/1241778101446512640,False,,0,,,,,,,"[{'user_id': '1241568431339528192', 'username': 'yikes_on_bikess'}, {'user_id': '3023272478', 'username': 'OregonGovBrown'}]",,,,
1241778018671984640,1241777429380620288,1584897925000,2020-03-22,10:25:25,PDT,22701501,pdxhannah,Hannah Carmody,,Why is there no shelter in place order?,['oregongovbrown'],[],[],1,1,44,[],[],https://twitter.com/pdxhannah/status/1241778018671984640,False,,0,,,,,,,"[{'user_id': '22701501', 'username': 'pdxhannah'}, {'user_id': '3023272478', 'username': 'OregonGovBrown'}]",,,,
1241777944285962240,1241777429380620288,1584897907000,2020-03-22,10:25:07,PDT,558997776,halomich2,mich,,They don’t care! Stop asking. There need to be consequences besides catching this damn virus and giving it to others!,['oregongovbrown'],[],[],4,6,132,[],[],https://twitter.com/Halomich2/status/1241777944285962240,False,,0,,,,,,,"[{'user_id': '558997776', 'username': 'Halomich2'}, {'user_id': '3023272478', 'username': 'OregonGovBrown'}]",,,,
1241777887964827655,1241777429380620288,1584897894000,2020-03-22,10:24:54,PDT,77875702,hobofett360,Comrade virus PDX 📈🏥😷🌎🚧🏙️💀⚰️,,"And your not, endangering the entire states population with that Press conference on Friday?
MAKE A DECISION, protect people over capitalism for once, please! 
#ShutItDown",['oregongovbrown'],[],[],1,1,40,['#shutitdown'],[],https://twitter.com/Hobofett360/status/1241777887964827655,False,,0,,,,,,,"[{'user_id': '77875702', 'username': 'Hobofett360'}, {'user_id': '3023272478', 'username': 'OregonGovBrown'}]",,,,
1241777791877574656,1241777429380620288,1584897871000,2020-03-22,10:24:31,PDT,415797038,randymckee31,Randy McKee,,Then do what needs to be done. Be a leader and follow the stay at home and make it a lawful order.,['oregongovbrown'],[],[],9,8,239,[],[],https://twitter.com/RandyMcKee31/status/1241777791877574656,False,,0,,,,,,,"[{'user_id': '415797038', 'username': 'RandyMcKee31'}, {'user_id': '3023272478', 'username': 'OregonGovBrown'}]",,,,
1241777652773433344,1241777429380620288,1584897838000,2020-03-22,10:23:58,PDT,18335521,nathanreid,Nathan Reid,, http://Shelter.In.Place .,['oregongovbrown'],['http://Shelter.In.Place'],[],1,0,20,[],[],https://twitter.com/nathanreid/status/1241777652773433344,False,,0,,,,,,,"[{'user_id': '18335521', 'username': 'nathanreid'}, {'user_id': '3023272478', 'username': 'OregonGovBrown'}]",,,,
1241777432513769472,1241777429380620288,1584897785000,2020-03-22,10:23:05,PDT,3023272478,oregongovbrown,Governor Kate Brown,,"But, these actions are necessary to save lives. Please stay at home. It’s a matter of life or death.",[],[],[],308,193,872,[],[],https://twitter.com/OregonGovBrown/status/1241777432513769472,False,,0,,,,,,,"[{'user_id': '3023272478', 'username': 'OregonGovBrown'}]",,,,
1241777431763021825,1241777429380620288,1584897785000,2020-03-22,10:23:05,PDT,3023272478,oregongovbrown,Governor Kate Brown,,"I know this is difficult for everyone. 

It’s not easy for those who can’t visit their loved ones in nursing homes. 
It’s not easy for those trying to balance work at home with their kids out of school. 
It’s not easy for Oregonians with employers that have closed their doors.",[],[],[],48,111,642,[],[],https://twitter.com/OregonGovBrown/status/1241777431763021825,False,,0,,,,,,,"[{'user_id': '3023272478', 'username': 'OregonGovBrown'}]",,,,
1241777431020625926,1241777429380620288,1584897785000,2020-03-22,10:23:05,PDT,3023272478,oregongovbrown,Governor Kate Brown,,That’s why I have put aggressive social distancing orders in place. But it takes each and everyone of you to comply with them to stop the spread of COVID-19.,[],[],[],91,97,641,[],[],https://twitter.com/OregonGovBrown/status/1241777431020625926,False,,0,,,,,,,"[{'user_id': '3023272478', 'username': 'OregonGovBrown'}]",,,,
1241777430253068288,1241777429380620288,1584897785000,2020-03-22,10:23:05,PDT,3023272478,oregongovbrown,Governor Kate Brown,,"I am urging all Oregonians to stay home. We just have to look to Washington, California, and New York to see the storm that is coming. But we still have time to change its course.",[],[],[],128,175,824,[],[],https://twitter.com/OregonGovBrown/status/1241777430253068288,False,,0,,,,,,,"[{'user_id': '3023272478', 'username': 'OregonGovBrown'}]",,,,
1241773199261663233,1240691834210279424,1584896776000,2020-03-22,10:06:16,PDT,16523905,robbystarbuck,Robby Starbuck,,"Are you ordering Masks and gowns from FEMA? I’m hearing from lots of angry nurses that you aren’t communicating your plan to get them more masks. FEMA has masks now they can send but the state needs to request them. Have you? If so, when did you request them?",['oregongovbrown'],[],[],8,15,54,[],[],https://twitter.com/robbystarbuck/status/1241773199261663233,False,,0,,,,,,,"[{'user_id': '16523905', 'username': 'robbystarbuck'}, {'user_id': '3023272478', 'username': 'OregonGovBrown'}]",,,,
1241583542141718533,1241566080708907010,1584851558000,2020-03-21,21:32:38,PDT,48241974,salemcinema,Salem Cinema,,"The responsible businesses who have closed to keep people from going out are losing money every. single. hour. We will continue to lose EVERYTHING if you don't SHUT IT DOWN. Take care of your communities, Kate!!",['oregongovbrown'],[],[],1,1,11,[],[],https://twitter.com/salemcinema/status/1241583542141718533,False,,0,,,,,,,"[{'user_id': '48241974', 'username': 'salemcinema'}, {'user_id': '3023272478', 'username': 'OregonGovBrown'}]",,,,
1241581681795981312,1241573048458686469,1584851115000,2020-03-21,21:25:15,PDT,15985831,donbrown,Don Brown 💦,, pic.twitter.com/cSC8kV4enw,['oregongovbrown'],[],['https://pbs.twimg.com/media/ETr79UyUwAEpA6w.jpg'],1,5,54,[],[],https://twitter.com/donbrown/status/1241581681795981312,False,,0,,,,,,,"[{'user_id': '15985831', 'username': 'donbrown'}, {'user_id': '3023272478', 'username': 'OregonGovBrown'}]",,,,
1241581367336419328,1241573048458686469,1584851040000,2020-03-21,21:24:00,PDT,93068432,ariellescott00,Arielle,,You can remind people until you’re blue in the face. Without an OFFICIAL ORDER you will continue to have situations like the coast is facing this weekend!,['oregongovbrown'],[],[],0,0,27,[],[],https://twitter.com/Ariellescott00/status/1241581367336419328,False,,0,,,,,,,"[{'user_id': '93068432', 'username': 'Ariellescott00'}, {'user_id': '3023272478', 'username': 'OregonGovBrown'}]",,,,
