id,conversation_id,created_at,date,time,timezone,user_id,username,name,place,tweet,mentions,urls,photos,replies_count,retweets_count,likes_count,hashtags,cashtags,link,retweet,quote_url,video,near,geo,source,user_rt_id,user_rt,retweet_id,reply_to,retweet_date,translate,trans_src,trans_dest
1239961115360190467,1239960157636792325,1584464741000,2020-03-17,10:05:41,PDT,953011591,ulrichangela,Angela Ulrich,,"If you don’t MANDATE this, the majority of people still have to go to work!!  This is where PA social distancing will fail.  This HAS to be MANDATED, please!!",['governortomwolf'],[],[],2,5,69,[],[],https://twitter.com/UlrichAngela/status/1239961115360190467,False,,0,,,,,,,"[{'user_id': '953011591', 'username': 'UlrichAngela'}, {'user_id': '2978837542', 'username': 'GovernorTomWolf'}]",,,,
1239960703622094848,1239960157636792325,1584464643000,2020-03-17,10:04:03,PDT,108800847,unacalle,Calle Affagato,,"It isn’t helpful when you have local legislators social saying “It’s not mandatory, you do you.”",['governortomwolf'],[],[],1,1,25,[],[],https://twitter.com/UnaCalle/status/1239960703622094848,False,,0,,,,,,,"[{'user_id': '108800847', 'username': 'UnaCalle'}, {'user_id': '2978837542', 'username': 'GovernorTomWolf'}]",,,,
1239960673943248896,1239960157636792325,1584464636000,2020-03-17,10:03:56,PDT,790241743312527360,erinkatherine13,Erin 🦋,,Mandate it,['governortomwolf'],[],[],0,4,68,[],[],https://twitter.com/erinkatherine13/status/1239960673943248896,False,,0,,,,,,,"[{'user_id': '790241743312527360', 'username': 'erinkatherine13'}, {'user_id': '2978837542', 'username': 'GovernorTomWolf'}]",,,,
1239911261594402816,1239910361823928320,1584452855000,2020-03-17,06:47:35,PDT,14639205,bustyyorneekaps,Busty Yorneekaps (They/Them),,MANDATE IT! Non-essential businesses are STILL OPEN! Non-essential state employees had their status changed! DO SOMETHING,['governortomwolf'],[],[],2,1,24,[],[],https://twitter.com/bustyyorneekaps/status/1239911261594402816,False,,0,,,,,,,"[{'user_id': '14639205', 'username': 'bustyyorneekaps'}, {'user_id': '2978837542', 'username': 'GovernorTomWolf'}]",,,,
1239910365774970881,1239910361823928320,1584452642000,2020-03-17,06:44:02,PDT,2978837542,governortomwolf,Governor Tom Wolf,,"These mitigation guidelines are in place for the next 14 days, at which point we will re-evaluate.

I encourage everyone to stay home and refrain from nonessential travel. Now is the time to work together to stop the spread of the coronavirus. #COVID19 https://www.governor.pa.gov/newsroom/gov-wolf-puts-statewide-covid-19-mitigation-efforts-in-effect-stresses-need-for-every-pennsylvanian-to-take-action-to-stop-the-spread/ …",[],['https://www.governor.pa.gov/newsroom/gov-wolf-puts-statewide-covid-19-mitigation-efforts-in-effect-stresses-need-for-every-pennsylvanian-to-take-action-to-stop-the-spread/'],[],61,72,154,['#covid19'],[],https://twitter.com/GovernorTomWolf/status/1239910365774970881,False,,0,,,,,,,"[{'user_id': '2978837542', 'username': 'GovernorTomWolf'}]",,,,
1239605731604774915,1239597520197693447,1584380011000,2020-03-16,10:33:31,PDT,409498235,morgdotz,morgan,,"Sadly, I work at a daycare in Lehigh County and have to go to work since you haven’t instructed our counties centers to close yet. Please think of us & close down Lehigh county daycares!!!",['governortomwolf'],[],[],3,1,20,[],[],https://twitter.com/morgdotz/status/1239605731604774915,False,,0,,,,,,,"[{'user_id': '409498235', 'username': 'morgdotz'}, {'user_id': '2978837542', 'username': 'GovernorTomWolf'}]",,,,
1239604721276633090,1239597520197693447,1584379770000,2020-03-16,10:29:30,PDT,14562542,idolette,bean's mom,,"Please shut down the state. People won't stop going out until they can't go out, and we need to curb it while we have the chance.","['governortomwolf', 'pahealthdept']",[],[],4,5,54,[],[],https://twitter.com/idolette/status/1239604721276633090,False,,0,,,,,,,"[{'user_id': '14562542', 'username': 'idolette'}, {'user_id': '2978837542', 'username': 'GovernorTomWolf'}, {'user_id': '3218464527', 'username': 'PAHealthDept'}]",,,,
1239602019196952578,1239597520197693447,1584379126000,2020-03-16,10:18:46,PDT,765902185,lauren_kuntz,Lauren Kuntz,,I’m supposed to go into work unless I have COVID-19 or go without pay. We need you to mandate closures of non essential companies/business,['governortomwolf'],[],[],6,5,62,[],[],https://twitter.com/Lauren_Kuntz/status/1239602019196952578,False,,0,,,,,,,"[{'user_id': '765902185', 'username': 'Lauren_Kuntz'}, {'user_id': '2978837542', 'username': 'GovernorTomWolf'}]",,,,
1239598477358882817,1239597520197693447,1584378282000,2020-03-16,10:04:42,PDT,920743770693488640,aggitatedhippo,AggitatedElephant,,"Hey Gov, my work is making me come in.  I have been sick since Wednesday - I can't get tested because I am not coughing much.  Mild temp of 99.5 consistently, but since it isn't severe I am told to come in to work and I can't get tested, so here I am probably spreading it in PA!",['governortomwolf'],[],[],3,5,26,[],[],https://twitter.com/AggitatedHippo/status/1239598477358882817,False,,0,,,,,,,"[{'user_id': '920743770693488640', 'username': 'AggitatedHippo'}, {'user_id': '2978837542', 'username': 'GovernorTomWolf'}]",,,,
1239597997098446850,1239597520197693447,1584378167000,2020-03-16,10:02:47,PDT,777985758305083393,shellbell_xo,Shelly Splainin’,,Please do a statewide restriction.  No more than a 25 person social gathering & all restaurants only allowed to do take out.,['governortomwolf'],[],[],1,0,29,[],[],https://twitter.com/sheLLbeLL_xo/status/1239597997098446850,False,,0,,,,,,,"[{'user_id': '777985758305083393', 'username': 'sheLLbeLL_xo'}, {'user_id': '2978837542', 'username': 'GovernorTomWolf'}]",,,,
1239517318847365121,1239514247085752320,1584358932000,2020-03-16,04:42:12,PDT,466027635,natalieann_39_,nat,,Please shut down Philadelphia. Many of us have bosses that prioritize profits over our safety. We are denied sick time.,"['governortomwolf', 'pahealthdept']",[],[],0,3,43,[],[],https://twitter.com/NatalieAnn_39_/status/1239517318847365121,False,,0,,,,,,,"[{'user_id': '466027635', 'username': 'NatalieAnn_39_'}, {'user_id': '2978837542', 'username': 'GovernorTomWolf'}, {'user_id': '3218464527', 'username': 'PAHealthDept'}]",,,,
1239516096643956742,1239514247085752320,1584358641000,2020-03-16,04:37:21,PDT,37961225,hendry_hill,HENDRY,,Declaring a state of emergency for the entire state might be the right step at this point.,"['governortomwolf', 'pahealthdept']",[],[],2,3,52,[],[],https://twitter.com/HENDRY_HILL/status/1239516096643956742,False,,0,,,,,,,"[{'user_id': '37961225', 'username': 'HENDRY_HILL'}, {'user_id': '2978837542', 'username': 'GovernorTomWolf'}, {'user_id': '3218464527', 'username': 'PAHealthDept'}]",,,,
1239516010916581377,1239514247085752320,1584358620000,2020-03-16,04:37:00,PDT,631666050,bvenini,Brandon Venini,,But let’s leave Philadelphia with no restrictions... higher populations and higher risk.... makes sense #ShutDownPhilly,"['governortomwolf', 'pahealthdept']",[],[],3,3,28,['#shutdownphilly'],[],https://twitter.com/bvenini/status/1239516010916581377,False,,0,,,,,,,"[{'user_id': '631666050', 'username': 'bvenini'}, {'user_id': '2978837542', 'username': 'GovernorTomWolf'}, {'user_id': '3218464527', 'username': 'PAHealthDept'}]",,,,
1239514814038360072,1239514247085752320,1584358335000,2020-03-16,04:32:15,PDT,3146569514,levibeers,Levi Beers,,"Hey Gov Wolf, I think you are doing a tremendous job looking out for Pennsylvanians during this crisis. The decisions you have to make are not easy, but they have to be made. Thank you for all that you do. Sincerely, an Independent Voter.","['governortomwolf', 'pahealthdept']",[],[],2,2,19,[],[],https://twitter.com/levibeers/status/1239514814038360072,False,,0,,,,,,,"[{'user_id': '3146569514', 'username': 'levibeers'}, {'user_id': '2978837542', 'username': 'GovernorTomWolf'}, {'user_id': '3218464527', 'username': 'PAHealthDept'}]",,,,
1238896081590726663,1238893218873446401,1584210818000,2020-03-14,11:33:38,PDT,3303376005,cinemadarling09,Samantha,,Can you please mandate non-essential retailers to close? I have a shift today at one of them in the area and we’re still open. I doubt they will close unless forced.,"['governortomwolf', 'pahealthdept', 'pemahq']",[],[],1,3,27,[],[],https://twitter.com/cinemadarling09/status/1238896081590726663,False,,0,,,,,,,"[{'user_id': '3303376005', 'username': 'cinemadarling09'}, {'user_id': '2978837542', 'username': 'GovernorTomWolf'}, {'user_id': '3218464527', 'username': 'PAHealthDept'}, {'user_id': '2435689370', 'username': 'PEMAHQ'}]",,,,
1238894918065696769,1238893218873446401,1584210540000,2020-03-14,11:29:00,PDT,386666805,susanehowells,Sue Howells,,Why aren’t you mandating non-essential businesses to close if you feel it is so important?,"['governortomwolf', 'pahealthdept', 'pemahq']",[],[],6,2,28,[],[],https://twitter.com/susanehowells/status/1238894918065696769,False,,0,,,,,,,"[{'user_id': '386666805', 'username': 'susanehowells'}, {'user_id': '2978837542', 'username': 'GovernorTomWolf'}, {'user_id': '3218464527', 'username': 'PAHealthDept'}, {'user_id': '2435689370', 'username': 'PEMAHQ'}]",,,,
1238894828412338179,1238893218873446401,1584210519000,2020-03-14,11:28:39,PDT,915296299741827075,waggledetails9,Valerie carr,,What about sole proprietors who don't get unemployment or sick pay? If we don't work. we don't get paid...so we're screwed! I own a pet sitting/dog walking business and I'm it..all of my clients cancelled because they are working from home (and they are getting paid),"['governortomwolf', 'rephoulahan']",[],[],3,1,21,[],[],https://twitter.com/Waggledetails9/status/1238894828412338179,False,,0,,,,,,,"[{'user_id': '915296299741827075', 'username': 'Waggledetails9'}, {'user_id': '2978837542', 'username': 'GovernorTomWolf'}, {'user_id': '1052896620797460481', 'username': 'RepHoulahan'}]",,,,
1238893876452167681,1238893218873446401,1584210292000,2020-03-14,11:24:52,PDT,410822650,jfarrell16,Joe Farrell,,Do beer distributors count as essential?,"['governortomwolf', 'pahealthdept', 'pemahq']",[],[],6,2,57,[],[],https://twitter.com/jfarrell16/status/1238893876452167681,False,,0,,,,,,,"[{'user_id': '410822650', 'username': 'jfarrell16'}, {'user_id': '2978837542', 'username': 'GovernorTomWolf'}, {'user_id': '3218464527', 'username': 'PAHealthDept'}, {'user_id': '2435689370', 'username': 'PEMAHQ'}]",,,,
1238893398200901633,1238893218873446401,1584210178000,2020-03-14,11:22:58,PDT,371565716,breezely1462,Ellen McGrath Smith,,Please do this throughout the state.,"['governortomwolf', 'pahealthdept', 'pemahq']",[],[],1,1,34,[],[],https://twitter.com/breezely1462/status/1238893398200901633,False,,0,,,,,,,"[{'user_id': '371565716', 'username': 'breezely1462'}, {'user_id': '2978837542', 'username': 'GovernorTomWolf'}, {'user_id': '3218464527', 'username': 'PAHealthDept'}, {'user_id': '2435689370', 'username': 'PEMAHQ'}]",,,,
1238893223193575425,1238893218873446401,1584210136000,2020-03-14,11:22:16,PDT,2978837542,governortomwolf,Governor Tom Wolf,,"I’m joined by @RepHoulahan to urge business owners in Montgomery, Delaware, Chester, and Bucks counties to close to protect the well-being of their employees.
 
Get all the latest #COVID19 information:  http://on.pa.gov/coronavirus . pic.twitter.com/d5nsFhO3Qh",['rephoulahan'],['http://on.pa.gov/coronavirus'],['https://pbs.twimg.com/media/ETFurdpXkAIjf1C.jpg'],50,80,158,['#covid19'],[],https://twitter.com/GovernorTomWolf/status/1238893223193575425,False,,0,,,,,,,"[{'user_id': '2978837542', 'username': 'GovernorTomWolf'}, {'user_id': '1052896620797460481', 'username': 'RepHoulahan'}]",,,,
1238607289839423490,1238607286177878017,1584141964000,2020-03-13,16:26:04,PDT,2978837542,governortomwolf,Governor Tom Wolf,,"We’ll continue to monitor this situation as it unfolds, and will announce more efforts like this in other counties as needed.
 
Stay calm and stay home if you can. We 𝙘𝙖𝙣 help control the spread of #COVID19. And that will ultimately save lives.",[],[],[],15,11,87,['#covid19'],[],https://twitter.com/GovernorTomWolf/status/1238607289839423490,False,,0,,,,,,,"[{'user_id': '2978837542', 'username': 'GovernorTomWolf'}]",,,,
1238607288346324992,1238607286177878017,1584141964000,2020-03-13,16:26:04,PDT,2978837542,governortomwolf,Governor Tom Wolf,,"Earlier today I announced the closure of ALL Pennsylvania schools starting Monday.
 
In Montgomery + Delaware counties, we also are closing state government offices and prohibiting visitors from senior care and long-term care facilities. #COVID19",[],[],[],18,26,114,['#covid19'],[],https://twitter.com/GovernorTomWolf/status/1238607288346324992,False,,0,,,,,,,"[{'user_id': '2978837542', 'username': 'GovernorTomWolf'}]",,,,
1238435919000154112,1238432490932625409,1584101106000,2020-03-13,05:05:06,PDT,23509102,monkeyjunkie22,jrsygrlinpa,,"More than 250 in schools, kids, teachers, administrators, exposed and community spread reality, we need to get ahead of this now before it's too late #CloseTheSchools",['governortomwolf'],[],[],0,1,38,['#closetheschools'],[],https://twitter.com/MonkeyJunkie22/status/1238435919000154112,False,,0,,,,,,,"[{'user_id': '23509102', 'username': 'MonkeyJunkie22'}, {'user_id': '2978837542', 'username': 'GovernorTomWolf'}]",,,,
1238434081433686017,1238432490932625409,1584100668000,2020-03-13,04:57:48,PDT,22901061,thedude9737,Chris H,,Schools and casinos aren’t considered large gatherings?,['governortomwolf'],[],[],2,1,41,[],[],https://twitter.com/TheDude9737/status/1238434081433686017,False,,0,,,,,,,"[{'user_id': '22901061', 'username': 'TheDude9737'}, {'user_id': '2978837542', 'username': 'GovernorTomWolf'}]",,,,
1238433961363345409,1238432490932625409,1584100640000,2020-03-13,04:57:20,PDT,708296532009885698,theladyhowe,Lady Howe,,Please close the schools!,['governortomwolf'],[],[],0,1,40,[],[],https://twitter.com/TheLadyHowe/status/1238433961363345409,False,,0,,,,,,,"[{'user_id': '708296532009885698', 'username': 'TheLadyHowe'}, {'user_id': '2978837542', 'username': 'GovernorTomWolf'}]",,,,
1238433895827324929,1238432490932625409,1584100624000,2020-03-13,04:57:04,PDT,28156495,snealmade,Shani Neal,,Then I am most certainly keeping my child home from school. There are far more than 250 people in that building. Thanks.,['governortomwolf'],[],[],2,1,27,[],[],https://twitter.com/SNEALMade/status/1238433895827324929,False,,0,,,,,,,"[{'user_id': '28156495', 'username': 'SNEALMade'}, {'user_id': '2978837542', 'username': 'GovernorTomWolf'}]",,,,
1238433808971636736,1238432490932625409,1584100603000,2020-03-13,04:56:43,PDT,735089743428497409,amellisonmiller,Anne Marie Ellison Miller,,"Governor, the schools.",['governortomwolf'],[],[],0,2,41,[],[],https://twitter.com/amellisonmiller/status/1238433808971636736,False,,0,,,,,,,"[{'user_id': '735089743428497409', 'username': 'amellisonmiller'}, {'user_id': '2978837542', 'username': 'GovernorTomWolf'}]",,,,
1238433100981506048,1238432490932625409,1584100434000,2020-03-13,04:53:54,PDT,2865208476,mommy_ew,Mommy of 3,,Please close the schools.,['governortomwolf'],[],[],0,4,79,[],[],https://twitter.com/mommy_ew/status/1238433100981506048,False,,0,,,,,,,"[{'user_id': '2865208476', 'username': 'mommy_ew'}, {'user_id': '2978837542', 'username': 'GovernorTomWolf'}]",,,,
1238432834102190080,1238432490932625409,1584100371000,2020-03-13,04:52:51,PDT,463977154,stonekoldsoul,Grey Witch,,#CloseTheSchools,['governortomwolf'],[],[],1,1,43,['#closetheschools'],[],https://twitter.com/stonekoldsoul/status/1238432834102190080,False,,0,,,,,,,"[{'user_id': '463977154', 'username': 'stonekoldsoul'}, {'user_id': '2978837542', 'username': 'GovernorTomWolf'}]",,,,
1238189166715899908,1238169331269283842,1584042276000,2020-03-12,12:44:36,PDT,1191451070,proud717mom,MURPHY stays the eff at home,,Please pass something to provide paid leave for workers. I substitute teach and I won’t get paid if schools are closed like so many others. If the feds won’t do it please do something at the state level,"['governortomwolf', 'pemahq', 'pahealthdept']",[],[],2,4,27,[],[],https://twitter.com/Proud717Mom/status/1238189166715899908,False,,0,,,,,,,"[{'user_id': '1191451070', 'username': 'Proud717Mom'}, {'user_id': '2978837542', 'username': 'GovernorTomWolf'}, {'user_id': '2435689370', 'username': 'PEMAHQ'}, {'user_id': '3218464527', 'username': 'PAHealthDept'}]",,,,
1238178517201846272,1238169331269283842,1584039737000,2020-03-12,12:02:17,PDT,338500727,perpoulos,Patricia Poulos,,"Again, cancel PSSA’s!  Students and teachers are losing valuable face time followed by 2 weeks of testing?","['governortomwolf', 'pemahq', 'pahealthdept']",[],[],0,4,22,[],[],https://twitter.com/PERPoulos/status/1238178517201846272,False,,0,,,,,,,"[{'user_id': '338500727', 'username': 'PERPoulos'}, {'user_id': '2978837542', 'username': 'GovernorTomWolf'}, {'user_id': '2435689370', 'username': 'PEMAHQ'}, {'user_id': '3218464527', 'username': 'PAHealthDept'}]",,,,
1238178414470848513,1238169331269283842,1584039712000,2020-03-12,12:01:52,PDT,930970453497335808,michellebshipe,Michelle,,@GovernorTomWolf so proud of PA and your response to this crisis! Thank you for the lockdown it is going to keep us healthier and safer.  Great decision!!!,"['governortomwolf', 'pemahq', 'pahealthdept']",[],[],1,3,32,[],[],https://twitter.com/michellebshipe/status/1238178414470848513,False,,0,,,,,,,"[{'user_id': '930970453497335808', 'username': 'michellebshipe'}, {'user_id': '2978837542', 'username': 'GovernorTomWolf'}, {'user_id': '2435689370', 'username': 'PEMAHQ'}, {'user_id': '3218464527', 'username': 'PAHealthDept'}]",,,,
1238176367885328386,1238169331269283842,1584039224000,2020-03-12,11:53:44,PDT,1900808910,camlovescorn,Cam,,As a resident of Montgomery County who has someone immunosupressed in my family I want to thank you personally for your order to close schools and other public gathering points today. You are saving lives and doing to much to help so many!,['governortomwolf'],[],[],0,1,25,[],[],https://twitter.com/Camlovescorn/status/1238176367885328386,False,,0,,,,,,,"[{'user_id': '1900808910', 'username': 'Camlovescorn'}, {'user_id': '2978837542', 'username': 'GovernorTomWolf'}]",,,,
1238175054082564099,1238169331269283842,1584038911000,2020-03-12,11:48:31,PDT,110762229,sue_zee_que4,Suze,,Thank you as a resident of MontCo.,"['governortomwolf', 'pemahq', 'pahealthdept']",[],[],0,0,12,[],[],https://twitter.com/Sue_Zee_Que4/status/1238175054082564099,False,,0,,,,,,,"[{'user_id': '110762229', 'username': 'Sue_Zee_Que4'}, {'user_id': '2978837542', 'username': 'GovernorTomWolf'}, {'user_id': '2435689370', 'username': 'PEMAHQ'}, {'user_id': '3218464527', 'username': 'PAHealthDept'}]",,,,
1238173849302249472,1238169331269283842,1584038624000,2020-03-12,11:43:44,PDT,16709580,davidmcullen3,David M. Cullen,,Thank god for @GovernorTomWolf,"['governortomwolf', 'pemahq', 'pahealthdept']",[],[],0,1,25,[],[],https://twitter.com/davidmcullen3/status/1238173849302249472,False,,0,,,,,,,"[{'user_id': '16709580', 'username': 'davidmcullen3'}, {'user_id': '2978837542', 'username': 'GovernorTomWolf'}, {'user_id': '2435689370', 'username': 'PEMAHQ'}, {'user_id': '3218464527', 'username': 'PAHealthDept'}]",,,,
1238169353260072960,1238169331269283842,1584037552000,2020-03-12,11:25:52,PDT,2978837542,governortomwolf,Governor Tom Wolf,,"I want to close this thread by thanking everyone who is working to respond to this pandemic — with a special thank you to @PAHealthDept and @SecretaryLevine.

We are safer because of your tireless effort to protect us.
 
All the latest updates ⤵️ http://on.pa.gov/coronavirus ","['pahealthdept', 'secretarylevine']",['http://on.pa.gov/coronavirus'],[],23,36,236,[],[],https://twitter.com/GovernorTomWolf/status/1238169353260072960,False,,0,,,,,,,"[{'user_id': '2978837542', 'username': 'GovernorTomWolf'}, {'user_id': '3218464527', 'username': 'PAHealthDept'}, {'user_id': '3688119747', 'username': 'SecretaryLevine'}]",,,,
1238169351951462400,1238169331269283842,1584037552000,2020-03-12,11:25:52,PDT,2978837542,governortomwolf,Governor Tom Wolf,,"We encourage Pennsylvanians to call the @PAHeathDept at 1-877-724-3258 if:
🤝 You have been in contact with a known #COVID19 exposure
✈️ You have recent travel history to Italy, China, Iran, or South Korea",[],[],[],13,80,127,['#covid19'],[],https://twitter.com/GovernorTomWolf/status/1238169351951462400,False,,0,,,,,,,"[{'user_id': '2978837542', 'username': 'GovernorTomWolf'}]",,,,
1238169350064005120,1238169331269283842,1584037551000,2020-03-12,11:25:51,PDT,2978837542,governortomwolf,Governor Tom Wolf,,"Protect yourself and your family by knowing the symptoms of #COVID19 and taking everyday precautions, such as:
🧼 Washing hands with soapy water for 20 seconds
🧻 Cleaning surfaces frequently
🙅‍♀‍ Avoiding touching face
🤧 Covering coughs + sneezes
🏡 Staying home when sick pic.twitter.com/Kwvy92mWfK",[],[],['https://pbs.twimg.com/media/ES7b8i8XsAEA8vU.jpg'],7,83,139,['#covid19'],[],https://twitter.com/GovernorTomWolf/status/1238169350064005120,False,,0,,,,,,,"[{'user_id': '2978837542', 'username': 'GovernorTomWolf'}]",,,,
1238169347933245446,1238169331269283842,1584037551000,2020-03-12,11:25:51,PDT,2978837542,governortomwolf,Governor Tom Wolf,,"There’s no need to panic, but we all can and should prepare at this time.
 
The same family emergency plans and kits that we use to prepare for flu or norovirus, and even snowstorms and floods, are important now.  #COVID19 pic.twitter.com/om8aOFEwlm",[],[],['https://pbs.twimg.com/media/ES7bvH_XYAE9IpL.jpg'],13,66,164,['#covid19'],[],https://twitter.com/GovernorTomWolf/status/1238169347933245446,False,,0,,,,,,,"[{'user_id': '2978837542', 'username': 'GovernorTomWolf'}]",,,,
1238169346377220101,1238169331269283842,1584037550000,2020-03-12,11:25:50,PDT,2978837542,governortomwolf,Governor Tom Wolf,,"The cost of testing is covered for patients who have Medicaid, Medical Assistance, or CHIP. #COVID19",[],[],[],7,45,150,['#covid19'],[],https://twitter.com/GovernorTomWolf/status/1238169346377220101,False,,0,,,,,,,"[{'user_id': '2978837542', 'username': 'GovernorTomWolf'}]",,,,
1238169345076887555,1238169331269283842,1584037550000,2020-03-12,11:25:50,PDT,2978837542,governortomwolf,Governor Tom Wolf,,"Earlier this week, I announced that health insurance providers will cover costs associated with testing for and treatment of coronavirus. 

Please don’t let worries about cost keep you from getting tested.  #COVID19",[],[],[],6,76,225,['#covid19'],[],https://twitter.com/GovernorTomWolf/status/1238169345076887555,False,,0,,,,,,,"[{'user_id': '2978837542', 'username': 'GovernorTomWolf'}]",,,,
1238169343814520832,1238169331269283842,1584037550000,2020-03-12,11:25:50,PDT,2978837542,governortomwolf,Governor Tom Wolf,,"I’m taking action to protect state workers. #COVID19
 
𝗘𝗳𝗳𝗲𝗰𝘁𝗶𝘃𝗲 𝗶𝗺𝗺𝗲𝗱𝗶𝗮𝘁𝗲𝗹𝘆:
▪️ No non-essential, out-of-state and international travel
▪️  All mass work meetings have been canceled or postponed",[],[],[],4,23,127,['#covid19'],[],https://twitter.com/GovernorTomWolf/status/1238169343814520832,False,,0,,,,,,,"[{'user_id': '2978837542', 'username': 'GovernorTomWolf'}]",,,,
1238169342501625859,1238169331269283842,1584037549000,2020-03-12,11:25:49,PDT,2978837542,governortomwolf,Governor Tom Wolf,,"Anyone exposed is being quarantined and monitored for symptoms.
 
We are working to make sure our health systems, first responders and county and municipal health departments have the resources they need to respond. #COVID19",[],[],[],4,14,106,['#covid19'],[],https://twitter.com/GovernorTomWolf/status/1238169342501625859,False,,0,,,,,,,"[{'user_id': '2978837542', 'username': 'GovernorTomWolf'}]",,,,
1238169341369204737,1238169331269283842,1584037549000,2020-03-12,11:25:49,PDT,2978837542,governortomwolf,Governor Tom Wolf,,"Last week, I declared an emergency disaster declaration to free up funding and resources. https://www.governor.pa.gov/newsroom/gov-wolf-signs-covid-19-disaster-declaration-to-provide-increased-support-for-state-response/ …",[],['https://www.governor.pa.gov/newsroom/gov-wolf-signs-covid-19-disaster-declaration-to-provide-increased-support-for-state-response/'],[],2,27,139,[],[],https://twitter.com/GovernorTomWolf/status/1238169341369204737,False,,0,,,,,,,"[{'user_id': '2978837542', 'username': 'GovernorTomWolf'}]",,,,
1238169340136099841,1238169331269283842,1584037549000,2020-03-12,11:25:49,PDT,2978837542,governortomwolf,Governor Tom Wolf,,I am asking religious leaders to use their discretion to prevent the spread of illness through their congregations and communities. #COVID19,[],[],[],4,42,144,['#covid19'],[],https://twitter.com/GovernorTomWolf/status/1238169340136099841,False,,0,,,,,,,"[{'user_id': '2978837542', 'username': 'GovernorTomWolf'}]",,,,
1238169338894594053,1238169331269283842,1584037549000,2020-03-12,11:25:49,PDT,2978837542,governortomwolf,Governor Tom Wolf,,"Across Pennsylvania, no mass gatherings — especially those with more than 250 attendees—should be held, including conferences and rallies.

I am discouraging people from going to recreational activities in public places. #COVID19",[],[],[],22,128,244,['#covid19'],[],https://twitter.com/GovernorTomWolf/status/1238169338894594053,False,,0,,,,,,,"[{'user_id': '2978837542', 'username': 'GovernorTomWolf'}]",,,,
