id,conversation_id,created_at,date,time,timezone,user_id,username,name,place,tweet,mentions,urls,photos,replies_count,retweets_count,likes_count,hashtags,cashtags,link,retweet,quote_url,video,near,geo,source,user_rt_id,user_rt,retweet_id,reply_to,retweet_date,translate,trans_src,trans_dest
1249652528213565440,1249652525390802944,1586775354000,2020-04-13,03:55:54,PDT,545107258,govphilscott,Governor Phil Scott,,"Later this week, I will announce additional flag protocols to honor all victims of the coronavirus. 

We will get through this, together.",[],[],[],6,6,66,[],[],https://twitter.com/GovPhilScott/status/1249652528213565440,False,,0,,,,,,,"[{'user_id': '545107258', 'username': 'GovPhilScott'}]",,,,
1249360887238070273,1249360690529406978,1586705822000,2020-04-12,08:37:02,PDT,545107258,govphilscott,Governor Phil Scott,,"I took this picture this morning in my backyard. They blossomed overnight. It reminded me that spring is coming, and there are better days ahead. pic.twitter.com/VoaPhfzUhl",[],[],['https://pbs.twimg.com/media/EVafGlyXgAAsVkq.jpg'],6,13,124,[],[],https://twitter.com/GovPhilScott/status/1249360887238070273,False,,0,,,,,,,"[{'user_id': '545107258', 'username': 'GovPhilScott'}]",,,,
1248639093531185153,1248619334982725640,1586533733000,2020-04-10,08:48:53,PDT,3044621157,jacobsmithvt,Jacob Smith,,"Good. I want to go back to work and my wife wants to find work again but we need to listen to doctors. There is near universal consensus among experts that we need to continue. Ppl who oppose this: if your doctor says you need to do something, do you ignore b/c it’s inconvenient?",['govphilscott'],[],[],0,0,14,[],[],https://twitter.com/JacobSmithVT/status/1248639093531185153,False,,0,,,,,,,"[{'user_id': '3044621157', 'username': 'JacobSmithVT'}, {'user_id': '545107258', 'username': 'GovPhilScott'}]",,,,
1248630635389911040,1248619334982725640,1586531716000,2020-04-10,08:15:16,PDT,785314653467541504,shelovedpurple,She Loved Purple,,Here come the bankruptcies,['govphilscott'],[],[],1,0,12,[],[],https://twitter.com/SheLovedPurple/status/1248630635389911040,False,,0,,,,,,,"[{'user_id': '785314653467541504', 'username': 'SheLovedPurple'}, {'user_id': '545107258', 'username': 'GovPhilScott'}]",,,,
1248629782553731072,1248619334982725640,1586531513000,2020-04-10,08:11:53,PDT,197086055,techcrib,David Bradbury,,".@GovPhilScott has risen to this occasion.  Steady, smart, informed, kind and credible leadership. Thank you.",['govphilscott'],[],[],0,1,24,[],[],https://twitter.com/techcrib/status/1248629782553731072,False,,0,,,,,,,"[{'user_id': '197086055', 'username': 'techcrib'}, {'user_id': '545107258', 'username': 'GovPhilScott'}]",,,,
1248627053957505028,1248619334982725640,1586530862000,2020-04-10,08:01:02,PDT,240698698,bwhitevt,Bob White,,You are no longer savings lives ..you are ruining lives! People are going to start to pushback and it will be ugly...nobody is addressing the stress and mental health issues this is causing! April 30th should be the date!,['govphilscott'],[],[],8,2,15,[],[],https://twitter.com/bwhitevt/status/1248627053957505028,False,,0,,,,,,,"[{'user_id': '240698698', 'username': 'bwhitevt'}, {'user_id': '545107258', 'username': 'GovPhilScott'}]",,,,
1248626383107944461,1248619334982725640,1586530702000,2020-04-10,07:58:22,PDT,2371712067,rmloozach,Robert,,This is undemocratic and unnecessary,['govphilscott'],[],[],4,0,12,[],[],https://twitter.com/rmloozach/status/1248626383107944461,False,,0,,,,,,,"[{'user_id': '2371712067', 'username': 'rmloozach'}, {'user_id': '545107258', 'username': 'GovPhilScott'}]",,,,
1248621578708910080,1248619334982725640,1586529557000,2020-04-10,07:39:17,PDT,606684158,margaretgrant22,Margaret Grant,,I would be disappointed if you didn’t do this. Thank you for your leadership and caution.,['govphilscott'],[],[],0,0,23,[],[],https://twitter.com/MargaretGrant22/status/1248621578708910080,False,,0,,,,,,,"[{'user_id': '606684158', 'username': 'MargaretGrant22'}, {'user_id': '545107258', 'username': 'GovPhilScott'}]",,,,
1248619337247682561,1248619334982725640,1586529022000,2020-04-10,07:30:22,PDT,545107258,govphilscott,Governor Phil Scott,,"Please know, I will work every hour of every day, for as long as it takes, to see Vermont through this and to help rebuild stronger than we were before. 3/3

 https://governor.vermont.gov/press-release/governor-phil-scott-extends-state-emergency-vermont …",[],['https://governor.vermont.gov/press-release/governor-phil-scott-extends-state-emergency-vermont'],[],14,11,105,[],[],https://twitter.com/GovPhilScott/status/1248619337247682561,False,,0,,,,,,,"[{'user_id': '545107258', 'username': 'GovPhilScott'}]",,,,
1248619336052256772,1248619334982725640,1586529022000,2020-04-10,07:30:22,PDT,545107258,govphilscott,Governor Phil Scott,,"We're making big sacrifices to save lives but we can't let our foot off the gas just yet. We'll continue to watch the trends & once the data shows a downward trend, we can open the spigot, a quarter turn at a time, to get folks back to work in a way that’s responsible & safe. 2/3",[],[],[],6,10,84,[],[],https://twitter.com/GovPhilScott/status/1248619336052256772,False,,0,,,,,,,"[{'user_id': '545107258', 'username': 'GovPhilScott'}]",,,,
1248036834002731009,1248036834002731009,1586390143000,2020-04-08,16:55:43,PDT,976897289645064193,vtnationalguard,Vermont National Guard,,"@GovPhilScott  stopped by the Alternate Healthcare Facility at the Champlain Valley Exposition. This facility will treat low acuity patients and allow our hospitals to focus resources on higher levels of care, including #COVID19. We are #InThisTogether pic.twitter.com/bwxDt1im3D",['govphilscott'],[],['https://pbs.twimg.com/media/EVHq4lNXkAQQCW3.jpg'],3,4,18,"['#covid19', '#inthistogether']",[],https://twitter.com/VTNationalGuard/status/1248036834002731009,False,,0,,,,,,,"[{'user_id': '976897289645064193', 'username': 'VTNationalGuard'}, {'user_id': '545107258', 'username': 'GovPhilScott'}]",,,,
1247562555649937416,1247558014183194624,1586277066000,2020-04-07,09:31:06,PDT,545107258,govphilscott,Governor Phil Scott,,We are encouraging other insurers to follow suit.  “Every insurer should begin developing plans to make certain that Vermonters are not overpaying when it comes to their auto insurance.” - @VermontDFR Commissioner @mspieciak (2/2),"['vermontdfr', 'mspieciak']",[],[],6,2,24,[],[],https://twitter.com/GovPhilScott/status/1247562555649937416,False,,0,,,,,,,"[{'user_id': '545107258', 'username': 'GovPhilScott'}, {'user_id': '822995007523213317', 'username': 'VermontDFR'}, {'user_id': '571362178', 'username': 'mspieciak'}]",,,,
1247267997158440965,1247267992947351555,1586206838000,2020-04-06,14:00:38,PDT,545107258,govphilscott,Governor Phil Scott,,"Educators and parents are working hard to achieve these goals, and this initiative will help support their work. I am grateful to Vermont PBS as this partnership will give those already doing so much another tool to reach and educate students. (3/3)",[],[],[],2,0,13,[],[],https://twitter.com/GovPhilScott/status/1247267997158440965,False,,0,,,,,,,"[{'user_id': '545107258', 'username': 'GovPhilScott'}]",,,,
1247267995484905472,1247267992947351555,1586206837000,2020-04-06,14:00:37,PDT,545107258,govphilscott,Governor Phil Scott,,"I recognize there is no replacement for in-person instruction and the learning that takes place in a classroom but this is an unprecedented public health situation, and we must work together to provide the best possible remote learning opportunities for Vermont’s kids. (2/3)",[],[],[],4,1,16,[],[],https://twitter.com/GovPhilScott/status/1247267995484905472,False,,0,,,,,,,"[{'user_id': '545107258', 'username': 'GovPhilScott'}]",,,,
1245144947629621250,1245138797467176960,1585700663000,2020-03-31,17:24:23,PDT,75355226,counseloradrian,(((Ed Adrian))),,Governor. Thank you for issuing this call for #VT to volunteer during this time of need.  I want to offer my services pro bono to any health care professional who might need legal assistance concerning licensure or other related issues. #VTpoli https://bit.ly/3bJNspV ,['govphilscott'],['https://bit.ly/3bJNspV'],[],0,6,30,"['#vt', '#vtpoli']",[],https://twitter.com/CounselorAdrian/status/1245144947629621250,False,,0,,,,,,,"[{'user_id': '75355226', 'username': 'CounselorAdrian'}, {'user_id': '545107258', 'username': 'GovPhilScott'}]",,,,
1245138818858127363,1245138797467176960,1585699202000,2020-03-31,17:00:02,PDT,545107258,govphilscott,Governor Phil Scott,,"Our state is at its best when Vermonters pull together to help each other. The coming weeks will be very difficult, but united in common purpose, we will face, fight and defeat this virus – and emerge stronger together. 15/15",[],[],[],7,3,37,[],[],https://twitter.com/GovPhilScott/status/1245138818858127363,False,,0,,,,,,,"[{'user_id': '545107258', 'username': 'GovPhilScott'}]",,,,
1245138817721532418,1245138797467176960,1585699202000,2020-03-31,17:00:02,PDT,545107258,govphilscott,Governor Phil Scott,,"Support your local Food Bank:
Donate online at  http://vtfoodbank.org  or you can text GIVEHEALTH to 85511. If you're in need of help, click below. 14/15 

  http://vtfoodbank.org/gethelp .",[],"['http://vtfoodbank.org', 'http://vtfoodbank.org/gethelp']",[],5,5,20,[],[],https://twitter.com/GovPhilScott/status/1245138817721532418,False,,0,,,,,,,"[{'user_id': '545107258', 'username': 'GovPhilScott'}]",,,,
1245138816106725383,1245138797467176960,1585699201000,2020-03-31,17:00:01,PDT,545107258,govphilscott,Governor Phil Scott,,"Give blood: Visit the American Red Cross by clicking below to learn how to safely donate blood. 13/15

 https://www.redcross.org/local/new-hampshire-vermont.html ….",[],['https://www.redcross.org/local/new-hampshire-vermont.html'],[],3,2,15,[],[],https://twitter.com/GovPhilScott/status/1245138816106725383,False,,0,,,,,,,"[{'user_id': '545107258', 'username': 'GovPhilScott'}]",,,,
1245138815125250051,1245138797467176960,1585699201000,2020-03-31,17:00:01,PDT,545107258,govphilscott,Governor Phil Scott,,"Donate PPE: Donations of N95 masks, medical and industrial grade or surgical masks can be brought to your nearest State Police Barracks. You can find the location nearest to you by clicking below. 12/15
 https://vsp.vermont.gov/stations .",[],['https://vsp.vermont.gov/stations'],[],1,5,19,[],[],https://twitter.com/GovPhilScott/status/1245138815125250051,False,,0,,,,,,,"[{'user_id': '545107258', 'username': 'GovPhilScott'}]",,,,
1245138814374379520,1245138797467176960,1585699201000,2020-03-31,17:00:01,PDT,545107258,govphilscott,Governor Phil Scott,,"Vermonters can also contribute to blood banks, food banks, and other emergency supply efforts. In addition to volunteering, Vermonters can also give back in the following ways: 11/15",[],[],[],2,2,16,[],[],https://twitter.com/GovPhilScott/status/1245138814374379520,False,,0,,,,,,,"[{'user_id': '545107258', 'username': 'GovPhilScott'}]",,,,
1245138813619494916,1245138797467176960,1585699201000,2020-03-31,17:00:01,PDT,545107258,govphilscott,Governor Phil Scott,,"We expect to draw upon many skills to meet the challenge of serving those affected by COVID-19, potentially including drivers, food service, construction, IT, security, skilled trades and more. 10/15",[],[],[],4,2,20,[],[],https://twitter.com/GovPhilScott/status/1245138813619494916,False,,0,,,,,,,"[{'user_id': '545107258', 'username': 'GovPhilScott'}]",,,,
1245138812407353345,1245138797467176960,1585699201000,2020-03-31,17:00:01,PDT,545107258,govphilscott,Governor Phil Scott,,"Other individuals who do not have medical or healthcare backgrounds but are willing to volunteer their time in Vermont’s response effort can register through the state’s volunteer web portal and indicate their expertise and availability. 9/15

 https://www.vermont.gov/volunteer ",[],['https://www.vermont.gov/volunteer'],[],1,3,21,[],[],https://twitter.com/GovPhilScott/status/1245138812407353345,False,,0,,,,,,,"[{'user_id': '545107258', 'username': 'GovPhilScott'}]",,,,
1245138811421483008,1245138797467176960,1585699200000,2020-03-31,17:00:00,PDT,545107258,govphilscott,Governor Phil Scott,,VT has eased licensing requirements for the purposes of aiding this emergency response. Individuals who are licensed in other states or who were previously licensed should visit the Health Dept. website and review the guide on emergency licensure. 8/15 https://www.healthvermont.gov/health-professionals-systems/board-medical-practice/COVID19 …,[],['https://www.healthvermont.gov/health-professionals-systems/board-medical-practice/COVID19'],[],4,2,19,[],[],https://twitter.com/GovPhilScott/status/1245138811421483008,False,,0,,,,,,,"[{'user_id': '545107258', 'username': 'GovPhilScott'}]",,,,
1245138810557562880,1245138797467176960,1585699200000,2020-03-31,17:00:00,PDT,545107258,govphilscott,Governor Phil Scott,,"This effort is about drawing more skilled personnel, such as retirees or those not currently employed in the healthcare field, into the response and not about redirecting existing healthcare workers. 7/15",[],[],[],1,1,18,[],[],https://twitter.com/GovPhilScott/status/1245138810557562880,False,,0,,,,,,,"[{'user_id': '545107258', 'username': 'GovPhilScott'}]",,,,
1245138808913485826,1245138797467176960,1585699200000,2020-03-31,17:00:00,PDT,545107258,govphilscott,Governor Phil Scott,,"The Vermont Medical Reserve Corps is seeking these qualified and experienced volunteers, including: 6/15 pic.twitter.com/yzymXYiLFx",[],[],['https://pbs.twimg.com/media/EUefJUNXYAAd3y0.jpg'],1,3,18,[],[],https://twitter.com/GovPhilScott/status/1245138808913485826,False,,0,,,,,,,"[{'user_id': '545107258', 'username': 'GovPhilScott'}]",,,,
1245138802479443968,1245138797467176960,1585699198000,2020-03-31,16:59:58,PDT,545107258,govphilscott,Governor Phil Scott,,"This is needed because Vermont’s existing health care workers are going above and beyond to respond to this challenge as it unfolds, and they are going to need reinforcements. 5/15",[],[],[],1,0,17,[],[],https://twitter.com/GovPhilScott/status/1245138802479443968,False,,0,,,,,,,"[{'user_id': '545107258', 'username': 'GovPhilScott'}]",,,,
1245138801632202752,1245138797467176960,1585699198000,2020-03-31,16:59:58,PDT,545107258,govphilscott,Governor Phil Scott,,"The state’s volunteer website directs these individuals to Vermont’s Medical Reserve Corp units, community-based groups of volunteers who can supplement local emergency, health care provider staff and public health resources. 4/15",[],[],[],1,0,16,[],[],https://twitter.com/GovPhilScott/status/1245138801632202752,False,,0,,,,,,,"[{'user_id': '545107258', 'username': 'GovPhilScott'}]",,,,
1245138800877150208,1245138797467176960,1585699198000,2020-03-31,16:59:58,PDT,545107258,govphilscott,Governor Phil Scott,,"Those with medical experience or other health care backgrounds and the ability to volunteer are needed to bolster the ranks of Vermont’s current health care workforce. 3/15

 https://vermont.gov/volunteer ",[],['https://vermont.gov/volunteer'],[],2,3,21,[],[],https://twitter.com/GovPhilScott/status/1245138800877150208,False,,0,,,,,,,"[{'user_id': '545107258', 'username': 'GovPhilScott'}]",,,,
1245138798327074817,1245138797467176960,1585699197000,2020-03-31,16:59:57,PDT,545107258,govphilscott,Governor Phil Scott,,"As we prepare for a surge in COVID-19 cases expected in the coming weeks, it will require each of us to do our part to ease the burden on our health care system, the struggles of those less fortunate, and, ultimately, to save the lives of our friends and neighbors. 2/15",[],[],[],1,3,25,[],[],https://twitter.com/GovPhilScott/status/1245138798327074817,False,,0,,,,,,,"[{'user_id': '545107258', 'username': 'GovPhilScott'}]",,,,
1244700142235553792,1244269395028910080,1585594613000,2020-03-30,11:56:53,PDT,20690398,manmademoon,Duncan Jones,,May want to check your local news is not owned by the Sinclair Broadcast Group though...,"['govphilscott', 'jaketapper']",[],[],3,2,40,[],[],https://twitter.com/ManMadeMoon/status/1244700142235553792,False,,0,,,,,,,"[{'user_id': '20690398', 'username': 'ManMadeMoon'}, {'user_id': '545107258', 'username': 'GovPhilScott'}, {'user_id': '14529929', 'username': 'jaketapper'}]",,,,
1244279861432258560,1244269395028910080,1585494411000,2020-03-29,08:06:51,PDT,914937519715885057,amohaffortin,Stacey Fortin,,"Thank you for all that you are doing for your people of Vermont. Your calm helps me stay calm. One question, my son has been trying all week to get thru the unemployment line, there are some questions he needs help with, rent is due, how does he get thru to the office?",['govphilscott'],[],[],3,1,19,[],[],https://twitter.com/amohaffortin/status/1244279861432258560,False,,0,,,,,,,"[{'user_id': '914937519715885057', 'username': 'amohaffortin'}, {'user_id': '545107258', 'username': 'GovPhilScott'}]",,,,
1244272806109622272,1244269395028910080,1585492729000,2020-03-29,07:38:49,PDT,2961492328,vermontisok,Enrico Pallazzo,,"Very classy Governor! You set the example and consistently rise above and lead despite the unwarranted negativity and attacks by @vtdigger writer John Walters. Keep up the great job, Vermonters are proud. #vtpoli #VT #BTV","['govphilscott', 'vtdigger']",[],[],0,2,25,"['#vtpoli', '#vt', '#btv']",[],https://twitter.com/Vermontisok/status/1244272806109622272,False,,0,,,,,,,"[{'user_id': '2961492328', 'username': 'Vermontisok'}, {'user_id': '545107258', 'username': 'GovPhilScott'}, {'user_id': '53502240', 'username': 'vtdigger'}]",,,,
1242184901178413061,1242184900188536838,1584994933000,2020-03-23,13:22:13,PDT,545107258,govphilscott,Governor Phil Scott,,"We have also extended, among others, personal income tax filing due dates from April 15 to July 15, 2020.
 
This means taxpayers can file and pay these taxes on or before July 15, 2020 without any penalty or interest. Read more below: (2/2) #vtpoli
 https://tax.vermont.gov/press-release/upcoming-vermont-tax-due-date-guidance …",[],['https://tax.vermont.gov/press-release/upcoming-vermont-tax-due-date-guidance'],[],2,11,34,['#vtpoli'],[],https://twitter.com/GovPhilScott/status/1242184901178413061,False,,0,,,,,,,"[{'user_id': '545107258', 'username': 'GovPhilScott'}]",,,,
1241879408039903232,1241879072738869250,1584922098000,2020-03-22,17:08:18,PDT,545107258,govphilscott,Governor Phil Scott,,"I know we’re going to get through this, not because of any one person or any one action, but because of each of us doing our part. We must stand as Vermonters, united. (2/2) pic.twitter.com/VWY05ZK8dO",[],[],[],9,13,56,[],[],https://twitter.com/GovPhilScott/status/1241879408039903232,False,,1,,,,,,,"[{'user_id': '545107258', 'username': 'GovPhilScott'}]",,,,
1241356470521921537,1241356469280419842,1584797420000,2020-03-21,06:30:20,PDT,545107258,govphilscott,Governor Phil Scott,,"I've also further reduced the allowable size of non-essential gatherings, which are now limited to no more than 10 people at the same time in a single space.

 https://governor.vermont.gov/press-release/governor-phil-scott-announces-new-covid-19-community-mitigation-measures-directs …",[],['https://governor.vermont.gov/press-release/governor-phil-scott-announces-new-covid-19-community-mitigation-measures-directs'],[],4,6,20,[],[],https://twitter.com/GovPhilScott/status/1241356470521921537,False,,0,,,,,,,"[{'user_id': '545107258', 'username': 'GovPhilScott'}]",,,,
1240743928795672580,1240701695706857474,1584651379000,2020-03-19,13:56:19,PDT,211510950,davesilberman,Dave Silberman,,Thanks. Can we have legal #cannabis delivery now too?,['govphilscott'],[],[],1,1,19,['#cannabis'],[],https://twitter.com/DaveSilberman/status/1240743928795672580,False,,0,,,,,,,"[{'user_id': '211510950', 'username': 'DaveSilberman'}, {'user_id': '545107258', 'username': 'GovPhilScott'}]",,,,
1240623904516984832,1240623903539630087,1584622763000,2020-03-19,05:59:23,PDT,545107258,govphilscott,Governor Phil Scott,,"First, I want to thank heath care workers & our public health officials at @healthvermont for working day and night to keep Vermonters safe and healthy. We owe them a debt of gratitude. We will get through this pandemic, largely thanks to their commitment & sense of duty. #vtpoli pic.twitter.com/bwYCkmKrON",['healthvermont'],[],['https://pbs.twimg.com/media/ETeUAZcXYAAsbG-.jpg'],4,15,54,['#vtpoli'],[],https://twitter.com/GovPhilScott/status/1240623904516984832,False,,0,,,,,,,"[{'user_id': '545107258', 'username': 'GovPhilScott'}, {'user_id': '35820178', 'username': 'healthvermont'}]",,,,
1239670213081280514,1239670199869202432,1584395385000,2020-03-16,14:49:45,PDT,545107258,govphilscott,Governor Phil Scott,,"I want Vermonters to know we’re continuously evaluating other mitigation steps and we’ll continue to communicate those as they are put into place. 

We will get through this, but it'll take all of us doing our part. 

For the latest guidance, visit  http://healthvermont.gov/covid19  (2/2)",[],['http://healthvermont.gov/covid19'],[],1,8,32,[],[],https://twitter.com/GovPhilScott/status/1239670213081280514,False,,0,,,,,,,"[{'user_id': '545107258', 'username': 'GovPhilScott'}]",,,,
1239315802622496769,1239314874901151747,1584310887000,2020-03-15,15:21:27,PDT,545107258,govphilscott,Governor Phil Scott,,"In times of crisis, we all need to make sacrifices. But Vermonters, and all Americans, have risen to the challenges before, and this time will be no different. We will get through this. And we’ll do it, together. 
 
For guidance on #coronavirus, visit  http://healthvermont.gov . 2/2 pic.twitter.com/4iBTFnryM8",[],['http://healthvermont.gov'],[],5,11,24,['#coronavirus'],[],https://twitter.com/GovPhilScott/status/1239315802622496769,False,,1,,,,,,,"[{'user_id': '545107258', 'username': 'GovPhilScott'}]",,,,
1238912022483537925,1238911128731820032,1584214618000,2020-03-14,12:36:58,PDT,1191521063286509569,seejaywon,chris webb 🕊️,,"We’ve pulled our kids from school. If kids get it, due to lack of testing we won’t know since they might not have symptoms, they could pass it to vulnerable staff who might be immunocompromised or taking care if elders. You should’ve shut the schools down.",['govphilscott'],[],[],1,1,16,[],[],https://twitter.com/seejaywon/status/1238912022483537925,False,,0,,,,,,,"[{'user_id': '1191521063286509569', 'username': 'seejaywon'}, {'user_id': '545107258', 'username': 'GovPhilScott'}]",,,,
1238911819659575298,1238911128731820032,1584214570000,2020-03-14,12:36:10,PDT,545107258,govphilscott,Governor Phil Scott,,(2/3) For additional details read my executive order declaring a State of Emergency here:  https://governor.vermont.gov/content/declaration-state-emergency-response-covid-19-and-national-guard-call-out-executive-order-01 … pic.twitter.com/i7mYSOoneV,[],['https://governor.vermont.gov/content/declaration-state-emergency-response-covid-19-and-national-guard-call-out-executive-order-01'],[],5,6,14,[],[],https://twitter.com/GovPhilScott/status/1238911819659575298,False,,1,,,,,,,"[{'user_id': '545107258', 'username': 'GovPhilScott'}]",,,,
1215757168126976000,1215756713657323525,1578694071000,2020-01-10,14:07:51,PDT,2583180049,thevpo1,John Walters,,"How about a state ""Royals In Exile"" incentive program?",['govphilscott'],[],[],1,1,16,[],[],https://twitter.com/thevpo1/status/1215757168126976000,False,,0,,,,,,,"[{'user_id': '2583180049', 'username': 'thevpo1'}, {'user_id': '545107258', 'username': 'GovPhilScott'}]",,,,
