id,conversation_id,created_at,date,time,timezone,user_id,username,name,place,tweet,mentions,urls,photos,replies_count,retweets_count,likes_count,hashtags,cashtags,link,retweet,quote_url,video,near,geo,source,user_rt_id,user_rt,retweet_id,reply_to,retweet_date,translate,trans_src,trans_dest
1232436359022796800,1232436359022796800,1582670700000,2020-02-25,17:45:00,EDT,269992801,asahutchinson,Gov. Asa Hutchinson,,Delighted to attend the dedication of @ibclr's new City Center. I look forward to the many ways this ministry facility will help serve the people of Little Rock. pic.twitter.com/EDk99LyX7T,['ibclr'],[],"['https://pbs.twimg.com/media/ERppVQMXkAMAkVV.jpg', 'https://pbs.twimg.com/media/ERppWfCX0AAZRnL.jpg', 'https://pbs.twimg.com/media/ERppXv0X0AI2Rxl.jpg', 'https://pbs.twimg.com/media/ERppaJUWkAIlDpD.jpg']",1,5,22,[],[],https://twitter.com/AsaHutchinson/status/1232436359022796800,False,,0,,,,,,,"[{'user_id': '269992801', 'username': 'AsaHutchinson'}, {'user_id': '1876725276', 'username': 'ibclr'}]",,,,
1232412707275624450,1232412707275624450,1582665061000,2020-02-25,16:11:01,EDT,269992801,asahutchinson,Gov. Asa Hutchinson,,"I asked the Terry Elementary students, “how many of you know how to code?” Just about every student raised their hand. #CSEd #CSinAR @codeorg pic.twitter.com/qKscslLBbI",['codeorg'],[],['https://pbs.twimg.com/media/ERpnu8iWAAYI2RZ.jpg'],3,6,54,"['#csed', '#csinar']",[],https://twitter.com/AsaHutchinson/status/1232412707275624450,False,,0,,,,,,,"[{'user_id': '269992801', 'username': 'AsaHutchinson'}, {'user_id': '850107536', 'username': 'codeorg'}]",,,,
1231685161223221248,1231685161223221248,1582491600000,2020-02-23,16:00:00,EDT,269992801,asahutchinson,Gov. Asa Hutchinson,,"Our students are AR’s most valuable resource & are critical to the future of our state. During Gifted and Talented Awareness Week, we celebrate gifted & talented students & recognize our state’s education system’s important role in nurturing our students.  https://governor.arkansas.gov/images/uploads/proclamations/200223_2020_Gifted_and_Talented_Awareness_Week.pdf …",[],['https://governor.arkansas.gov/images/uploads/proclamations/200223_2020_Gifted_and_Talented_Awareness_Week.pdf'],[],4,9,30,[],[],https://twitter.com/AsaHutchinson/status/1231685161223221248,False,,0,,,,,,,"[{'user_id': '269992801', 'username': 'AsaHutchinson'}]",,,,
1231579464963960832,1231579464963960832,1582466400000,2020-02-23,09:00:00,EDT,269992801,asahutchinson,Gov. Asa Hutchinson,,Have a blessed day. pic.twitter.com/dbdciJcVim,[],[],['https://pbs.twimg.com/media/ERUzkkJXsAAh4r4.jpg'],2,7,75,[],[],https://twitter.com/AsaHutchinson/status/1231579464963960832,False,,0,,,,,,,"[{'user_id': '269992801', 'username': 'AsaHutchinson'}]",,,,
1231247276112261120,1231247276112261120,1582387200000,2020-02-22,11:00:00,EDT,269992801,asahutchinson,Gov. Asa Hutchinson,,"On Civil Air Patrol Recognition Day, I commend the 260 adult & 203 cadet members of the AR Wing of Civil Air Patrol. These volunteers are tasked by @usairforce for inland search & rescue of downed aircraft & other disaster relief efforts in our state.  https://governor.arkansas.gov/images/uploads/proclamations/200127_2020_Civil_Air_Patrol_Recognition_Day._._.pdf …",['usairforce'],['https://governor.arkansas.gov/images/uploads/proclamations/200127_2020_Civil_Air_Patrol_Recognition_Day._._.pdf'],[],0,5,15,[],[],https://twitter.com/AsaHutchinson/status/1231247276112261120,False,,0,,,,,,,"[{'user_id': '269992801', 'username': 'AsaHutchinson'}, {'user_id': '19611483', 'username': 'usairforce'}]",,,,
1231217076359950336,1231217076359950336,1582380000000,2020-02-22,09:00:00,EDT,269992801,asahutchinson,Gov. Asa Hutchinson,,"On the 288th anniversary of his birth, we recognize the leadership and wisdom of founding father and first President George Washington. pic.twitter.com/2GqcrvNyNq",[],[],['https://pbs.twimg.com/media/ERUxZ9dXkAAnRCh.jpg'],4,14,65,[],[],https://twitter.com/AsaHutchinson/status/1231217076359950336,False,,0,,,,,,,"[{'user_id': '269992801', 'username': 'AsaHutchinson'}]",,,,
1230989994602455040,1230989994602455040,1582325860000,2020-02-21,17:57:40,EDT,269992801,asahutchinson,Gov. Asa Hutchinson,,"In the past two years, the number of youths in state custody of the Division of Youth Services has declined by nearly thirty percent, and in this week's radio address, I discuss some of the changes we have made to achieve that.  https://governor.arkansas.gov/news-media/weekly-address/new-policies-positive-outcomes … pic.twitter.com/PM2pdPvLMj",[],['https://governor.arkansas.gov/news-media/weekly-address/new-policies-positive-outcomes'],['https://pbs.twimg.com/media/ERVYfh7VAAANnUT.jpg'],3,3,12,[],[],https://twitter.com/AsaHutchinson/status/1230989994602455040,False,,0,,,,,,,"[{'user_id': '269992801', 'username': 'AsaHutchinson'}]",,,,
1230628195180789760,1230628195180789760,1582239600000,2020-02-20,18:00:00,EDT,269992801,asahutchinson,Gov. Asa Hutchinson,,"The nursing profession celebrates a global milestone this year, as @WHO declares 2020 the International Year of the Nurse in honor of the 200th anniversary of the birth of Florence Nightingale. It was a pleasure to meet many of AR's nurses & nursing students today at the Capitol. pic.twitter.com/uew80S38J8",['who'],[],"['https://pbs.twimg.com/media/ERQMxYVXsAIKvS9.jpg', 'https://pbs.twimg.com/media/ERQM0EyX0AsjnVq.jpg', 'https://pbs.twimg.com/media/ERQM1MkX0AAG_Ed.jpg']",1,3,23,[],[],https://twitter.com/AsaHutchinson/status/1230628195180789760,False,,0,,,,,,,"[{'user_id': '269992801', 'username': 'AsaHutchinson'}, {'user_id': '14499829', 'username': 'WHO'}]",,,,
1230244749803692033,1230244749803692033,1582148179000,2020-02-19,16:36:19,EDT,269992801,asahutchinson,Gov. Asa Hutchinson,,"At today's STEM Poster event, more than 140 undergraduate students from 17 Arkansas colleges & universities shared their scientific research in natural science & math at the Capitol. It was inspiring to see the work these bright young people have accomplished in STEM fields. pic.twitter.com/N2bGAaO90y",[],[],"['https://pbs.twimg.com/media/ERK1EwcWsAAz3Ax.jpg', 'https://pbs.twimg.com/media/ERK1EwhWoAE_zCW.jpg', 'https://pbs.twimg.com/media/ERK1EweXsAAUrJG.jpg']",5,7,64,[],[],https://twitter.com/AsaHutchinson/status/1230244749803692033,False,,0,,,,,,,"[{'user_id': '269992801', 'username': 'AsaHutchinson'}]",,,,
1229556485782462471,1229556485782462471,1581984084000,2020-02-17,19:01:24,EDT,269992801,asahutchinson,Gov. Asa Hutchinson,,"Today we learned of the death of Arkansan and beloved writer Charles Portis. His classic works, including “True Grit,” will be remembered for generations to come.  And we are proud of the way he showcased our beautiful state.",[],[],[],3,16,102,[],[],https://twitter.com/AsaHutchinson/status/1229556485782462471,False,,0,,,,,,,"[{'user_id': '269992801', 'username': 'AsaHutchinson'}]",,,,
1229473146547384321,1229473146547384321,1581964215000,2020-02-17,13:30:15,EDT,269992801,asahutchinson,Gov. Asa Hutchinson,,This is great news & the changes give a meaningful second chance opportunity for youth who are struggling.  We all need hope. https://www.arkansasonline.com/news/2020/feb/17/state-reduces-count-of-kids-in-lockups-/?utm_medium=email&utm_campaign=morning-2-17-20-subscribers&utm_content=morning-2-17-20-subscribers+CID_07aca88a1a0b9f3cb9ac992f30507617&utm_source=Email%20Marketing%20Platform&utm_term=State%20reduces%20count%20of%20kids%20in%20lockups%20by%20almost%20third …,[],['https://www.arkansasonline.com/news/2020/feb/17/state-reduces-count-of-kids-in-lockups-/?utm_medium=email&utm_campaign=morning-2-17-20-subscribers&utm_content=morning-2-17-20-subscribers+CID_07aca88a1a0b9f3cb9ac992f30507617&utm_source=Email%20Marketing%20Platform&utm_term=State%20reduces%20count%20of%20kids%20in%20lockups%20by%20almost%20third'],[],0,4,26,[],[],https://twitter.com/AsaHutchinson/status/1229473146547384321,False,,0,,,,,,,"[{'user_id': '269992801', 'username': 'AsaHutchinson'}]",,,,
1229405141075255297,1229405141075255297,1581948001000,2020-02-17,09:00:01,EDT,269992801,asahutchinson,Gov. Asa Hutchinson,,Powerful words from former President Ronald Reagan's 1985 State of the Union address. Happy #PresidentsDay. pic.twitter.com/ccON5aRV7x,[],[],['https://pbs.twimg.com/media/EQxK5OVXUAAbMmV.jpg'],5,11,82,['#presidentsday'],[],https://twitter.com/AsaHutchinson/status/1229405141075255297,False,,0,,,,,,,"[{'user_id': '269992801', 'username': 'AsaHutchinson'}]",,,,
1229042749451595777,1229042749451595777,1581861600000,2020-02-16,09:00:00,EDT,269992801,asahutchinson,Gov. Asa Hutchinson,,Have a good Sunday. pic.twitter.com/paG92NDK9d,[],[],['https://pbs.twimg.com/media/EQxJ_1ZWkAMGlLi.jpg'],2,11,76,[],[],https://twitter.com/AsaHutchinson/status/1229042749451595777,False,,0,,,,,,,"[{'user_id': '269992801', 'username': 'AsaHutchinson'}]",,,,
1228442867988865026,1228442867988865026,1581718577000,2020-02-14,17:16:17,EDT,269992801,asahutchinson,Gov. Asa Hutchinson,,"In this week’s radio address, I share the story of Daisy Bates, a courageous woman whose leadership and determination continue to inspire us today. Learn more about her and her enormous contributions to the cause of equal rights here:  https://governor.arkansas.gov/news-media/weekly-address/the-home-of-history-makers … pic.twitter.com/jbBJNtNeKn",[],['https://governor.arkansas.gov/news-media/weekly-address/the-home-of-history-makers'],['https://pbs.twimg.com/media/EQxORoqWoAAAHvw.jpg'],1,7,17,[],[],https://twitter.com/AsaHutchinson/status/1228442867988865026,False,,0,,,,,,,"[{'user_id': '269992801', 'username': 'AsaHutchinson'}]",,,,
1228420936677941264,1228420936677941264,1581713348000,2020-02-14,15:49:08,EDT,269992801,asahutchinson,Gov. Asa Hutchinson,,The newly created Occupational Licensing Sustainability Group will continue to streamline AR’s licensing & certification process from last year’s reforms. This is a significant step in pursuing @realDonaldTrump’s vision for regulatory reform.  https://governor.arkansas.gov/news-media/press-releases/governor-hutchinson-creates-working-group-to-continue-reform-of-occupational-licensing …,['realdonaldtrump'],['https://governor.arkansas.gov/news-media/press-releases/governor-hutchinson-creates-working-group-to-continue-reform-of-occupational-licensing'],[],0,2,13,[],[],https://twitter.com/AsaHutchinson/status/1228420936677941264,False,,0,,,,,,,"[{'user_id': '269992801', 'username': 'AsaHutchinson'}, {'user_id': '25073877', 'username': 'realDonaldTrump'}]",,,,
1228086144614699008,1228086144614699008,1581633528000,2020-02-13,17:38:48,EDT,269992801,asahutchinson,Gov. Asa Hutchinson,,"It's always a pleasure to meet with our state's local leaders, who work daily on behalf of the people of Arkansas by serving our communities. Thank you for inviting me to speak with you at today's Arkansas Municipal League Winter Conference! pic.twitter.com/keg5kO75hW",[],[],"['https://pbs.twimg.com/media/EQsJ1QoW4AMI1Gp.jpg', 'https://pbs.twimg.com/media/EQsJ1QqXYAAGm-e.jpg']",1,1,28,[],[],https://twitter.com/AsaHutchinson/status/1228086144614699008,False,,0,,,,,,,"[{'user_id': '269992801', 'username': 'AsaHutchinson'}]",,,,
1227785920985862144,1227785920985862144,1581561949000,2020-02-12,21:45:49,EDT,269992801,asahutchinson,Gov. Asa Hutchinson,,I like it when Arkansas gets an “A” on broadband deployment policy.  Much more to do but I  appreciate the General Assembly supporting our rural internet initiative. https://twitter.com/RSI/status/1227743252826202113 …,[],['https://twitter.com/RSI/status/1227743252826202113'],[],7,24,129,[],[],https://twitter.com/AsaHutchinson/status/1227785920985862144,False,https://twitter.com/RSI/status/1227743252826202113,0,,,,,,,"[{'user_id': '269992801', 'username': 'AsaHutchinson'}]",,,,
1227747965986594816,1227747965986594816,1581552900000,2020-02-12,19:15:00,EDT,269992801,asahutchinson,Gov. Asa Hutchinson,,"At yesterday's CTE Day at the Capitol, I discussed the importance of career & technical education to AR & met several bright students from across the state who are learning skills that will help them pursue future careers in industries such as computer science, welding & nursing. pic.twitter.com/OgtCjW4dLe",[],[],"['https://pbs.twimg.com/media/EQnOrVYWAAA91o1.jpg', 'https://pbs.twimg.com/media/EQnOrVaXUAAK3bW.jpg']",0,8,56,[],[],https://twitter.com/AsaHutchinson/status/1227747965986594816,False,,0,,,,,,,"[{'user_id': '269992801', 'username': 'AsaHutchinson'}]",,,,
1227738925357244418,1227738925357244418,1581550744000,2020-02-12,18:39:04,EDT,269992801,asahutchinson,Gov. Asa Hutchinson,,Wise words from former President Abraham Lincoln on what would have been his 211th birthday. pic.twitter.com/fHutDCvLDq,[],[],['https://pbs.twimg.com/media/EQnOCvgXUAAUT37.jpg'],2,3,31,[],[],https://twitter.com/AsaHutchinson/status/1227738925357244418,False,,0,,,,,,,"[{'user_id': '269992801', 'username': 'AsaHutchinson'}]",,,,
1227361220132511744,1227361220132511744,1581460692000,2020-02-11,17:38:12,EDT,269992801,asahutchinson,Gov. Asa Hutchinson,,Great to be on @FoxFriendsFirst this morning to discuss the partnerships with governors and @realDonaldTrump’s administration in reducing regulations and in increasing state flexibility. https://twitter.com/FoxFriendsFirst/status/1227308846986780673 …,"['foxfriendsfirst', 'realdonaldtrump']",['https://twitter.com/FoxFriendsFirst/status/1227308846986780673'],[],3,10,40,[],[],https://twitter.com/AsaHutchinson/status/1227361220132511744,False,https://twitter.com/FoxFriendsFirst/status/1227308846986780673,0,,,,,,,"[{'user_id': '269992801', 'username': 'AsaHutchinson'}, {'user_id': '488679352', 'username': 'FoxFriendsFirst'}, {'user_id': '25073877', 'username': 'realDonaldTrump'}]",,,,
1226951984219070465,1226951984219070465,1581363123000,2020-02-10,14:32:03,EDT,269992801,asahutchinson,Gov. Asa Hutchinson,,I am grateful for law enforcement who respond to calls to assure public safety.   They put their own safety at risk. Very thankful. https://twitter.com/ARStatePolice/status/1226932423289720835 …,[],['https://twitter.com/ARStatePolice/status/1226932423289720835'],[],3,28,145,[],[],https://twitter.com/AsaHutchinson/status/1226951984219070465,False,https://twitter.com/ARStatePolice/status/1226932423289720835,0,,,,,,,"[{'user_id': '269992801', 'username': 'AsaHutchinson'}]",,,,
1226603198275899400,1226603198275899400,1581279966000,2020-02-09,15:26:06,EDT,269992801,asahutchinson,Gov. Asa Hutchinson,,It’s exciting to share with my fellow governors what Arkansas is doing to help ex-offenders re-enter the workforce. https://twitter.com/NatlGovsAssoc/status/1226578435633532928 …,[],['https://twitter.com/NatlGovsAssoc/status/1226578435633532928'],[],3,12,84,[],[],https://twitter.com/AsaHutchinson/status/1226603198275899400,False,https://twitter.com/NatlGovsAssoc/status/1226578435633532928,0,,,,,,,"[{'user_id': '269992801', 'username': 'AsaHutchinson'}]",,,,
1226506034983759875,1226506034983759875,1581256800000,2020-02-09,09:00:00,EDT,269992801,asahutchinson,Gov. Asa Hutchinson,,Have a wonderful day. pic.twitter.com/U6CjIIWXdJ,[],[],['https://pbs.twimg.com/media/EQM_WOaU8AIP9IO.jpg'],3,8,58,[],[],https://twitter.com/AsaHutchinson/status/1226506034983759875,False,,0,,,,,,,"[{'user_id': '269992801', 'username': 'AsaHutchinson'}]",,,,
1226268570746806272,1226268570746806272,1581200184000,2020-02-08,17:16:24,EDT,269992801,asahutchinson,Gov. Asa Hutchinson,,We had a productive meeting of the Council of Governors yesterday in DC. I’m honored to represent AR as co-chair of this important state-federal partnership to strengthen our homeland defenses and keep our citizens safe. pic.twitter.com/7Vd6nBT4OY,[],[],['https://pbs.twimg.com/media/EQSUwufXsAc2TNp.jpg'],4,5,70,[],[],https://twitter.com/AsaHutchinson/status/1226268570746806272,False,,0,,,,,,,"[{'user_id': '269992801', 'username': 'AsaHutchinson'}]",,,,
1225626732927049728,1225626732927049728,1581047158000,2020-02-06,22:45:58,EDT,269992801,asahutchinson,Gov. Asa Hutchinson,,Our tech talent in Arkansas leads to Affirma Consulting expanding its Fayetteville office - #Success https://talkbusiness.net/2020/02/affirma-consulting-to-expand-its-fayetteville-office/ …,[],['https://talkbusiness.net/2020/02/affirma-consulting-to-expand-its-fayetteville-office/'],[],1,3,17,['#success'],[],https://twitter.com/AsaHutchinson/status/1225626732927049728,False,,0,,,,,,,"[{'user_id': '269992801', 'username': 'AsaHutchinson'}]",,,,
1225477328282759171,1225477328282759171,1581011537000,2020-02-06,12:52:17,EDT,269992801,asahutchinson,Gov. Asa Hutchinson,,Former President Ronald Reagan appointed me as U.S. Attorney for the Western District of Arkansas in 1982 when I was 31 years old. Today is the 109th anniversary of his birth and the 16th since his passing. I am honored to have served under his leadership.  https://governor.arkansas.gov/images/uploads/proclamations/200206_2020_Ronald_Reagan_Day_in_Arkansas.pdf … pic.twitter.com/18yc0oWP9h,[],['https://governor.arkansas.gov/images/uploads/proclamations/200206_2020_Ronald_Reagan_Day_in_Arkansas.pdf'],['https://pbs.twimg.com/media/EQHFIlbX0AENDb1.jpg'],5,19,159,[],[],https://twitter.com/AsaHutchinson/status/1225477328282759171,False,,0,,,,,,,"[{'user_id': '269992801', 'username': 'AsaHutchinson'}]",,,,
1225192576699052032,1225192576699052032,1580943647000,2020-02-05,18:00:47,EDT,269992801,asahutchinson,Gov. Asa Hutchinson,,"""Rescuers: Portraits of Moral Courage in the Holocaust” is a compelling exhibit by photographer Gay Block that tells stories of those who saved lives during one of history’s darkest moments. I was honored to attend the opening of this collection, on display now at @ArkansasTech. pic.twitter.com/9eKYVWZL5E",['arkansastech'],[],"['https://pbs.twimg.com/media/EQDCJTvXYAY5isl.jpg', 'https://pbs.twimg.com/media/EQDCJUZWkAEdYp_.jpg', 'https://pbs.twimg.com/media/EQDCJTyWsAA0mPA.jpg']",1,3,36,[],[],https://twitter.com/AsaHutchinson/status/1225192576699052032,False,,0,,,,,,,"[{'user_id': '269992801', 'username': 'AsaHutchinson'}, {'user_id': '23623643', 'username': 'ArkansasTech'}]",,,,
1225182508859432960,1225182508859432960,1580941247000,2020-02-05,17:20:47,EDT,269992801,asahutchinson,Gov. Asa Hutchinson,,"It was great to be                                in #I❤️Russellville with ⁦@BreanneDavis⁩ 
to enjoy some good bbq and talk about the importance of rural broadband. pic.twitter.com/ZbroSK6vnf",['breannedavis'],[],['https://pbs.twimg.com/media/EQC4_qxXUAAu7Zn.jpg'],1,5,63,['#i'],[],https://twitter.com/AsaHutchinson/status/1225182508859432960,False,,0,,,,,,,"[{'user_id': '269992801', 'username': 'AsaHutchinson'}, {'user_id': '151973090', 'username': 'BreanneDavis'}]",,,,
1225084655407333376,1225084655407333376,1580917917000,2020-02-05,10:51:57,EDT,269992801,asahutchinson,Gov. Asa Hutchinson,,I’m grateful for the well-deserved recognition given in the #SOTU to our men & women serving in the military overseas. I’m glad they were honored last night by @realDonaldTrump.,['realdonaldtrump'],[],[],1,5,59,['#sotu'],[],https://twitter.com/AsaHutchinson/status/1225084655407333376,False,,0,,,,,,,"[{'user_id': '269992801', 'username': 'AsaHutchinson'}, {'user_id': '25073877', 'username': 'realDonaldTrump'}]",,,,
1224823885780213763,1224823885780213763,1580855745000,2020-02-04,17:35:45,EDT,269992801,asahutchinson,Gov. Asa Hutchinson,,"Today I spoke to the Benton Chamber of Commerce & learned more about the future Saline County Career & Technical Center, which will help students learn skills to set them apart in the workforce. Great work being done in central AR! pic.twitter.com/uX5fYhOtOe",[],[],"['https://pbs.twimg.com/media/EP9y0ymWAAABxka.jpg', 'https://pbs.twimg.com/media/EP9y0yYWkAAJyzT.jpg']",0,4,43,[],[],https://twitter.com/AsaHutchinson/status/1224823885780213763,False,,0,,,,,,,"[{'user_id': '269992801', 'username': 'AsaHutchinson'}]",,,,
1224472794240602119,1224472794240602119,1580772038000,2020-02-03,18:20:38,EDT,269992801,asahutchinson,Gov. Asa Hutchinson,,"What a privilege for @ARFirstLady & me to host the 70th anniversary celebration of the Arkansas Governor's Mansion. Thank you to former Governors Jim Guy Tucker, @GovMikeHuckabee, & @MikeBeebeAR, First Ladies, & their family members for joining us on this special day. pic.twitter.com/7DvNO0AnLu","['arfirstlady', 'govmikehuckabee', 'mikebeebear']",[],"['https://pbs.twimg.com/media/EP4zgMbWAAAloiI.jpg', 'https://pbs.twimg.com/media/EP4zgMZWsAATeX1.jpg', 'https://pbs.twimg.com/media/EP4zgMcWsAAHc7j.jpg', 'https://pbs.twimg.com/media/EP4zgMfXsAAwNj0.jpg']",4,18,141,[],[],https://twitter.com/AsaHutchinson/status/1224472794240602119,False,,0,,,,,,,"[{'user_id': '269992801', 'username': 'AsaHutchinson'}, {'user_id': '3070146696', 'username': 'ARFirstLady'}, {'user_id': '15416505', 'username': 'GovMikeHuckabee'}, {'user_id': '39556712', 'username': 'MikeBeebeAR'}]",,,,
1224371969275109377,1224371969275109377,1580747999000,2020-02-03,11:39:59,EDT,269992801,asahutchinson,Gov. Asa Hutchinson,,LIVE: 70th Anniversary Celebration of the Governor’s Mansion Press Conference https://www.youtube.com/watch?v=X7Yt6R7n8ss …,[],['https://www.youtube.com/watch?v=X7Yt6R7n8ss'],[],0,4,15,[],[],https://twitter.com/AsaHutchinson/status/1224371969275109377,False,,0,,,,,,,"[{'user_id': '269992801', 'username': 'AsaHutchinson'}]",,,,
1223969321468100609,1223969321468100609,1580652001000,2020-02-02,09:00:01,EDT,269992801,asahutchinson,Gov. Asa Hutchinson,,Have a blessed Sunday! pic.twitter.com/RkXoLX8rtv,[],[],['https://pbs.twimg.com/media/EPpUO4vW4AAEz6E.jpg'],1,9,60,[],[],https://twitter.com/AsaHutchinson/status/1223969321468100609,False,,0,,,,,,,"[{'user_id': '269992801', 'username': 'AsaHutchinson'}]",,,,
1223604344592961536,1223604344592961536,1580564983000,2020-02-01,08:49:43,EDT,269992801,asahutchinson,Gov. Asa Hutchinson,,"February is Career and Technical Education Month in Arkansas. Career and technical education offers students the opportunity to gain the academic, technical, and employability skills necessary for true career readiness.  https://governor.arkansas.gov/images/uploads/proclamations/200201_2020_Career_and_Technical_Education_Month_in_Arkansas.pdf …",[],['https://governor.arkansas.gov/images/uploads/proclamations/200201_2020_Career_and_Technical_Education_Month_in_Arkansas.pdf'],[],2,34,86,[],[],https://twitter.com/AsaHutchinson/status/1223604344592961536,False,,0,,,,,,,"[{'user_id': '269992801', 'username': 'AsaHutchinson'}]",,,,
1223388690296332289,1223388690296332289,1580513567000,2020-01-31,18:32:47,EDT,269992801,asahutchinson,Gov. Asa Hutchinson,,"In Arkansas, we have fostered an environment for tech innovation and recognize that the commercialization of technology drives our global economies. NWA @PlugandPlayTC inspires and supports innovation across our state and region. pic.twitter.com/bOMAbuLO0P",['plugandplaytc'],[],"['https://pbs.twimg.com/media/EPpZhqxWAAAh20W.jpg', 'https://pbs.twimg.com/media/EPpZhqxXkAYpGiW.jpg', 'https://pbs.twimg.com/media/EPpZhr2X4AAxpp8.jpg']",0,3,25,[],[],https://twitter.com/AsaHutchinson/status/1223388690296332289,False,,0,,,,,,,"[{'user_id': '269992801', 'username': 'AsaHutchinson'}, {'user_id': '17392100', 'username': 'PlugandPlayTC'}]",,,,
1223385265630334978,1223385265630334978,1580512751000,2020-01-31,18:19:11,EDT,269992801,asahutchinson,Gov. Asa Hutchinson,,"In this week’s radio address, I share my thoughts about Forrest Wood, one of Arkansas’s great outdoorsmen, conservationists, and entrepreneurs. Learn about his life and legacy here:  https://governor.arkansas.gov/news-media/weekly-address/forrest-l-wood-an-exceptional-arkansan … pic.twitter.com/K3NKXHup9f",[],['https://governor.arkansas.gov/news-media/weekly-address/forrest-l-wood-an-exceptional-arkansan'],['https://pbs.twimg.com/media/EPpWaUEWsAE5nJt.jpg'],0,2,5,[],[],https://twitter.com/AsaHutchinson/status/1223385265630334978,False,,0,,,,,,,"[{'user_id': '269992801', 'username': 'AsaHutchinson'}]",,,,
1223340400485728256,1223340400485728256,1580502054000,2020-01-31,15:20:54,EDT,269992801,asahutchinson,Gov. Asa Hutchinson,,"Coming out of a technology summit at Crystal Bridges, I got to meet some bright young students from ⁦@lrsd⁩ with two wonderful teachers pic.twitter.com/epPhdPUYVa",['lrsd'],[],['https://pbs.twimg.com/media/EPotmquX0AEids4.jpg'],2,1,32,[],[],https://twitter.com/AsaHutchinson/status/1223340400485728256,False,,0,,,,,,,"[{'user_id': '269992801', 'username': 'AsaHutchinson'}, {'user_id': '20098129', 'username': 'lrsd'}]",,,,
1223270678398455808,1223270678398455808,1580485431000,2020-01-31,10:43:51,EDT,269992801,asahutchinson,Gov. Asa Hutchinson,,"Don't miss your opportunity to be part of our 2020 Summer Internship Program. Click here to apply by March 1, 2020:  https://governor.arkansas.gov/our-office/internships … pic.twitter.com/2euR54tl0x",[],['https://governor.arkansas.gov/our-office/internships'],['https://pbs.twimg.com/media/EPnuMsIW4AAcCpL.jpg'],1,8,8,[],[],https://twitter.com/AsaHutchinson/status/1223270678398455808,False,,0,,,,,,,"[{'user_id': '269992801', 'username': 'AsaHutchinson'}]",,,,
1223096570658291712,1223096570658291712,1580443921000,2020-01-30,23:12:01,EDT,269992801,asahutchinson,Gov. Asa Hutchinson,,Pretty excited for Asa4 tonight. https://twitter.com/drurypanthers/status/1223091977450860544 …,[],['https://twitter.com/drurypanthers/status/1223091977450860544'],[],5,9,170,[],[],https://twitter.com/AsaHutchinson/status/1223096570658291712,False,https://twitter.com/drurypanthers/status/1223091977450860544,0,,,,,,,"[{'user_id': '269992801', 'username': 'AsaHutchinson'}]",,,,
