id,conversation_id,created_at,date,time,timezone,user_id,username,name,place,tweet,mentions,urls,photos,replies_count,retweets_count,likes_count,hashtags,cashtags,link,retweet,quote_url,video,near,geo,source,user_rt_id,user_rt,retweet_id,reply_to,retweet_date,translate,trans_src,trans_dest
1244027141236260875,1244027141236260875,1585434158000,2020-03-28,18:22:38,EDT,1070083706822438912,govmlg,Michelle Lujan Grisham,,"A positive note: As of today, there are 26 COVID-19 cases designated as having recovered by the New Mexico Department of Health.

We will get through this public health emergency together.

Stay home. Wash your hands. Be kind.

#AllTogetherNM #StayHomeSaveLives pic.twitter.com/CFU55si0YK",[],[],['https://pbs.twimg.com/media/EUOr0cQUwAAd-1G.jpg'],55,305,1336,"['#alltogethernm', '#stayhomesavelives']",[],https://twitter.com/GovMLG/status/1244027141236260875,False,,0,,,,,,,"[{'user_id': '1070083706822438912', 'username': 'GovMLG'}]",,,,
1244016007754080256,1244016006244130817,1585431503000,2020-03-28,17:38:23,EDT,1070083706822438912,govmlg,Michelle Lujan Grisham,,"My prayers are with the family of this New Mexican. I ask all New Mexicans to include the sick and their families in their thoughts – as well as the health care workers and those others on the front lines helping protect us from this virus.

Stay home. Save lives. #AllTogetherNM",[],[],[],6,25,138,['#alltogethernm'],[],https://twitter.com/GovMLG/status/1244016007754080256,False,,0,,,,,,,"[{'user_id': '1070083706822438912', 'username': 'GovMLG'}]",,,,
1244016006244130817,1244016006244130817,1585431503000,2020-03-28,17:38:23,EDT,1070083706822438912,govmlg,Michelle Lujan Grisham,,"State health officials have announced today 17 additional cases of COVID-19 in New Mexico, currently totaling 208 positive tests statewide. 

They have also announced one additional death related to COVID-19, bringing the total to two.

More info here:  https://bit.ly/2QPSGII  pic.twitter.com/KpF8AOy4pW",[],['https://bit.ly/2QPSGII'],"['https://pbs.twimg.com/media/EUOglBhUMAUlDin.jpg', 'https://pbs.twimg.com/media/EUOgmACU8AkZ8Ar.jpg']",13,52,104,[],[],https://twitter.com/GovMLG/status/1244016006244130817,False,,0,,,,,,,"[{'user_id': '1070083706822438912', 'username': 'GovMLG'}]",,,,
1243986243974643714,1243986243974643714,1585424407000,2020-03-28,15:40:07,EDT,1070083706822438912,govmlg,Michelle Lujan Grisham,,"The only way to save lives & not overwhelm our healthcare system is by slowing the spread of COVID-19.

The only way to slow the spread of COVID-19 is by staying home & minimizing person-to-person contact.

New Mexicans are instructed to stay home unless absolutely essential. pic.twitter.com/a00b5VdccP",[],[],['https://pbs.twimg.com/media/EUOGjWuUUAEXAcf.jpg'],22,134,409,[],[],https://twitter.com/GovMLG/status/1243986243974643714,False,,0,,,,,,,"[{'user_id': '1070083706822438912', 'username': 'GovMLG'}]",,,,
1243952460126810118,1243952456553205761,1585416352000,2020-03-28,13:25:52,EDT,1070083706822438912,govmlg,Michelle Lujan Grisham,,"Please be kind and patient with @NMDWS staff. They are working around the clock to assist New Mexicans during this trying time.

Remember: the most efficient method to file for unemployment insurance is online at  http://www.jobs.state.nm.us ",['nmdws'],['http://www.jobs.state.nm.us'],[],2,12,35,[],[],https://twitter.com/GovMLG/status/1243952460126810118,False,,0,,,,,,,"[{'user_id': '1070083706822438912', 'username': 'GovMLG'}, {'user_id': '913535713', 'username': 'NMDWS'}]",,,,
1243952459141115904,1243952456553205761,1585416352000,2020-03-28,13:25:52,EDT,1070083706822438912,govmlg,Michelle Lujan Grisham,,"Filing later in the week will not delay payments or affect the date of an individual’s claim – all claims are effective on the Sunday of the week in which they are filed. The Operations Center is available Monday-Friday, 8:00 a.m. to 4:30 p.m.",[],[],[],2,7,27,[],[],https://twitter.com/GovMLG/status/1243952459141115904,False,,0,,,,,,,"[{'user_id': '1070083706822438912', 'username': 'GovMLG'}]",,,,
1243952458222600192,1243952456553205761,1585416352000,2020-03-28,13:25:52,EDT,1070083706822438912,govmlg,Michelle Lujan Grisham,,"If you’re calling the Unemployment Insurance Operations Center, you will have a designated day to call based on the last number of your Social Security Number:

0 – 3 : Monday
4 – 6 : Tuesday
7 – 9 : Wednesday
Missed your day: Thursday and Friday",[],[],[],3,6,25,[],[],https://twitter.com/GovMLG/status/1243952458222600192,False,,0,,,,,,,"[{'user_id': '1070083706822438912', 'username': 'GovMLG'}]",,,,
1243952456553205761,1243952456553205761,1585416351000,2020-03-28,13:25:51,EDT,1070083706822438912,govmlg,Michelle Lujan Grisham,,"Important information from @NMDWS today to streamline the filing system for unemployment insurance:

PLEASE start by filing online at  http://www.jobs.state.nm.us  if you are able. This ensures that those who can't get online can still access their resources via the phone lines. pic.twitter.com/IQncdToZuQ",['nmdws'],['http://www.jobs.state.nm.us'],['https://pbs.twimg.com/media/EUNmLn4U4AAkWlz.jpg'],9,35,62,[],[],https://twitter.com/GovMLG/status/1243952456553205761,False,,0,,,,,,,"[{'user_id': '1070083706822438912', 'username': 'GovMLG'}, {'user_id': '913535713', 'username': 'NMDWS'}]",,,,
1243943541346152448,1243943541346152448,1585414226000,2020-03-28,12:50:26,EDT,1070083706822438912,govmlg,Michelle Lujan Grisham,,"The only thing we can do to slow the spread of COVID-19 is stay home.

The health of your community depends on you.

Protect yourself and your fellow New Mexicans: STAY HOME.

We're in this together, and we will get through this together.

#StayHomeSaveLives #AllTogetherNM pic.twitter.com/wbGFqI2weQ",[],[],[],35,134,445,"['#stayhomesavelives', '#alltogethernm']",[],https://twitter.com/GovMLG/status/1243943541346152448,False,,1,,,,,,,"[{'user_id': '1070083706822438912', 'username': 'GovMLG'}]",,,,
1243933024833564673,1243933024833564673,1585411718000,2020-03-28,12:08:38,EDT,1070083706822438912,govmlg,Michelle Lujan Grisham,,Did you miss my update yesterday evening? No worries – you can watch it right here:  https://www.facebook.com/GovMLG/videos/877285956090614/ … https://twitter.com/GovMLG/status/1243668245422305280 …,[],"['https://www.facebook.com/GovMLG/videos/877285956090614/', 'https://twitter.com/GovMLG/status/1243668245422305280']",[],7,19,89,[],[],https://twitter.com/GovMLG/status/1243933024833564673,False,https://twitter.com/GovMLG/status/1243668245422305280,0,,,,,,,"[{'user_id': '1070083706822438912', 'username': 'GovMLG'}]",,,,
1243674757616160768,1243674757616160768,1585350143000,2020-03-27,19:02:23,EDT,1070083706822438912,govmlg,Michelle Lujan Grisham,,Live now! Tune in:  http://facebook.com/GovMLG/  https://twitter.com/GovMLG/status/1243668245422305280 …,[],"['http://facebook.com/GovMLG/', 'https://twitter.com/GovMLG/status/1243668245422305280']",[],7,10,61,[],[],https://twitter.com/GovMLG/status/1243674757616160768,False,https://twitter.com/GovMLG/status/1243668245422305280,0,,,,,,,"[{'user_id': '1070083706822438912', 'username': 'GovMLG'}]",,,,
1243668245422305280,1243668245422305280,1585348590000,2020-03-27,18:36:30,EDT,1070083706822438912,govmlg,Michelle Lujan Grisham,,Hey New Mexico – I’m jumping on Facebook live around 5pm tonight to talk directly to you about the changes we’ve seen in the past few days and the state’s response to COVID-19. You don’t have to have a Facebook account to watch – tune in here:  http://www.facebook.com/GovMLG/ ,[],['http://www.facebook.com/GovMLG/'],[],44,67,276,[],[],https://twitter.com/GovMLG/status/1243668245422305280,False,,0,,,,,,,"[{'user_id': '1070083706822438912', 'username': 'GovMLG'}]",,,,
1243664174145613824,1243664174145613824,1585347619000,2020-03-27,18:20:19,EDT,1070083706822438912,govmlg,Michelle Lujan Grisham,,"State health officials have announced today 55 additional cases of COVID-19 in New Mexico, currently totaling 191 positive tests statewide.

More information here:  https://bit.ly/2WNdi81 

This is the largest jump in cases yet. This does not mean panic – it means stay home. pic.twitter.com/iB8gwJsuWD",[],['https://bit.ly/2WNdi81'],"['https://pbs.twimg.com/media/EUJhHiTU8AEeeOI.jpg', 'https://pbs.twimg.com/media/EUJhIePUYAE-ZWM.jpg']",37,115,252,[],[],https://twitter.com/GovMLG/status/1243664174145613824,False,,0,,,,,,,"[{'user_id': '1070083706822438912', 'username': 'GovMLG'}]",,,,
1243644002538151937,1243643999274954752,1585342810000,2020-03-27,17:00:10,EDT,1070083706822438912,govmlg,Michelle Lujan Grisham,,"Despite the best efforts of our state and local governments and the citizens of New Mexico, COVID-19 has continued to spread and ongoing efforts are still necessary to mitigate and contain the spread of the virus.

Find more information here:  https://bit.ly/33Pczom ",[],['https://bit.ly/33Pczom'],[],8,19,73,[],[],https://twitter.com/GovMLG/status/1243644002538151937,False,,0,,,,,,,"[{'user_id': '1070083706822438912', 'username': 'GovMLG'}]",,,,
1243644001355362313,1243643999274954752,1585342810000,2020-03-27,17:00:10,EDT,1070083706822438912,govmlg,Michelle Lujan Grisham,,The majority of confirmed cases of COVID-19 in New Mexico have resulted from interstate and international travel into the state. Some individuals infected with COVID-19 are asymptomatic or have very mild symptoms and may be unaware they are traveling into NM carrying the virus.,[],[],[],10,30,94,[],[],https://twitter.com/GovMLG/status/1243644001355362313,False,,0,,,,,,,"[{'user_id': '1070083706822438912', 'username': 'GovMLG'}]",,,,
1243643999274954752,1243643999274954752,1585342809000,2020-03-27,17:00:09,EDT,1070083706822438912,govmlg,Michelle Lujan Grisham,,Today I issued an executive order requiring anyone traveling into New Mexico by plane to self-isolate for at least 14 days in order to help combat the spread of COVID-19. Those who fail to voluntarily self-isolate will be subject to forced isolation or quarantine by @NMDOH. pic.twitter.com/XHKSZTKQyU,['nmdoh'],[],['https://pbs.twimg.com/media/EUJOW1iUYAAK_Ur.jpg'],52,117,347,[],[],https://twitter.com/GovMLG/status/1243643999274954752,False,,0,,,,,,,"[{'user_id': '1070083706822438912', 'username': 'GovMLG'}, {'user_id': '1465196934', 'username': 'NMDOH'}]",,,,
1243608446882074624,1243608439869194240,1585334333000,2020-03-27,14:38:53,EDT,1070083706822438912,govmlg,Michelle Lujan Grisham,,"We will get through this together.

Stay home unless absolutely essential. 

Be kind to one another.

The more we do now to slow the spread of COVID-19, the sooner we will come out on the other side.

#AllTogetherNM pic.twitter.com/qyAckb4CjV",[],[],['https://pbs.twimg.com/media/EUIuuKrXYAAh0X3.jpg'],2,16,86,['#alltogethernm'],[],https://twitter.com/GovMLG/status/1243608446882074624,False,,0,,,,,,,"[{'user_id': '1070083706822438912', 'username': 'GovMLG'}]",,,,
1243608445841846278,1243608439869194240,1585334333000,2020-03-27,14:38:53,EDT,1070083706822438912,govmlg,Michelle Lujan Grisham,,We all have to fill the void left by the lack of schools keeping an eye out for vulnerable children – be extra aware of their safety & well-being. Anyone can report suspected child abuse or neglect by dialing #SAFE from a cell phone or by calling 1-855-333-SAFE from a landline.,[],[],[],1,27,82,['#safe'],[],https://twitter.com/GovMLG/status/1243608445841846278,False,,0,,,,,,,"[{'user_id': '1070083706822438912', 'username': 'GovMLG'}]",,,,
1243608444688424960,1243608439869194240,1585334332000,2020-03-27,14:38:52,EDT,1070083706822438912,govmlg,Michelle Lujan Grisham,,"School-based health centers, educational programming for youth in facilities, and licensed child care facilities (centers and homes) serving workers whose jobs have been deemed essential will all continue to operate.",[],[],[],2,7,24,[],[],https://twitter.com/GovMLG/status/1243608444688424960,False,,0,,,,,,,"[{'user_id': '1070083706822438912', 'username': 'GovMLG'}]",,,,
1243608443644071936,1243608439869194240,1585334332000,2020-03-27,14:38:52,EDT,1070083706822438912,govmlg,Michelle Lujan Grisham,,"Additionally, @NMPED is seeking permission to distribute Electronic Benefits Transfer cards that would allow qualifying families to purchase meals with their free breakfast/lunch allotment. New Mexico children will continue to be fed.",['nmped'],[],[],1,8,27,[],[],https://twitter.com/GovMLG/status/1243608443644071936,False,,0,,,,,,,"[{'user_id': '1070083706822438912', 'username': 'GovMLG'}, {'user_id': '2533050750', 'username': 'NMPED'}]",,,,
1243608442465472512,1243608439869194240,1585334332000,2020-03-27,14:38:52,EDT,1070083706822438912,govmlg,Michelle Lujan Grisham,,"Every New Mexico school district has a plan to continue providing childhood nutrition during this period. In the past weeks, we have seen communities come together in truly incredible ways to ensure that kids are fed. You can find district meal info here:  https://bit.ly/3dwCPs1 ",[],['https://bit.ly/3dwCPs1'],[],1,5,25,[],[],https://twitter.com/GovMLG/status/1243608442465472512,False,,0,,,,,,,"[{'user_id': '1070083706822438912', 'username': 'GovMLG'}]",,,,
1243608441379151872,1243608439869194240,1585334332000,2020-03-27,14:38:52,EDT,1070083706822438912,govmlg,Michelle Lujan Grisham,,School districts will be developing continuous learning plans. High school credits will be awarded based on flexible approaches. Seniors will demonstrate eligibility for graduation. Actual graduation ceremonies will be postponed or held virtually as health conditions warrant.,[],[],[],2,4,37,[],[],https://twitter.com/GovMLG/status/1243608441379151872,False,,0,,,,,,,"[{'user_id': '1070083706822438912', 'username': 'GovMLG'}]",,,,
1243608439869194240,1243608439869194240,1585334331000,2020-03-27,14:38:51,EDT,1070083706822438912,govmlg,Michelle Lujan Grisham,,"I do not take the decision to close schools lightly – but we are in unprecedented, trying times.
 
While school closures have been extended, the state and its school districts will not be abandoning New Mexico's students, families, and education staff.
 
We are #AllTogetherNM pic.twitter.com/YVGFsrnRjp",[],[],['https://pbs.twimg.com/media/EUIuHNWXYAAavbk.jpg'],18,49,240,['#alltogethernm'],[],https://twitter.com/GovMLG/status/1243608439869194240,False,,0,,,,,,,"[{'user_id': '1070083706822438912', 'username': 'GovMLG'}]",,,,
1243576483722825728,1243576480698793984,1585326712000,2020-03-27,12:31:52,EDT,1070083706822438912,govmlg,Michelle Lujan Grisham,,"We are in unprecedented times. Public health is our first & foremost priority. We will keep doing everything we can to keep kids, teachers, families and workers all across New Mexico safe from this terrible virus.

More info on the closure extension here:  https://bit.ly/3butL57  pic.twitter.com/iruUeM6g3g",[],['https://bit.ly/3butL57'],['https://pbs.twimg.com/media/EUISFsWXkAIG8uV.jpg'],13,31,146,[],[],https://twitter.com/GovMLG/status/1243576483722825728,False,,0,,,,,,,"[{'user_id': '1070083706822438912', 'username': 'GovMLG'}]",,,,
1243576482682683395,1243576480698793984,1585326712000,2020-03-27,12:31:52,EDT,1070083706822438912,govmlg,Michelle Lujan Grisham,,"We know this has tremendous implications for families & students statewide. This is part of a two-pronged plan my admin. is crafting to protect New Mexicans from COVID-19 & ensure that children are protected, fed & educated & that families are supported through this crisis.",[],[],[],9,24,132,[],[],https://twitter.com/GovMLG/status/1243576482682683395,False,,0,,,,,,,"[{'user_id': '1070083706822438912', 'username': 'GovMLG'}]",,,,
1243576480698793984,1243576480698793984,1585326712000,2020-03-27,12:31:52,EDT,1070083706822438912,govmlg,Michelle Lujan Grisham,,"My administration has made the very difficult decision, in close consultation with education & health leaders, to extend public school closures through the rest of the academic year. We have to continue to take aggressive steps to mitigate the spread of COVID-19. #AllTogetherNM pic.twitter.com/5M2F7dcart",[],[],['https://pbs.twimg.com/media/EUIP_57UMAU1Zk0.jpg'],117,234,722,['#alltogethernm'],[],https://twitter.com/GovMLG/status/1243576480698793984,False,,0,,,,,,,"[{'user_id': '1070083706822438912', 'username': 'GovMLG'}]",,,,
1243298894194212865,1243298894194212865,1585260530000,2020-03-26,18:08:50,EDT,1070083706822438912,govmlg,Michelle Lujan Grisham,,"State health officials have announced today 24 additional cases of COVID-19 in New Mexico, currently totaling 136 positive tests statewide.

More information here:  https://bit.ly/3dzRdzE 

All New Mexicans are instructed to stay home unless absolutely essential. #AllTogetherNM pic.twitter.com/Btm7ld2GC7",[],['https://bit.ly/3dzRdzE'],"['https://pbs.twimg.com/media/EUEVLQqUUAEc1YF.jpg', 'https://pbs.twimg.com/media/EUEVMkNU0AAXwrO.jpg']",42,100,193,['#alltogethernm'],[],https://twitter.com/GovMLG/status/1243298894194212865,False,,0,,,,,,,"[{'user_id': '1070083706822438912', 'username': 'GovMLG'}]",,,,
1243282218174177280,1243282215464660992,1585256554000,2020-03-26,17:02:34,EDT,1070083706822438912,govmlg,Michelle Lujan Grisham,,Please join me in thanking the generous partners who have come together to establish this fund. We are #AllTogetherNM pic.twitter.com/BiJDcF40Gv,[],[],['https://pbs.twimg.com/media/EUEGV71U4AIiypg.jpg'],2,13,97,['#alltogethernm'],[],https://twitter.com/GovMLG/status/1243282218174177280,False,,0,,,,,,,"[{'user_id': '1070083706822438912', 'username': 'GovMLG'}]",,,,
1243282217175896064,1243282215464660992,1585256554000,2020-03-26,17:02:34,EDT,1070083706822438912,govmlg,Michelle Lujan Grisham,,"The #AllTogetherNM Fund will first address immediate needs including:

Food and supplies for at-risk communities

Support for childcare workers who are supporting those on the frontlines of COVID-19

Grants to address income insecurity among small businesses & employees",[],[],[],3,17,76,['#alltogethernm'],[],https://twitter.com/GovMLG/status/1243282217175896064,False,,0,,,,,,,"[{'user_id': '1070083706822438912', 'username': 'GovMLG'}]",,,,
1243282215464660992,1243282215464660992,1585256553000,2020-03-26,17:02:33,EDT,1070083706822438912,govmlg,Michelle Lujan Grisham,,I'm thrilled to announce today a new statewide fund established by the New Mexico Coalition of Community Foundations to help New Mexicans respond to and eventually recover from the COVID-19 pandemic: the #AllTogetherNM Fund. pic.twitter.com/ux0Phc0ffw,[],[],['https://pbs.twimg.com/media/EUEFAOTUwAEORTE.jpg'],9,70,271,['#alltogethernm'],[],https://twitter.com/GovMLG/status/1243282215464660992,False,,0,,,,,,,"[{'user_id': '1070083706822438912', 'username': 'GovMLG'}]",,,,
1243258925438210048,1243258925438210048,1585251001000,2020-03-26,15:30:01,EDT,1070083706822438912,govmlg,Michelle Lujan Grisham,,"It is critical that New Mexicans understand that the only way to slow the spread of COVID-19 is to stay home. 

This virus affects everyone, both young & old. Every New Mexican is susceptible.

Protect yourself & your community by staying home.

#AllTogetherNM #StayHomeSaveLives pic.twitter.com/pr45VtdDAT",[],[],['https://pbs.twimg.com/media/EUDww_fVAAAWIVv.jpg'],39,153,429,"['#alltogethernm', '#stayhomesavelives']",[],https://twitter.com/GovMLG/status/1243258925438210048,False,,0,,,,,,,"[{'user_id': '1070083706822438912', 'username': 'GovMLG'}]",,,,
1243241590765715459,1243241590765715459,1585246868000,2020-03-26,14:21:08,EDT,1070083706822438912,govmlg,Michelle Lujan Grisham,,"New Mexico continues to work to increase testing capacities statewide – I am grateful to our partners in that effort.

I will not stop advocating for additional resources & supplies from the federal government to expand testing across the state. https://nmpoliticalreport.com/2020/03/25/lab-announces-increased-covid-19-testing-capacity/ …",[],['https://nmpoliticalreport.com/2020/03/25/lab-announces-increased-covid-19-testing-capacity/'],[],23,63,314,[],[],https://twitter.com/GovMLG/status/1243241590765715459,False,,0,,,,,,,"[{'user_id': '1070083706822438912', 'username': 'GovMLG'}]",,,,
1243198565893025793,1243198564676726786,1585236610000,2020-03-26,11:30:10,EDT,1070083706822438912,govmlg,Michelle Lujan Grisham,,"However, more funding will likely be needed to manage the wide-ranging impacts of coronavirus and rebuild our economy here in New Mexico. I will continue working with the federal government to ensure that we have all needed resources. #AllTogetherNM #COVID19",[],[],[],9,9,116,"['#alltogethernm', '#covid19']",[],https://twitter.com/GovMLG/status/1243198565893025793,False,,0,,,,,,,"[{'user_id': '1070083706822438912', 'username': 'GovMLG'}]",,,,
1243198564676726786,1243198564676726786,1585236609000,2020-03-26,11:30:09,EDT,1070083706822438912,govmlg,Michelle Lujan Grisham,,I am glad there has been progress on stimulus legislation in Congress; the funding provided in this bill is critical to our efforts to immediately and proactively respond to this virus. #AllTogetherNM #COVID19 https://www.cbpp.org/blog/bipartisan-stimulus-agreement-contains-significant-funds-for-states …,[],['https://www.cbpp.org/blog/bipartisan-stimulus-agreement-contains-significant-funds-for-states'],[],9,12,114,"['#alltogethernm', '#covid19']",[],https://twitter.com/GovMLG/status/1243198564676726786,False,,0,,,,,,,"[{'user_id': '1070083706822438912', 'username': 'GovMLG'}]",,,,
1242953768745881601,1242953768745881601,1585178246000,2020-03-25,19:17:26,EDT,1070083706822438912,govmlg,Michelle Lujan Grisham,,"The hardworking state employees of the @NMDOH State Laboratory are working around the clock – literally, they are working 24/7 – to process as many COVID-19 tests as possible and get New Mexicans the essential health information they need. Please join me in thanking them! pic.twitter.com/aTgwhAhkLZ",['nmdoh'],[],['https://pbs.twimg.com/media/ET_by1EVAAAi5oT.jpg'],28,133,696,[],[],https://twitter.com/GovMLG/status/1242953768745881601,False,,0,,,,,,,"[{'user_id': '1070083706822438912', 'username': 'GovMLG'}, {'user_id': '1465196934', 'username': 'NMDOH'}]",,,,
1242940153993125888,1242940153993125888,1585175000000,2020-03-25,18:23:20,EDT,1070083706822438912,govmlg,Michelle Lujan Grisham,,"State health officials have announced today 13 additional cases of COVID-19. More information here:  https://bit.ly/2UkjYsP 

All New Mexicans are instructed to stay home unless essentially necessary. Stay home. Save lives.
#AllTogetherNM pic.twitter.com/Upxxxx8XGz",[],['https://bit.ly/2UkjYsP'],['https://pbs.twimg.com/media/ET_PN-SUwAM_e6y.jpg'],14,67,142,['#alltogethernm'],[],https://twitter.com/GovMLG/status/1242940153993125888,False,,0,,,,,,,"[{'user_id': '1070083706822438912', 'username': 'GovMLG'}]",,,,
1242904618536808453,1242904618536808453,1585166527000,2020-03-25,16:02:07,EDT,1070083706822438912,govmlg,Michelle Lujan Grisham,,"The threat of COVID-19 is real.

The only thing we can do to slow the spread is to stay home.

Protect yourself and your fellow New Mexicans: STAY HOME.

We will get through this together.

#AllTogetherNM pic.twitter.com/CcDBmFoaAU",[],[],[],37,172,486,['#alltogethernm'],[],https://twitter.com/GovMLG/status/1242904618536808453,False,,1,,,,,,,"[{'user_id': '1070083706822438912', 'username': 'GovMLG'}]",,,,
1242874765016092672,1242874765016092672,1585159410000,2020-03-25,14:03:30,EDT,1070083706822438912,govmlg,Michelle Lujan Grisham,,"In an effort to reach as many New Mexicans as possible with essential COVID-19 info, we will be using the statewide emergency alert system. The first message will go out at 12:30 p.m. today. The system is being used to get information out widely and is not a cause for alarm.",[],[],[],86,209,874,[],[],https://twitter.com/GovMLG/status/1242874765016092672,False,,0,,,,,,,"[{'user_id': '1070083706822438912', 'username': 'GovMLG'}]",,,,
1242873240218787841,1242873240218787841,1585159046000,2020-03-25,13:57:26,EDT,1070083706822438912,govmlg,Michelle Lujan Grisham,,"Important information from the Supreme Court regarding the temporary moratorium on evictions: 

Tenants will need to provide the court with evidence of their current inability to pay rent by participating in a hearing set by the judge.

More info here:  https://www.nmcourts.gov/news.aspx  https://twitter.com/GovMLG/status/1242522202257293312 …",[],"['https://www.nmcourts.gov/news.aspx', 'https://twitter.com/GovMLG/status/1242522202257293312']",[],12,35,77,[],[],https://twitter.com/GovMLG/status/1242873240218787841,False,https://twitter.com/GovMLG/status/1242522202257293312,0,,,,,,,"[{'user_id': '1070083706822438912', 'username': 'GovMLG'}]",,,,
1242844996203503616,1242844995230396416,1585152312000,2020-03-25,12:05:12,EDT,1070083706822438912,govmlg,Michelle Lujan Grisham,,"The terrible reality is that this will not be the last time that I deliver this sad news. Please take care to protect yourself and your community. Together, we will come out the other side. Together, we will get through this. #AllTogetherNM",[],[],[],12,46,348,['#alltogethernm'],[],https://twitter.com/GovMLG/status/1242844996203503616,False,,0,,,,,,,"[{'user_id': '1070083706822438912', 'username': 'GovMLG'}]",,,,
1242844995230396416,1242844995230396416,1585152312000,2020-03-25,12:05:12,EDT,1070083706822438912,govmlg,Michelle Lujan Grisham,,It brings me great sorrow to tell you that we have lost a New Mexican to COVID-19. My thoughts and prayers are with the family and friends who are grieving this sudden loss.,[],[],[],58,187,1062,[],[],https://twitter.com/GovMLG/status/1242844995230396416,False,,0,,,,,,,"[{'user_id': '1070083706822438912', 'username': 'GovMLG'}]",,,,
