id,conversation_id,created_at,date,time,timezone,user_id,username,name,place,tweet,mentions,urls,photos,replies_count,retweets_count,likes_count,hashtags,cashtags,link,retweet,quote_url,video,near,geo,source,user_rt_id,user_rt,retweet_id,reply_to,retweet_date,translate,trans_src,trans_dest
1237461905502949377,1237461905502949377,1583868883000,2020-03-10,15:34:43,EDT,1070083706822438912,govmlg,Michelle Lujan Grisham,,"I was incredibly proud to sign House Bill 292, making New Mexico insulin costs the lowest in the country and ending an unacceptable dilemma for thousands of New Mexicans with diabetes forced to choose between life-saving insulin and other expenses. #NMgov #NMleg #HB292 pic.twitter.com/ETL7FaOhMz",[],[],['https://pbs.twimg.com/media/ESxYiZrUMAAdEo7.jpg'],9,33,182,"['#nmgov', '#nmleg', '#hb292']",[],https://twitter.com/GovMLG/status/1237461905502949377,False,,0,,,,,,,"[{'user_id': '1070083706822438912', 'username': 'GovMLG'}]",,,,
1237129082279612417,1237129082279612417,1583789532000,2020-03-09,17:32:12,EDT,1070083706822438912,govmlg,Michelle Lujan Grisham,,"No child should ever go hungry. While we continue to combat child hunger across the state, House Bill 10 will ensure that over 12,000 additional New Mexico children are guaranteed meals at school. #NMgov #NMleg #HB10 pic.twitter.com/sNiaBYH64k",[],[],['https://pbs.twimg.com/media/ESspxfzU8AASHCx.jpg'],9,21,69,"['#nmgov', '#nmleg', '#hb10']",[],https://twitter.com/GovMLG/status/1237129082279612417,False,,0,,,,,,,"[{'user_id': '1070083706822438912', 'username': 'GovMLG'}]",,,,
1237108416536969217,1237108416536969217,1583784605000,2020-03-09,16:10:05,EDT,1070083706822438912,govmlg,Michelle Lujan Grisham,,"Thanks @SenatorTomUdall! Don't forget: just like with many other illnesses, the best way to protect yourself is to wash your hands regularly, to cough or sneeze into your sleeve or a tissue, and when possible, to avoid contact with people who are coughing or sneezing. #NMgov https://twitter.com/SenatorTomUdall/status/1237086944120750080 …",['senatortomudall'],['https://twitter.com/SenatorTomUdall/status/1237086944120750080'],[],10,12,31,['#nmgov'],[],https://twitter.com/GovMLG/status/1237108416536969217,False,https://twitter.com/SenatorTomUdall/status/1237086944120750080,0,,,,,,,"[{'user_id': '1070083706822438912', 'username': 'GovMLG'}, {'user_id': '60828944', 'username': 'SenatorTomUdall'}]",,,,
1237108030606422017,1237108030606422017,1583784513000,2020-03-09,16:08:33,EDT,1070083706822438912,govmlg,Michelle Lujan Grisham,,New Mexico is THE place to be for film and TV! #NMfilm https://twitter.com/ABQFilmOffice/status/1237085851261136896 …,[],['https://twitter.com/ABQFilmOffice/status/1237085851261136896'],[],18,41,245,['#nmfilm'],[],https://twitter.com/GovMLG/status/1237108030606422017,False,https://twitter.com/ABQFilmOffice/status/1237085851261136896,0,,,,,,,"[{'user_id': '1070083706822438912', 'username': 'GovMLG'}]",,,,
1237099846047166464,1237099029781069824,1583782562000,2020-03-09,15:36:02,EDT,1070083706822438912,govmlg,Michelle Lujan Grisham,,Stay up to date on the actions @NMDOH is taking and best practices to stay healthy:  https://cv.nmhealth.org/ ,['nmdoh'],['https://cv.nmhealth.org/'],[],0,10,26,[],[],https://twitter.com/GovMLG/status/1237099846047166464,False,,0,,,,,,,"[{'user_id': '1070083706822438912', 'username': 'GovMLG'}, {'user_id': '1465196934', 'username': 'NMDOH'}]",,,,
1237099029781069824,1237099029781069824,1583782367000,2020-03-09,15:32:47,EDT,1070083706822438912,govmlg,Michelle Lujan Grisham,,I was glad to join governors from around the country this morning on a conference call with @VP Pence & @CDCgov officials for an update on the federal response to the COVID-19 #coronavirus. @NMDOH is ensuring that New Mexico is mobilized and prepared for any potential outbreak. pic.twitter.com/lqFbQhOqXS,"['vp', 'cdcgov', 'nmdoh']",[],['https://pbs.twimg.com/media/ESsOkryUMAIeC6v.jpg'],21,140,396,['#coronavirus'],[],https://twitter.com/GovMLG/status/1237099029781069824,False,,0,,,,,,,"[{'user_id': '1070083706822438912', 'username': 'GovMLG'}, {'user_id': '818910970567344128', 'username': 'VP'}, {'user_id': '146569971', 'username': 'CDCgov'}, {'user_id': '1465196934', 'username': 'NMDOH'}]",,,,
1237036211568427008,1237036209806794757,1583767390000,2020-03-09,11:23:10,EDT,1070083706822438912,govmlg,Michelle Lujan Grisham,,The @NMDOH dedicated COVID-19 website is updated regularly and includes the most recent information and best practices to keep yourself and your community healthy:  https://cv.nmhealth.org/ ,['nmdoh'],['https://cv.nmhealth.org/'],[],0,12,22,[],[],https://twitter.com/GovMLG/status/1237036211568427008,False,,0,,,,,,,"[{'user_id': '1070083706822438912', 'username': 'GovMLG'}, {'user_id': '1465196934', 'username': 'NMDOH'}]",,,,
1237036209806794757,1237036209806794757,1583767390000,2020-03-09,11:23:10,EDT,1070083706822438912,govmlg,Michelle Lujan Grisham,,"There continue to be zero confirmed cases of the COVID-19 #coronavirus in New Mexico. @NMDOH has processed tests from people across the state, all of which have been negative, and has activated the Department Operations Center to further support ongoing readiness. #NMgov pic.twitter.com/haA6MaqNDU",['nmdoh'],[],['https://pbs.twimg.com/media/ESrVvVSUMAIAjnQ.png'],15,41,148,"['#coronavirus', '#nmgov']",[],https://twitter.com/GovMLG/status/1237036209806794757,False,,0,,,,,,,"[{'user_id': '1070083706822438912', 'username': 'GovMLG'}, {'user_id': '1465196934', 'username': 'NMDOH'}]",,,,
1236781301950115841,1236781301950115841,1583706615000,2020-03-08,18:30:15,EDT,1070083706822438912,govmlg,Michelle Lujan Grisham,,"I'm proud to work every day to build a brighter tomorrow for New Mexicans like my granddaughter, Avery. On #InternationalWomensDay, I'm thinking of her and the incredible future that she has ahead of her because of the strong women who have blazed paths before her. pic.twitter.com/ua3tRxySo8",[],[],['https://pbs.twimg.com/media/ESntbXFUYAE4vmP.jpg'],12,21,192,['#internationalwomensday'],[],https://twitter.com/GovMLG/status/1236781301950115841,False,,0,,,,,,,"[{'user_id': '1070083706822438912', 'username': 'GovMLG'}]",,,,
1236081737966309378,1236081737966309378,1583539826000,2020-03-06,19:10:26,EDT,1070083706822438912,govmlg,Michelle Lujan Grisham,,"I’ve been signing many pieces of hard-fought legislation this week! My administration is all about transparency and access to information – you can see all legislation that I’ve signed listed on my website:  http://bit.ly/2VXSHO9 
#NMgov #NMleg pic.twitter.com/n8WG8Cw7D7",[],['http://bit.ly/2VXSHO9'],['https://pbs.twimg.com/media/ESdxootU0AA7LSq.jpg'],30,13,62,"['#nmgov', '#nmleg']",[],https://twitter.com/GovMLG/status/1236081737966309378,False,,0,,,,,,,"[{'user_id': '1070083706822438912', 'username': 'GovMLG'}]",,,,
1236034290464329728,1236034286249074689,1583528513000,2020-03-06,16:01:53,EDT,1070083706822438912,govmlg,Michelle Lujan Grisham,,"Read more about these three child welfare bills:
 http://bit.ly/2InzuNN ",[],['http://bit.ly/2InzuNN'],[],1,0,4,[],[],https://twitter.com/GovMLG/status/1236034290464329728,False,,0,,,,,,,"[{'user_id': '1070083706822438912', 'username': 'GovMLG'}]",,,,
1236034288560164864,1236034286249074689,1583528513000,2020-03-06,16:01:53,EDT,1070083706822438912,govmlg,Michelle Lujan Grisham,,"Today I was glad to sign three bills into law to support New Mexico children and young adults, addressing family and kinship foster caregivers, providing vital support for foster children up to age 21, and ensuring that students transferring schools retain credit for their work. pic.twitter.com/wP2VnmsjZq",[],[],"['https://pbs.twimg.com/media/ESdGZJuUYAAgqH_.jpg', 'https://pbs.twimg.com/media/ESdGnCZUEAA1sqi.jpg']",3,5,23,[],[],https://twitter.com/GovMLG/status/1236034288560164864,False,,0,,,,,,,"[{'user_id': '1070083706822438912', 'username': 'GovMLG'}]",,,,
1236034286249074689,1236034286249074689,1583528512000,2020-03-06,16:01:52,EDT,1070083706822438912,govmlg,Michelle Lujan Grisham,,"This administration and this Legislature agree that taking care of children, especially our most vulnerable children, is Job No. 1. Anything the state can do to ease the burden on children in foster care or those aging out of it, we will do, and so we are. pic.twitter.com/7hBZunyJgn",[],[],['https://pbs.twimg.com/media/ESdGV0aU0AEGHs1.jpg'],14,9,47,[],[],https://twitter.com/GovMLG/status/1236034286249074689,False,,0,,,,,,,"[{'user_id': '1070083706822438912', 'username': 'GovMLG'}]",,,,
1236006806679216128,1236006804305281024,1583521961000,2020-03-06,14:12:41,EDT,1070083706822438912,govmlg,Michelle Lujan Grisham,,"There is no world I can imagine in which it would be right to discriminate against a woman for becoming a mother, forcing them to choose between a safe, healthy pregnancy or the paycheck they need to support their family. In New Mexico, that ends today.
📰: http://bit.ly/2vB3zqr ",[],['http://bit.ly/2vB3zqr'],[],4,15,41,[],[],https://twitter.com/GovMLG/status/1236006806679216128,False,,0,,,,,,,"[{'user_id': '1070083706822438912', 'username': 'GovMLG'}]",,,,
1236006804305281024,1236006804305281024,1583521960000,2020-03-06,14:12:40,EDT,1070083706822438912,govmlg,Michelle Lujan Grisham,,"It's always a good feeling to be able to sign legislation into law that does what is so clearly the right thing to do. That's how I felt this morning when I signed House Bill 25, protecting pregnant women and new mothers from workplace discrimination in New Mexico.
#NMgov #NMleg pic.twitter.com/SMT9bc5Iw0",[],[],"['https://pbs.twimg.com/media/ESctWrYU8AERG9l.jpg', 'https://pbs.twimg.com/media/ESctXg4UEAA5irT.jpg']",9,37,163,"['#nmgov', '#nmleg']",[],https://twitter.com/GovMLG/status/1236006804305281024,False,,0,,,,,,,"[{'user_id': '1070083706822438912', 'username': 'GovMLG'}]",,,,
1235663954015211521,1235663954015211521,1583440218000,2020-03-05,15:30:18,EDT,1070083706822438912,govmlg,Michelle Lujan Grisham,,"The #2020Census will affect federal funding in New Mexico for:

🏫 School funding
🛣️ Roads & infrastructure
🥫 Food assistance
🏥 Health care

Do your part to ensure continued funding for critical programs & services in your community by getting counted! https://2020census.gov/en ",[],['https://2020census.gov/en'],[],15,23,56,['#2020census'],[],https://twitter.com/GovMLG/status/1235663954015211521,False,,0,,,,,,,"[{'user_id': '1070083706822438912', 'username': 'GovMLG'}]",,,,
1235643097389789184,1235643096039227392,1583435246000,2020-03-05,14:07:26,EDT,1070083706822438912,govmlg,Michelle Lujan Grisham,,"Reinstating the solar tax credit will create more renewable energy jobs, reduce emissions in the electricity sector and save New Mexicans money on their electricity bills. Making solar power more accessible to will be yet another tool that enables us to address climate change.",[],[],[],3,2,10,[],[],https://twitter.com/GovMLG/status/1235643097389789184,False,,0,,,,,,,"[{'user_id': '1070083706822438912', 'username': 'GovMLG'}]",,,,
1235643096039227392,1235643096039227392,1583435245000,2020-03-05,14:07:25,EDT,1070083706822438912,govmlg,Michelle Lujan Grisham,,"When the previous solar tax credit expired, jobs in the solar energy industry declined by 25% across the state. I was glad to reinstate the solar tax credit this year and enable New Mexicans to better afford to install solar on residences and businesses. https://www.abqjournal.com/1427746/solar-market-shining-brighter-again-in-new-mexico.html …",[],['https://www.abqjournal.com/1427746/solar-market-shining-brighter-again-in-new-mexico.html'],[],6,12,46,[],[],https://twitter.com/GovMLG/status/1235643096039227392,False,,0,,,,,,,"[{'user_id': '1070083706822438912', 'username': 'GovMLG'}]",,,,
1235343210987302912,1235343152996913160,1583363747000,2020-03-04,18:15:47,EDT,1070083706822438912,govmlg,Michelle Lujan Grisham,,"For the latest information about the COVID-19 virus in New Mexico, visit NMDOH's novel coronavirus webpage:  https://cv.nmhealth.org/ ",[],['https://cv.nmhealth.org/'],[],5,5,20,[],[],https://twitter.com/GovMLG/status/1235343210987302912,False,,0,,,,,,,"[{'user_id': '1070083706822438912', 'username': 'GovMLG'}]",,,,
1235343152996913160,1235343152996913160,1583363733000,2020-03-04,18:15:33,EDT,1070083706822438912,govmlg,Michelle Lujan Grisham,,"There continue to be zero confirmed cases of the COVID-19 coronavirus in New Mexico, which we are equipped to test for. While New Mexicans should certainly be informed, there is no reason to be panicked. @NMDOH continues to monitor the situation. https://www.abqjournal.com/1427467/governor-nm-prepared-for-coronavirus-but-no-cases-so-far.html …",['nmdoh'],['https://www.abqjournal.com/1427467/governor-nm-prepared-for-coronavirus-but-no-cases-so-far.html'],[],25,39,128,[],[],https://twitter.com/GovMLG/status/1235343152996913160,False,,0,,,,,,,"[{'user_id': '1070083706822438912', 'username': 'GovMLG'}, {'user_id': '1465196934', 'username': 'NMDOH'}]",,,,
1235303029479542785,1235303021686542337,1583354167000,2020-03-04,15:36:07,EDT,1070083706822438912,govmlg,Michelle Lujan Grisham,,"I will always keep fighting to ensure that New Mexicans have access to affordable quality health care. I'm proud that this legislation will make a real, tangible difference in the lives of New Mexicans.
Read more about the legislation I signed today:  http://bit.ly/38pCOCC ",[],['http://bit.ly/38pCOCC'],[],2,1,13,[],[],https://twitter.com/GovMLG/status/1235303029479542785,False,,0,,,,,,,"[{'user_id': '1070083706822438912', 'username': 'GovMLG'}]",,,,
1235303027860557826,1235303021686542337,1583354167000,2020-03-04,15:36:07,EDT,1070083706822438912,govmlg,Michelle Lujan Grisham,,"SB 131 regulates the manufacture, distribution and sale of tobacco products – raising the legal age for purchases of e-cigarette and other tobacco products from 18 to 21, aligning New Mexico law with recently passed federal law. #NMgov #NMleg",[],[],[],3,0,14,"['#nmgov', '#nmleg']",[],https://twitter.com/GovMLG/status/1235303027860557826,False,,0,,,,,,,"[{'user_id': '1070083706822438912', 'username': 'GovMLG'}]",,,,
1235303026707042305,1235303021686542337,1583354167000,2020-03-04,15:36:07,EDT,1070083706822438912,govmlg,Michelle Lujan Grisham,,"HB 100 empowers beWellnm, the New Mexico health insurance exchange, to operate as a fully state-based exchange meeting the needs of families seeking health insurance coverage in New Mexico and promoting access to more affordable, higher-quality insurance plans. #NMgov #NMleg",[],[],[],2,0,15,"['#nmgov', '#nmleg']",[],https://twitter.com/GovMLG/status/1235303026707042305,False,,0,,,,,,,"[{'user_id': '1070083706822438912', 'username': 'GovMLG'}]",,,,
1235303025557803009,1235303021686542337,1583354166000,2020-03-04,15:36:06,EDT,1070083706822438912,govmlg,Michelle Lujan Grisham,,"SB 1 authorizes the New Mexico Department of Health to develop a plan making New Mexico one of the early states to apply for federal approval to import lower-cost wholesale drugs from Canada, another way we’re working to make medicine affordable for New Mexicans. #NMgov #NMleg",[],[],[],1,3,15,"['#nmgov', '#nmleg']",[],https://twitter.com/GovMLG/status/1235303025557803009,False,,0,,,,,,,"[{'user_id': '1070083706822438912', 'username': 'GovMLG'}]",,,,
1235303023905320964,1235303021686542337,1583354166000,2020-03-04,15:36:06,EDT,1070083706822438912,govmlg,Michelle Lujan Grisham,,HB 292 caps co-pays and out-of-pocket expenses for insulin at $25 per prescription – making them the lowest in the country and ending an unacceptable dilemma for thousands of New Mexicans with diabetes forced to choose between life-saving insulin and other expenses. #NMgov #NMleg,[],[],[],2,11,34,"['#nmgov', '#nmleg']",[],https://twitter.com/GovMLG/status/1235303023905320964,False,,0,,,,,,,"[{'user_id': '1070083706822438912', 'username': 'GovMLG'}]",,,,
1235303021686542337,1235303021686542337,1583354165000,2020-03-04,15:36:05,EDT,1070083706822438912,govmlg,Michelle Lujan Grisham,,"Today I signed four priority public health bills into law focusing on reducing prescription drug prices, capping insulin costs, creating more affordable health insurance options and raising the age to purchase e-cigarettes and other tobacco products from 18 to 21. #NMgov #NMleg pic.twitter.com/CpYNbTdBIJ",[],[],['https://pbs.twimg.com/media/ESStMQFX0AEmdq1.jpg'],4,19,78,"['#nmgov', '#nmleg']",[],https://twitter.com/GovMLG/status/1235303021686542337,False,,0,,,,,,,"[{'user_id': '1070083706822438912', 'username': 'GovMLG'}]",,,,
1234989544203640832,1234989537777963008,1583279426000,2020-03-03,18:50:26,EDT,1070083706822438912,govmlg,Michelle Lujan Grisham,,"All three bills passed with bipartisan support, highlighting the importance of infrastructure & renewable energy investments. Thanks to the leadership of these bill sponsors and the support of the Legislature, we will have necessary innovative solutions to combat climate change.",[],[],[],2,2,23,[],[],https://twitter.com/GovMLG/status/1234989544203640832,False,,0,,,,,,,"[{'user_id': '1070083706822438912', 'username': 'GovMLG'}]",,,,
1234989542978945025,1234989537777963008,1583279426000,2020-03-03,18:50:26,EDT,1070083706822438912,govmlg,Michelle Lujan Grisham,,"HB 233, the Energy Grid Modernization Roadmap, directs @EmnrdNM to develop a strategic plan for energy grid modernization & enables the state to pursue federal funding sources previously out of reach. #NMgov",['emnrdnm'],[],[],2,3,24,['#nmgov'],[],https://twitter.com/GovMLG/status/1234989542978945025,False,,0,,,,,,,"[{'user_id': '1070083706822438912', 'username': 'GovMLG'}, {'user_id': '1090393941592006656', 'username': 'EmnrdNM'}]",,,,
1234989541963919360,1234989537777963008,1583279426000,2020-03-03,18:50:26,EDT,1070083706822438912,govmlg,Michelle Lujan Grisham,,"HB 50 expands infrastructure for renewable energy by making transmission line projects eligible for municipal Industrial Revenue Bonds, supporting transmission projects & promoting renewable energy development by laying the groundwork to transmit power across the state. #NMgov",[],[],[],1,1,10,['#nmgov'],[],https://twitter.com/GovMLG/status/1234989541963919360,False,,0,,,,,,,"[{'user_id': '1070083706822438912', 'username': 'GovMLG'}]",,,,
1234989539736731650,1234989537777963008,1583279425000,2020-03-03,18:50:25,EDT,1070083706822438912,govmlg,Michelle Lujan Grisham,,"SB 29 re-establishes the solar tax credit, enabling New Mexico residents and business owners to more easily be able to afford residential and business solar, creating more renewable energy jobs, reducing emissions and saving New Mexicans money on their electricity bills. #NMgov",[],[],[],1,2,13,['#nmgov'],[],https://twitter.com/GovMLG/status/1234989539736731650,False,,0,,,,,,,"[{'user_id': '1070083706822438912', 'username': 'GovMLG'}]",,,,
1234989537777963008,1234989537777963008,1583279425000,2020-03-03,18:50:25,EDT,1070083706822438912,govmlg,Michelle Lujan Grisham,,"Today I was proud to sign legislation making solar power more accessible to New Mexicans, addressing our electric grid, & establishing tools to expand transmission infrastructure, ensuring that New Mexico is on the right track to meet the crisis of climate change head-on. #NMgov pic.twitter.com/z4lMDuI1wS",[],[],['https://pbs.twimg.com/media/ESOPoD4UcAIvNK4.jpg'],12,22,130,['#nmgov'],[],https://twitter.com/GovMLG/status/1234989537777963008,False,,0,,,,,,,"[{'user_id': '1070083706822438912', 'username': 'GovMLG'}]",,,,
1234898967118266369,1234898967118266369,1583257831000,2020-03-03,12:50:31,EDT,1070083706822438912,govmlg,Michelle Lujan Grisham,,"The bipartisan and urgently needed PERA solvency bill will protect what is one of the best pension plans in the country, ensuring it can continue successfully for years to come by reducing its unfunded liability and protecting retirees. #NMgov #NMleg #SB72 https://www.santafenewmexican.com/news/legislature/gov-signs-bill-aimed-at-making-pension-system-solvent/article_783d5b1e-5cce-11ea-86a8-43df0eb8c62d.html …",[],['https://www.santafenewmexican.com/news/legislature/gov-signs-bill-aimed-at-making-pension-system-solvent/article_783d5b1e-5cce-11ea-86a8-43df0eb8c62d.html'],[],2,10,33,"['#nmgov', '#nmleg', '#sb72']",[],https://twitter.com/GovMLG/status/1234898967118266369,False,,0,,,,,,,"[{'user_id': '1070083706822438912', 'username': 'GovMLG'}]",,,,
1234629624887300096,1234629623981330432,1583193615000,2020-03-02,19:00:15,EDT,1070083706822438912,govmlg,Michelle Lujan Grisham,,It's crucial we all be on the same page as @NMDOH monitors the situation and ensures New Mexico is as ready as we can be. Read more about what you can do to stay healthy and reduce risk here:  https://cv.nmhealth.org/ ,['nmdoh'],['https://cv.nmhealth.org/'],[],8,8,31,[],[],https://twitter.com/GovMLG/status/1234629624887300096,False,,0,,,,,,,"[{'user_id': '1070083706822438912', 'username': 'GovMLG'}, {'user_id': '1465196934', 'username': 'NMDOH'}]",,,,
1234629623981330432,1234629623981330432,1583193615000,2020-03-02,19:00:15,EDT,1070083706822438912,govmlg,Michelle Lujan Grisham,,"I was glad to be part of the #COVID19 call today with @VP Pence and other governors from across the country. My Department of Health @NMDOH has been working with healthcare providers to identify patients at risk, to provide testing and to manage infection control procedures.","['vp', 'nmdoh']",[],[],9,14,79,['#covid19'],[],https://twitter.com/GovMLG/status/1234629623981330432,False,,0,,,,,,,"[{'user_id': '1070083706822438912', 'username': 'GovMLG'}, {'user_id': '818910970567344128', 'username': 'VP'}, {'user_id': '1465196934', 'username': 'NMDOH'}]",,,,
1234624778306084864,1234624778306084864,1583192460000,2020-03-02,18:41:00,EDT,1070083706822438912,govmlg,Michelle Lujan Grisham,,"Welcome to New Mexico, @mindykaling! Make sure to enjoy some New Mexico chile while you’re here – the best in the world! https://twitter.com/mindykaling/status/1234584729468297216 …",['mindykaling'],['https://twitter.com/mindykaling/status/1234584729468297216'],[],20,24,408,[],[],https://twitter.com/GovMLG/status/1234624778306084864,False,https://twitter.com/mindykaling/status/1234584729468297216,0,,,,,,,"[{'user_id': '1070083706822438912', 'username': 'GovMLG'}, {'user_id': '23544596', 'username': 'mindykaling'}]",,,,
1234620790429093888,1234620788147286016,1583191509000,2020-03-02,18:25:09,EDT,1070083706822438912,govmlg,Michelle Lujan Grisham,,"A 40-cent copay should never come between a child and the food they need to thrive. While I continue to work to end child hunger across New Mexico, school meals are a proven way to ensure that children receive the nutrition they need to grow and learn.
#NMgov #NMleg #HB10",[],[],[],3,8,38,"['#nmgov', '#nmleg', '#hb10']",[],https://twitter.com/GovMLG/status/1234620790429093888,False,,0,,,,,,,"[{'user_id': '1070083706822438912', 'username': 'GovMLG'}]",,,,
1234620788147286016,1234620788147286016,1583191508000,2020-03-02,18:25:08,EDT,1070083706822438912,govmlg,Michelle Lujan Grisham,,"Today I was proud to sign House Bill 10, eliminating student co-pays for reduced price school breakfast and lunch and ensuring that over 12,000 more New Mexico children are guaranteed meals at school. What a way to kick off National School Breakfast Week!
#NMgov #NMleg #HB10 pic.twitter.com/SL1SRaFhEF",[],[],['https://pbs.twimg.com/media/ESJAb9HU4AAqTGe.jpg'],9,34,167,"['#nmgov', '#nmleg', '#hb10']",[],https://twitter.com/GovMLG/status/1234620788147286016,False,,0,,,,,,,"[{'user_id': '1070083706822438912', 'username': 'GovMLG'}]",,,,
1234597284437905408,1234597284437905408,1583185904000,2020-03-02,16:51:44,EDT,1070083706822438912,govmlg,Michelle Lujan Grisham,,"The Working Families Tax Credit puts more money back into the pockets of hundreds of thousands of hard-working New Mexico families. I was proud to spearhead legislation last year doubling this important tax credit for New Mexicans, which continues this year. #NMgov #NMleg https://twitter.com/NM_MVD/status/1234587425889849345 …",[],['https://twitter.com/NM_MVD/status/1234587425889849345'],[],4,16,30,"['#nmgov', '#nmleg']",[],https://twitter.com/GovMLG/status/1234597284437905408,False,https://twitter.com/NM_MVD/status/1234587425889849345,0,,,,,,,"[{'user_id': '1070083706822438912', 'username': 'GovMLG'}]",,,,
1234571770662768640,1234571770662768640,1583179822000,2020-03-02,15:10:22,EDT,1070083706822438912,govmlg,Michelle Lujan Grisham,,It's critical that every New Mexican get counted for the #2020Census – just a 1% undercount could result in New Mexico losing hundreds of millions of dollars of federal funding. #SB4 delivers an additional $8 million to empower communities statewide to ensure an accurate count. pic.twitter.com/m4oBclnnlX,[],[],['https://pbs.twimg.com/media/ESIT_cxVUAEe_Kj.jpg'],15,17,54,"['#2020census', '#sb4']",[],https://twitter.com/GovMLG/status/1234571770662768640,False,,0,,,,,,,"[{'user_id': '1070083706822438912', 'username': 'GovMLG'}]",,,,
1234544056396439552,1234544056396439552,1583173214000,2020-03-02,13:20:14,EDT,1070083706822438912,govmlg,Michelle Lujan Grisham,,"Flags across the state are flying at half staff today in honor of New Mexico National Guard SPC Walter Lewark, who died serving his country in Djibouti. Our entire state grieves the loss of one of New Mexico's own and my prayers are with his loved ones. https://www.lcsun-news.com/story/news/local/new-mexico/2020/03/01/us-state-flags-half-staff-monday-guard-soldier-walter-lewark/4915098002/ …",[],['https://www.lcsun-news.com/story/news/local/new-mexico/2020/03/01/us-state-flags-half-staff-monday-guard-soldier-walter-lewark/4915098002/'],[],1,15,62,[],[],https://twitter.com/GovMLG/status/1234544056396439552,False,,0,,,,,,,"[{'user_id': '1070083706822438912', 'username': 'GovMLG'}]",,,,
