id,conversation_id,created_at,date,time,timezone,user_id,username,name,place,tweet,mentions,urls,photos,replies_count,retweets_count,likes_count,hashtags,cashtags,link,retweet,quote_url,video,near,geo,source,user_rt_id,user_rt,retweet_id,reply_to,retweet_date,translate,trans_src,trans_dest
1232005505670930432,1232005505670930432,1582567976000,2020-02-24,13:12:56,EDT,545107258,govphilscott,Governor Phil Scott,,"Thank you to April's Maple for hosting my team & members of @NCChamberofC for a great lunch as part of #VTCapitol4aDay. Great to chat w/ these employers about workforce challenges and economic opportunities, and to learn more about April’s success here in Essex County. pic.twitter.com/FA001Afvsl",['ncchamberofc'],[],"['https://pbs.twimg.com/media/ERj2KNKXYAAEpfP.jpg', 'https://pbs.twimg.com/media/ERj2KNVWoAAsezG.jpg', 'https://pbs.twimg.com/media/ERj2KNVXUAIicib.jpg', 'https://pbs.twimg.com/media/ERj2KNUXsAEVb4v.jpg']",2,2,12,['#vtcapitol4aday'],[],https://twitter.com/GovPhilScott/status/1232005505670930432,False,,0,,,,,,,"[{'user_id': '545107258', 'username': 'GovPhilScott'}, {'user_id': '632231238', 'username': 'NCChamberofC'}]",,,,
1231983003016007680,1231982984372346880,1582562611000,2020-02-24,11:43:31,EDT,545107258,govphilscott,Governor Phil Scott,,"My team is working to strengthen and increase investment in tech centers like this because they are so important to filling critical workforce needs, including nursing, emergency services, manufacturing, agriculture, carpentry, welding and more. #VTCapitol4aDay pic.twitter.com/9Z2VBqMmHK",[],[],"['https://pbs.twimg.com/media/ERjiAAdXUAAfz1X.jpg', 'https://pbs.twimg.com/media/ERjiABnWAAEIdsL.jpg', 'https://pbs.twimg.com/media/ERjiACpXYAU_Uro.jpg', 'https://pbs.twimg.com/media/ERjiAEhW4AAZcUL.jpg']",0,3,10,['#vtcapitol4aday'],[],https://twitter.com/GovPhilScott/status/1231983003016007680,False,,0,,,,,,,"[{'user_id': '545107258', 'username': 'GovPhilScott'}]",,,,
1231982984372346880,1231982984372346880,1582562607000,2020-02-24,11:43:27,EDT,545107258,govphilscott,Governor Phil Scott,,"The Canaan Career Technical Center offers five college and career pathways to its students, helping train our future workforce and provide greater opportunities for kids from both Vermont and New Hampshire. #VTCapitol4aDay pic.twitter.com/5wtAB3Phy5",[],[],"['https://pbs.twimg.com/media/ERjh-tVWAAEg3fx.jpg', 'https://pbs.twimg.com/media/ERjh-tZX0AAsslr.jpg', 'https://pbs.twimg.com/media/ERjh-tZXYAAXnL5.jpg', 'https://pbs.twimg.com/media/ERjh-u5WkAAaQkp.jpg']",1,5,13,['#vtcapitol4aday'],[],https://twitter.com/GovPhilScott/status/1231982984372346880,False,,0,,,,,,,"[{'user_id': '545107258', 'username': 'GovPhilScott'}]",,,,
1231967249772269568,1231967249772269568,1582558855000,2020-02-24,10:40:55,EDT,545107258,govphilscott,Governor Phil Scott,,"Next stop for #VTCapitol4aDay was to Ethan Allen Sawmill in Beecher Falls. The company provides hundreds of jobs in the Northeast Kingdom, and builds custom furniture sold around the globe. pic.twitter.com/cdnW135zrV",[],[],"['https://pbs.twimg.com/media/ERjTq8sW4AYpCs5.jpg', 'https://pbs.twimg.com/media/ERjTq8YWsAAQ46l.jpg', 'https://pbs.twimg.com/media/ERjTq8rXsAMdo4F.jpg', 'https://pbs.twimg.com/media/ERjTq9oWkAE6rfh.jpg']",0,0,8,['#vtcapitol4aday'],[],https://twitter.com/GovPhilScott/status/1231967249772269568,False,,0,,,,,,,"[{'user_id': '545107258', 'username': 'GovPhilScott'}]",,,,
1231940547679576065,1231940451839758337,1582552489000,2020-02-24,08:54:49,EDT,545107258,govphilscott,Governor Phil Scott,,".@VTLabor Acting Commissioner Michael Harrington provided details on Essex County’s workforce, which illustrates the two Vermonts that exist and the challenges our rural areas face. #VTCapitol4aDay pic.twitter.com/KalijpBVKq",['vtlabor'],[],"['https://pbs.twimg.com/media/ERi7W4JXYAE1ssF.jpg', 'https://pbs.twimg.com/media/ERi7W4uWAAAMxU_.jpg']",0,1,3,['#vtcapitol4aday'],[],https://twitter.com/GovPhilScott/status/1231940547679576065,False,,0,,,,,,,"[{'user_id': '545107258', 'username': 'GovPhilScott'}, {'user_id': '898273962282627072', 'username': 'VTLabor'}]",,,,
1231940495363973122,1231940451839758337,1582552477000,2020-02-24,08:54:37,EDT,545107258,govphilscott,Governor Phil Scott,,"Dept. of Forests, Parks & Rec Deputy Commissioner Sam Lincoln shared how last year’s visit to Essex County has helped in our work to support the logging industry, which is critical to the region’s economy. #VTCapitol4aDay pic.twitter.com/AXoYhro10D",[],[],['https://pbs.twimg.com/media/ERi7UyOW4AE4XvJ.jpg'],1,0,4,['#vtcapitol4aday'],[],https://twitter.com/GovPhilScott/status/1231940495363973122,False,,0,,,,,,,"[{'user_id': '545107258', 'username': 'GovPhilScott'}]",,,,
1231940451839758337,1231940451839758337,1582552466000,2020-02-24,08:54:26,EDT,545107258,govphilscott,Governor Phil Scott,,Great to be in Beecher Falls to kick off our Essex County #VTCapitol4aDay! Thanks to Beecher Falls Volunteer Fire Department for hosting our cabinet meeting this morning and for all you do to serve and protect this area. pic.twitter.com/uw1iFfd8Ce,[],[],"['https://pbs.twimg.com/media/ERi7QvmW4AA9J0c.jpg', 'https://pbs.twimg.com/media/ERi7QvcXUAIUfT_.jpg', 'https://pbs.twimg.com/media/ERi7QveX0AAj87C.jpg']",1,3,14,['#vtcapitol4aday'],[],https://twitter.com/GovPhilScott/status/1231940451839758337,False,,0,,,,,,,"[{'user_id': '545107258', 'username': 'GovPhilScott'}]",,,,
1231748263285530624,1231731693666656258,1582506645000,2020-02-23,20:10:45,EDT,545107258,govphilscott,Governor Phil Scott,,"Don’t forget...Bloomfield,Brunswick, Concord,Ferdinand, Granby,Guildhall,Lunenburg (largest town) and of course Victory (smallest town)","['counseloradrian', 'johnjquinn3']",[],[],2,0,6,[],[],https://twitter.com/GovPhilScott/status/1231748263285530624,False,,0,,,,,,,"[{'user_id': '545107258', 'username': 'GovPhilScott'}, {'user_id': '75355226', 'username': 'CounselorAdrian'}, {'user_id': '401632137', 'username': 'johnjquinn3'}]",,,,
1230973078915756039,1230973078915756039,1582321827000,2020-02-21,16:50:27,EDT,545107258,govphilscott,Governor Phil Scott,,"When I was in the Senate, I was honored to serve with Sen. Julius Canns, who fought for the recognition of Abenaki tribes & advocated for veterans. He was also the first African American to serve in the Vermont Senate. He was a great colleague & public servant. #BlackHistoryMonth pic.twitter.com/ecC78K5MSM",[],[],['https://pbs.twimg.com/media/ERVLdAoWoAYfmrg.jpg'],4,1,13,['#blackhistorymonth'],[],https://twitter.com/GovPhilScott/status/1230973078915756039,False,,0,,,,,,,"[{'user_id': '545107258', 'username': 'GovPhilScott'}]",,,,
1229865682604568579,1229865682604568579,1582057803000,2020-02-18,15:30:03,EDT,545107258,govphilscott,Governor Phil Scott,,"Today, I proclaimed it Engineers Week in VT. Engineers play a critical role in our communities, economy & so much of our daily lives - and we need more of them. The good news is there’re many engineering jobs in our state available right now. Learn more @  http://vermontjoblink.com  pic.twitter.com/WIIL8WXCI8",[],['http://vermontjoblink.com'],['https://pbs.twimg.com/media/ERFcUN_XUAAdO-4.jpg'],2,0,13,[],[],https://twitter.com/GovPhilScott/status/1229865682604568579,False,,0,,,,,,,"[{'user_id': '545107258', 'username': 'GovPhilScott'}]",,,,
1229779212443291648,1229779212443291648,1582037187000,2020-02-18,09:46:27,EDT,545107258,govphilscott,Governor Phil Scott,,"Born in Corinth, VT, Alexander Twilight was the first African American man to earn a bachelor's degree from an American college. In 1836, he became the first African American man elected to a state legislature, representing Brownington in the VT House of Reps. #BlackHistoryMonth pic.twitter.com/6rpFGLSPWn",[],[],['https://pbs.twimg.com/media/ERENrMpVUAAPfWD.jpg'],2,13,41,['#blackhistorymonth'],[],https://twitter.com/GovPhilScott/status/1229779212443291648,False,,0,,,,,,,"[{'user_id': '545107258', 'username': 'GovPhilScott'}]",,,,
1228410566697508866,1228410566697508866,1581710876000,2020-02-14,15:07:56,EDT,545107258,govphilscott,Governor Phil Scott,,Thanks to @scoutingvermont for having me at their Eagle Scout Recognition Day to celebrate 27 of the 65 scouts who’ve earned that rank in the last year. Congratulations to these young leaders who do so much to serve others in their communities! pic.twitter.com/2p6TYmPirh,['scoutingvermont'],[],['https://pbs.twimg.com/media/EQww5BBWoAANpP_.jpg'],5,0,15,[],[],https://twitter.com/GovPhilScott/status/1228410566697508866,False,,0,,,,,,,"[{'user_id': '545107258', 'username': 'GovPhilScott'}, {'user_id': '232766635', 'username': 'scoutingvermont'}]",,,,
1228380838162767872,1228380838162767872,1581703788000,2020-02-14,13:09:48,EDT,545107258,govphilscott,Governor Phil Scott,,"Eliza Healy (later know as Sister Mary Magdalen) was born into slavery in Georgia and, in 1903, became the first African American mother superior of a Catholic convent when she assumed leadership of the Villa Barlow convent and school in St. Albans, VT. #BlackHistoryMonth",[],[],[],1,8,27,['#blackhistorymonth'],[],https://twitter.com/GovPhilScott/status/1228380838162767872,False,,0,,,,,,,"[{'user_id': '545107258', 'username': 'GovPhilScott'}]",,,,
1227673283992092679,1227673196339585026,1581535094000,2020-02-12,14:18:14,EDT,545107258,govphilscott,Governor Phil Scott,,"To learn more about their experiences and important contributions, a good place to start is the Vermont African American Heritage Trail to visit historical sites and hear these stories. #BlackHistoryMonth #ThinkVT  http://bit.ly/37mtChR ",[],['http://bit.ly/37mtChR'],[],0,3,13,"['#blackhistorymonth', '#thinkvt']",[],https://twitter.com/GovPhilScott/status/1227673283992092679,False,,0,,,,,,,"[{'user_id': '545107258', 'username': 'GovPhilScott'}]",,,,
1227673196339585026,1227673196339585026,1581535073000,2020-02-12,14:17:53,EDT,545107258,govphilscott,Governor Phil Scott,,Our shared values as Vermonters have been shaped by those who came before us. The history of African American Vermonters is woven into the story of our state and we honor this legacy as we celebrate #BlackHistoryMonth,[],[],[],1,4,19,['#blackhistorymonth'],[],https://twitter.com/GovPhilScott/status/1227673196339585026,False,,0,,,,,,,"[{'user_id': '545107258', 'username': 'GovPhilScott'}]",,,,
1226906466747068417,1226906460170473472,1581352271000,2020-02-10,11:31:11,EDT,545107258,govphilscott,Governor Phil Scott,,"When combined with decreases from 2017-2019, VT employers will pay an average of 30% less in workers’ comp. premiums than before I took office. These savings will help employers of all sizes hire more workers, increase salaries and expand their operations in our state. (2/2) pic.twitter.com/x8vULOL1Xi",[],[],['https://pbs.twimg.com/media/EQbY7TNWAAcLrxQ.jpg'],0,5,16,[],[],https://twitter.com/GovPhilScott/status/1226906466747068417,False,,0,,,,,,,"[{'user_id': '545107258', 'username': 'GovPhilScott'}]",,,,
1226906460170473472,1226906460170473472,1581352269000,2020-02-10,11:31:09,EDT,545107258,govphilscott,Governor Phil Scott,,"As we work to grow the economy, addressing the high cost of doing business in Vermont is critical. This year, I’m happy to announce the largest workers’ compensation insurance rate decrease in decades – without reducing benefits to workers. (1/2) pic.twitter.com/3f77MEJptS",[],[],['https://pbs.twimg.com/media/EQbY7AlWkAIScKs.jpg'],2,9,23,[],[],https://twitter.com/GovPhilScott/status/1226906460170473472,False,,0,,,,,,,"[{'user_id': '545107258', 'username': 'GovPhilScott'}]",,,,
1226511447296884736,1226511447296884736,1581258091000,2020-02-09,09:21:31,EDT,545107258,govphilscott,Governor Phil Scott,,"Productive meeting this morning with fellow New England governors @GovNedLamont, @GovJanetMills and @MassGovernor Charlie Baker, discussing clean energy, infrastructure and other ways we can work together as a region. pic.twitter.com/jREDblVQcl","['govnedlamont', 'govjanetmills', 'massgovernor']",[],"['https://pbs.twimg.com/media/EQVxow6UEAAY5Df.jpg', 'https://pbs.twimg.com/media/EQVxow5U4AAT6XM.jpg']",5,10,29,[],[],https://twitter.com/GovPhilScott/status/1226511447296884736,False,,0,,,,,,,"[{'user_id': '545107258', 'username': 'GovPhilScott'}, {'user_id': '1076293903723233280', 'username': 'GovNedLamont'}, {'user_id': '1083795319027089408', 'username': 'GovJanetMills'}, {'user_id': '18023868', 'username': 'MassGovernor'}]",,,,
1226266548681105409,1226266548681105409,1581199702000,2020-02-08,17:08:22,EDT,545107258,govphilscott,Governor Phil Scott,,"I’m in D.C. for the @NatlGovsAssoc, working with colleagues to find solutions to issues that face all our states. It’s great to join @MassGovernor, Gov. @DougDucey and others for @GovLarryHogan’s Chair Initiative roundtable on modernizing America’s infrastructure. #WeTheStates pic.twitter.com/ym6CdoYLBI","['natlgovsassoc', 'massgovernor', 'dougducey', 'govlarryhogan']",[],"['https://pbs.twimg.com/media/EQSS68lUYAAywI3.jpg', 'https://pbs.twimg.com/media/EQSS68lUUAAnEd_.jpg']",2,7,40,['#wethestates'],[],https://twitter.com/GovPhilScott/status/1226266548681105409,False,,0,,,,,,,"[{'user_id': '545107258', 'username': 'GovPhilScott'}, {'user_id': '393615360', 'username': 'NatlGovsAssoc'}, {'user_id': '18023868', 'username': 'MassGovernor'}, {'user_id': '20217019', 'username': 'dougducey'}, {'user_id': '2987671552', 'username': 'GovLarryHogan'}]",,,,
1226207889473167360,1226207889473167360,1581185717000,2020-02-08,13:15:17,EDT,545107258,govphilscott,Governor Phil Scott,,"Yesterday with Loki, and today with Captain America @ChrisEvans to be interviewed for his new project, A Starting Point, which aims to help Americans bridge the gap of political rhetoric and better understand the issues that impact them and their families.  https://twitter.com/GovPhilScott/status/1226179106003390465 … pic.twitter.com/96bJdXyHuV",['chrisevans'],['https://twitter.com/GovPhilScott/status/1226179106003390465'],"['https://pbs.twimg.com/media/EQRdjcgUYAEbKWU.jpg', 'https://pbs.twimg.com/media/EQRdjcgUEAAoSF2.jpg']",13,152,659,[],[],https://twitter.com/GovPhilScott/status/1226207889473167360,False,,0,,,,,,,"[{'user_id': '545107258', 'username': 'GovPhilScott'}, {'user_id': '580097412', 'username': 'ChrisEvans'}]",,,,
1226179106003390465,1226179106003390465,1581178854000,2020-02-08,11:20:54,EDT,545107258,govphilscott,Governor Phil Scott,,"Great to meet @VTStatePolice’s newest recruit, Loki, who showed me around the State House yesterday. pic.twitter.com/f1sXoeiqap",['vtstatepolice'],[],"['https://pbs.twimg.com/media/EQRDSt4XYAITtLJ.jpg', 'https://pbs.twimg.com/media/EQRDSt7W4AA-6tw.jpg', 'https://pbs.twimg.com/media/EQRDSvSWAAEGc69.jpg', 'https://pbs.twimg.com/media/EQRDTY-XkAc5aim.jpg']",0,10,102,[],[],https://twitter.com/GovPhilScott/status/1226179106003390465,False,,0,,,,,,,"[{'user_id': '545107258', 'username': 'GovPhilScott'}, {'user_id': '259817328', 'username': 'VTStatePolice'}]",,,,
1224851883581411329,1224851883581411329,1580862420000,2020-02-04,19:27:00,EDT,545107258,govphilscott,Governor Phil Scott,,"Last week, I vetoed a $29 million payroll tax on VTers & outlined the next steps of my plan to provide a voluntary paid leave program without a tax hike or new bureaucracy. If you agree, contact your reps at 802-828-2228 and ask them to sustain my veto. https://www.facebook.com/1255419051203893/posts/2768860103193106/?vh=e&d=n …",[],['https://www.facebook.com/1255419051203893/posts/2768860103193106/?vh=e&d=n'],[],18,6,19,[],[],https://twitter.com/GovPhilScott/status/1224851883581411329,False,,0,,,,,,,"[{'user_id': '545107258', 'username': 'GovPhilScott'}]",,,,
1223367176964464640,1223367176964464640,1580508438000,2020-01-31,17:07:18,EDT,545107258,govphilscott,Governor Phil Scott,,"Today, I vetoed a new mandatory $29 million payroll tax on working Vermonters, and outlined the next steps of my plan to provide an affordable paid family and medical leave program without a tax increase or new bureaucracy. Read my statement here: #vtpoli  https://governor.vermont.gov/press-release/governor-phil-scott-announces-action-h107-details-progress-towards-voluntary-paid … pic.twitter.com/jIokrGASNN",[],['https://governor.vermont.gov/press-release/governor-phil-scott-announces-action-h107-details-progress-towards-voluntary-paid'],['https://pbs.twimg.com/media/EPpF9i5WkAEwpxA.jpg'],6,6,35,['#vtpoli'],[],https://twitter.com/GovPhilScott/status/1223367176964464640,False,,0,,,,,,,"[{'user_id': '545107258', 'username': 'GovPhilScott'}]",,,,
1222925152473710594,1222907186600390658,1580403051000,2020-01-30,11:50:51,EDT,545107258,govphilscott,Governor Phil Scott,,#USMCA pic.twitter.com/QY62dUeEkp,[],[],['https://pbs.twimg.com/media/EPiz8R7XUAIgsnm.jpg'],2,4,14,['#usmca'],[],https://twitter.com/GovPhilScott/status/1222925152473710594,False,,0,,,,,,,"[{'user_id': '545107258', 'username': 'GovPhilScott'}]",,,,
1222907187225419776,1222907186600390658,1580398768000,2020-01-30,10:39:28,EDT,545107258,govphilscott,Governor Phil Scott,,and I thank Congress for its improvements and action. Our nation needs and deserves much more bipartisanship like this. We must put progress ahead of partisan politics. (2/2),[],[],[],8,2,8,[],[],https://twitter.com/GovPhilScott/status/1222907187225419776,False,,0,,,,,,,"[{'user_id': '545107258', 'username': 'GovPhilScott'}]",,,,
1222907186600390658,1222907186600390658,1580398768000,2020-01-30,10:39:28,EDT,545107258,govphilscott,Governor Phil Scott,,"Ratification of the #USMCA is great news for workers, small businesses, manufacturers, innovators and farmers in Vermont and all across the North American economy. I appreciate the work of President Trump and his administration on this impactful trade deal...(1/2)",[],[],[],8,4,12,['#usmca'],[],https://twitter.com/GovPhilScott/status/1222907186600390658,False,,0,,,,,,,"[{'user_id': '545107258', 'username': 'GovPhilScott'}]",,,,
1222595963778404352,1222595963778404352,1580324567000,2020-01-29,14:02:47,EDT,545107258,govphilscott,Governor Phil Scott,,Welcome to @VTStatePolice's newest officer! https://twitter.com/Wej12/status/1222557134849703936 …,['vtstatepolice'],['https://twitter.com/Wej12/status/1222557134849703936'],[],1,10,72,[],[],https://twitter.com/GovPhilScott/status/1222595963778404352,False,https://twitter.com/Wej12/status/1222557134849703936,0,,,,,,,"[{'user_id': '545107258', 'username': 'GovPhilScott'}, {'user_id': '259817328', 'username': 'VTStatePolice'}]",,,,
1222532072104919043,1222532072104919043,1580309334000,2020-01-29,09:48:54,EDT,545107258,govphilscott,Governor Phil Scott,,"This morning during open door coffee, I had the privilege of meeting Mary Nadon and learning more about Friedreich’s ataxia and her work with @CureFA_org to raise public awareness and find a cure for this debilitating disorder. #CureFA pic.twitter.com/iyb1DP3Gjn",['curefa_org'],[],['https://pbs.twimg.com/media/EPdOboVWkAUnZVG.jpg'],1,6,37,['#curefa'],[],https://twitter.com/GovPhilScott/status/1222532072104919043,False,,0,,,,,,,"[{'user_id': '545107258', 'username': 'GovPhilScott'}, {'user_id': '314022370', 'username': 'CureFA_org'}]",,,,
1221860357414760450,1221860357414760450,1580149184000,2020-01-27,13:19:44,EDT,545107258,govphilscott,Governor Phil Scott,,A Statement from Governor Phil Scott on Holocaust Remembrance Day:  http://bit.ly/30Yt67U  pic.twitter.com/CuXFiFcOVR,[],['http://bit.ly/30Yt67U'],['https://pbs.twimg.com/media/EPTrhKRXUAAW5Fe.jpg'],2,2,6,[],[],https://twitter.com/GovPhilScott/status/1221860357414760450,False,,0,,,,,,,"[{'user_id': '545107258', 'username': 'GovPhilScott'}]",,,,
1220833112810237953,1220833112810237953,1579904270000,2020-01-24,17:17:50,EDT,545107258,govphilscott,Governor Phil Scott,,"It was an honor to recognize Vermont World War II veterans today in Stowe. We can never fully repay our debt to members of the Greatest Generation who served. Their bravery, heroism and sacrifice saved the world, and we can never thank them enough. pic.twitter.com/SAnTvjbm5B",[],[],"['https://pbs.twimg.com/media/EPFFPQFW4AAelfz.jpg', 'https://pbs.twimg.com/media/EPFFPQ3WkAEYhTg.jpg', 'https://pbs.twimg.com/media/EPFFPT5X0AAQePg.jpg', 'https://pbs.twimg.com/media/EPFFPTHXUAA39g_.jpg']",3,5,26,[],[],https://twitter.com/GovPhilScott/status/1220833112810237953,False,,0,,,,,,,"[{'user_id': '545107258', 'username': 'GovPhilScott'}]",,,,
1220793351752032256,1220793351752032256,1579894790000,2020-01-24,14:39:50,EDT,545107258,govphilscott,Governor Phil Scott,,Voting is critical to our democracy and it's important for all Vermonters to participate. Join @VermontSOS and community partners in Burlington and Winooski for New American voting events to learn more about registering to vote and using new translated ballots! pic.twitter.com/iYvAj0orpx,['vermontsos'],[],['https://pbs.twimg.com/media/EPEhFQDWoAAeri3.jpg'],0,11,22,[],[],https://twitter.com/GovPhilScott/status/1220793351752032256,False,,0,,,,,,,"[{'user_id': '545107258', 'username': 'GovPhilScott'}, {'user_id': '3946773623', 'username': 'VermontSOS'}]",,,,
1219708356312600576,1219708356312600576,1579636107000,2020-01-21,14:48:27,EDT,545107258,govphilscott,Governor Phil Scott,,"If we accept the challenge, set clear objectives, have the discipline to commit to solutions and follow through, we can reverse these trends. We can restore economic vitality to every corner of our state. We can make Vermont more affordable for every family & business. #VTBudget",[],[],[],2,0,4,['#vtbudget'],[],https://twitter.com/GovPhilScott/status/1219708356312600576,False,,0,,,,,,,"[{'user_id': '545107258', 'username': 'GovPhilScott'}]",,,,
1219708064967905280,1219708064967905280,1579636038000,2020-01-21,14:47:18,EDT,545107258,govphilscott,Governor Phil Scott,,The issues we face are significant but none greater than the demographic crisis and the economic challenges it brings... Confronting this crisis now is the only way to preserve our ability to solve problems in the future. #VTBudget,[],[],[],3,0,5,['#vtbudget'],[],https://twitter.com/GovPhilScott/status/1219708064967905280,False,,0,,,,,,,"[{'user_id': '545107258', 'username': 'GovPhilScott'}]",,,,
1219707909677965313,1219707909677965313,1579636001000,2020-01-21,14:46:41,EDT,545107258,govphilscott,Governor Phil Scott,,My $3.15M Clean Grid Modernization Package will encourage companies to start & expand here by making R&D work eligible for a tax credit and will provide $2M in capital & technical assistance... and I propose we eliminate the corporate income tax on these job creators. #VTBudget,[],[],[],0,1,2,['#vtbudget'],[],https://twitter.com/GovPhilScott/status/1219707909677965313,False,,0,,,,,,,"[{'user_id': '545107258', 'username': 'GovPhilScott'}]",,,,
1219707650541268992,1219707482039341062,1579635939000,2020-01-21,14:45:39,EDT,545107258,govphilscott,Governor Phil Scott,,"(2/2) While we wait for Congress to work on a national solution, electric utilities have introduced EV-specific rates and will recommend a pilot program for the collection of revenue from EV charging stations to support long-term transportation maintenance. #VTBudget",[],[],[],0,0,2,['#vtbudget'],[],https://twitter.com/GovPhilScott/status/1219707650541268992,False,,0,,,,,,,"[{'user_id': '545107258', 'username': 'GovPhilScott'}]",,,,
1219707482039341062,1219707482039341062,1579635899000,2020-01-21,14:44:59,EDT,545107258,govphilscott,Governor Phil Scott,,"(1/2) My budget proposes to invest $3 million to address [obstacles to EV purchases] and help meet our climate & energy goals... We’ll increase funding for incentives, consumer education and support services and… more charging stations on our highways & our workplaces. #VTBudget",[],[],[],1,0,3,['#vtbudget'],[],https://twitter.com/GovPhilScott/status/1219707482039341062,False,,0,,,,,,,"[{'user_id': '545107258', 'username': 'GovPhilScott'}]",,,,
1219707066182520838,1219707066182520838,1579635800000,2020-01-21,14:43:20,EDT,545107258,govphilscott,Governor Phil Scott,,"On top of everything we’re already doing & everything I’m proposing... I propose committing 25% of all future end-of-year budget surpluses for additional investments that address climate change, specifically for initiatives that support weatherization or electrification.#VTBudget",[],[],[],0,0,2,['#vtbudget'],[],https://twitter.com/GovPhilScott/status/1219707066182520838,False,,0,,,,,,,"[{'user_id': '545107258', 'username': 'GovPhilScott'}]",,,,
1219706330862247936,1219706330862247936,1579635624000,2020-01-21,14:40:24,EDT,545107258,govphilscott,Governor Phil Scott,,"To create an incentive for military vets to return to VT & join our workforce, I’m again proposing to exempt military retirement pay from the income tax... I hope you’ll join me this year in eliminating the tax on those who devoted their lives in service to our nation. #VTBudget",[],[],[],1,0,7,['#vtbudget'],[],https://twitter.com/GovPhilScott/status/1219706330862247936,False,,0,,,,,,,"[{'user_id': '545107258', 'username': 'GovPhilScott'}]",,,,
1219706063609630721,1219705806918242305,1579635561000,2020-01-21,14:39:21,EDT,545107258,govphilscott,Governor Phil Scott,,"(4/4) That America is still a land of opportunity for all who seek freedom from oppression, security for their families or, in some cases, just a fresh start. As long as I’m governor, they’ll be welcome right here in Vermont. #VTBudget",['vtlabor'],[],[],0,1,8,['#vtbudget'],[],https://twitter.com/GovPhilScott/status/1219706063609630721,False,,0,,,,,,,"[{'user_id': '545107258', 'username': 'GovPhilScott'}, {'user_id': '898273962282627072', 'username': 'VTLabor'}]",,,,
