id,conversation_id,created_at,date,time,timezone,user_id,username,name,place,tweet,mentions,urls,photos,replies_count,retweets_count,likes_count,hashtags,cashtags,link,retweet,quote_url,video,near,geo,source,user_rt_id,user_rt,retweet_id,reply_to,retweet_date,translate,trans_src,trans_dest
1240318339320352769,1240318337139302407,1584549910000,2020-03-18,12:45:10,EDT,545107258,govphilscott,Governor Phil Scott,,"I know there are many disruptions our COVID-19 mitigation steps have caused, but each and every decision we've made is based on science, and will save lives. We must take social distancing seriously. We will get through this. And we'll do it, together. (3/3) #vtpoli",[],[],[],0,5,7,['#vtpoli'],[],https://twitter.com/GovPhilScott/status/1240318339320352769,False,,0,,,,,,,"[{'user_id': '545107258', 'username': 'GovPhilScott'}]",,,,
1240318338212995073,1240318337139302407,1584549910000,2020-03-18,12:45:10,EDT,545107258,govphilscott,Governor Phil Scott,,"I am also in regular contact with our congressional delegation, @SenatorLeahy, @SenSanders and Rep. @PeterWelch, as well as Vermont legislators, to find ways to help Vermonters whose employment has been impacted by our COVID-19 response. (2/3) #vtpoli","['senatorleahy', 'sensanders', 'peterwelch']",[],[],1,2,7,['#vtpoli'],[],https://twitter.com/GovPhilScott/status/1240318338212995073,False,,0,,,,,,,"[{'user_id': '545107258', 'username': 'GovPhilScott'}, {'user_id': '242836537', 'username': 'SenatorLeahy'}, {'user_id': '29442313', 'username': 'SenSanders'}, {'user_id': '1410590874', 'username': 'PeterWelch'}]",,,,
1240318337139302407,1240318337139302407,1584549910000,2020-03-18,12:45:10,EDT,545107258,govphilscott,Governor Phil Scott,,"During these challenging times I have instructed @VTLabor to launch an online form for unemployment insurance claims and we’re expanding the number of people in our call center to help. 
To file, visit the link below or call 1-877-214-3330 (1/2) #vtpoli
 https://appengine.egov.com/apps/vt/dol/unemploymentinsuranceclaim …",['vtlabor'],['https://appengine.egov.com/apps/vt/dol/unemploymentinsuranceclaim'],[],3,13,23,['#vtpoli'],[],https://twitter.com/GovPhilScott/status/1240318337139302407,False,,0,,,,,,,"[{'user_id': '545107258', 'username': 'GovPhilScott'}, {'user_id': '898273962282627072', 'username': 'VTLabor'}]",,,,
1240062256152444939,1240062251257790464,1584488855000,2020-03-17,19:47:35,EDT,545107258,govphilscott,Governor Phil Scott,,"....so those who are on the front lines of our response can continue to care for the sick, protect the public and manage this evolving challenge. 

I am incredibly proud of the selflessness of these public servants at this time of need. (5/5)  https://governor.vermont.gov/press-release/governor-phil-scott-orders-implementation-child-care-system-personnel-essential-covid …",[],['https://governor.vermont.gov/press-release/governor-phil-scott-orders-implementation-child-care-system-personnel-essential-covid'],[],1,1,10,[],[],https://twitter.com/GovPhilScott/status/1240062256152444939,False,,0,,,,,,,"[{'user_id': '545107258', 'username': 'GovPhilScott'}]",,,,
1240062254906847233,1240062251257790464,1584488855000,2020-03-17,19:47:35,EDT,545107258,govphilscott,Governor Phil Scott,,"That’s why, even as we ask the public to step back to help slow the spread of this virus, we are asking others, including our educators and child care providers, to step in and provide a critical service.... (4/5)",[],[],[],1,1,6,[],[],https://twitter.com/GovPhilScott/status/1240062254906847233,False,,0,,,,,,,"[{'user_id': '545107258', 'username': 'GovPhilScott'}]",,,,
1240062253623279618,1240062251257790464,1584488855000,2020-03-17,19:47:35,EDT,545107258,govphilscott,Governor Phil Scott,,"Teachers, childcare providers and school support staff are going to be as critical to our response as our doctors, nurses and healthcare support staff. (3/5)",[],[],[],2,0,4,[],[],https://twitter.com/GovPhilScott/status/1240062253623279618,False,,0,,,,,,,"[{'user_id': '545107258', 'username': 'GovPhilScott'}]",,,,
1240062252486721536,1240062251257790464,1584488854000,2020-03-17,19:47:34,EDT,545107258,govphilscott,Governor Phil Scott,,My directive also provides for continuity of funding for schools and providers during the period of school dismissal and closure to help preserve these important services for Vermonters post-response. (2/5) #vtpoli,[],[],[],2,0,4,['#vtpoli'],[],https://twitter.com/GovPhilScott/status/1240062252486721536,False,,0,,,,,,,"[{'user_id': '545107258', 'username': 'GovPhilScott'}]",,,,
1240062251257790464,1240062251257790464,1584488854000,2020-03-17,19:47:34,EDT,545107258,govphilscott,Governor Phil Scott,,"I'm directing childcare centers across the state to close normal operations, but encourage continued operation exclusively where needed to provide services for workers who are essential to Vermont’s ongoing effort in community mitigation of COVID-19. (1/5)
 https://governor.vermont.gov/press-release/governor-phil-scott-orders-implementation-child-care-system-personnel-essential-covid …",[],['https://governor.vermont.gov/press-release/governor-phil-scott-orders-implementation-child-care-system-personnel-essential-covid'],[],13,18,12,[],[],https://twitter.com/GovPhilScott/status/1240062251257790464,False,,0,,,,,,,"[{'user_id': '545107258', 'username': 'GovPhilScott'}]",,,,
1239670213081280514,1239670199869202432,1584395385000,2020-03-16,17:49:45,EDT,545107258,govphilscott,Governor Phil Scott,,"I want Vermonters to know we’re continuously evaluating other mitigation steps and we’ll continue to communicate those as they are put into place. 

We will get through this, but it'll take all of us doing our part. 

For the latest guidance, visit  http://healthvermont.gov/covid19  (2/2)",[],['http://healthvermont.gov/covid19'],[],1,8,32,[],[],https://twitter.com/GovPhilScott/status/1239670213081280514,False,,0,,,,,,,"[{'user_id': '545107258', 'username': 'GovPhilScott'}]",,,,
1239670199869202432,1239670199869202432,1584395382000,2020-03-16,17:49:42,EDT,545107258,govphilscott,Governor Phil Scott,,"In response to the COVID-19 pandemic, effective Tuesday, March 17 at 2:00 p.m. I am ordering the closure of all bars and restaurants statewide. Establishments may continue to offer food for take-out and by delivery. (1/2) #vtpoli  https://governor.vermont.gov/press-release/governor-phil-scott-announces-new-guidance-covid-19-community-mitigation-measures …",[],['https://governor.vermont.gov/press-release/governor-phil-scott-announces-new-guidance-covid-19-community-mitigation-measures'],[],24,70,101,['#vtpoli'],[],https://twitter.com/GovPhilScott/status/1239670199869202432,False,,0,,,,,,,"[{'user_id': '545107258', 'username': 'GovPhilScott'}]",,,,
1239315802622496769,1239314874901151747,1584310887000,2020-03-15,18:21:27,EDT,545107258,govphilscott,Governor Phil Scott,,"In times of crisis, we all need to make sacrifices. But Vermonters, and all Americans, have risen to the challenges before, and this time will be no different. We will get through this. And we’ll do it, together. 
 
For guidance on #coronavirus, visit  http://healthvermont.gov . 2/2 pic.twitter.com/4iBTFnryM8",[],['http://healthvermont.gov'],[],5,11,24,['#coronavirus'],[],https://twitter.com/GovPhilScott/status/1239315802622496769,False,,1,,,,,,,"[{'user_id': '545107258', 'username': 'GovPhilScott'}]",,,,
1239314874901151747,1239314874901151747,1584310666000,2020-03-15,18:17:46,EDT,545107258,govphilscott,Governor Phil Scott,,"The orderly dismissal of schools is essential to support both the State’s response to COVID-19 and the needs of children and families across VT. We must ensure children are safe, nourished, and still learning even as the traditional structure of school is disrupted. 1/2 #vtpoli pic.twitter.com/h2zLqgTTuk",[],[],[],19,19,66,['#vtpoli'],[],https://twitter.com/GovPhilScott/status/1239314874901151747,False,,1,,,,,,,"[{'user_id': '545107258', 'username': 'GovPhilScott'}]",,,,
1239272656983252993,1239272656983252993,1584300600000,2020-03-15,15:30:00,EDT,545107258,govphilscott,Governor Phil Scott,,"In response to the COVID-19 pandemic, I'm announcing a Continuity of Education Plan for the orderly dismissal of all schools, and cancellation of all school related activities, no later than Wednesday, March 18. More details here: 

 https://governor.vermont.gov/press-release/gov-scott-orders-orderly-closure-vermont-prek-12-schools-week …",[],['https://governor.vermont.gov/press-release/gov-scott-orders-orderly-closure-vermont-prek-12-schools-week'],[],23,111,146,[],[],https://twitter.com/GovPhilScott/status/1239272656983252993,False,,0,,,,,,,"[{'user_id': '545107258', 'username': 'GovPhilScott'}]",,,,
1238912450747084800,1238911128731820032,1584214720000,2020-03-14,15:38:40,EDT,545107258,govphilscott,Governor Phil Scott,,"(3/3) For the latest guidance on #coronavirus, visit  http://healthvermont.gov . pic.twitter.com/HWzWfVXlQU",[],['http://healthvermont.gov'],[],7,5,12,['#coronavirus'],[],https://twitter.com/GovPhilScott/status/1238912450747084800,False,,1,,,,,,,"[{'user_id': '545107258', 'username': 'GovPhilScott'}]",,,,
1238911819659575298,1238911128731820032,1584214570000,2020-03-14,15:36:10,EDT,545107258,govphilscott,Governor Phil Scott,,(2/3) For additional details read my executive order declaring a State of Emergency here:  https://governor.vermont.gov/content/declaration-state-emergency-response-covid-19-and-national-guard-call-out-executive-order-01 … pic.twitter.com/i7mYSOoneV,[],['https://governor.vermont.gov/content/declaration-state-emergency-response-covid-19-and-national-guard-call-out-executive-order-01'],[],5,6,14,[],[],https://twitter.com/GovPhilScott/status/1238911819659575298,False,,1,,,,,,,"[{'user_id': '545107258', 'username': 'GovPhilScott'}]",,,,
1238911128731820032,1238911128731820032,1584214405000,2020-03-14,15:33:25,EDT,545107258,govphilscott,Governor Phil Scott,,"(1/3) Every single one of us has a role to play confronting COVID-19 and protecting those who are most vulnerable to it – the very ill and elderly. We’re all in this together. We’re going to act together, and we’re going to get through this, together. pic.twitter.com/pkqxxFO7Dr",[],[],[],39,20,81,[],[],https://twitter.com/GovPhilScott/status/1238911128731820032,False,,1,,,,,,,"[{'user_id': '545107258', 'username': 'GovPhilScott'}]",,,,
1238552845261160451,1238552845261160451,1584128984000,2020-03-13,15:49:44,EDT,545107258,govphilscott,Governor Phil Scott,,"You can watch my press conference live on television on @WCAX, @WVNYWFFF and @MyNBC5 , as well as online on @VermontPBS at  https://www.vermontpbs.org/live/  https://twitter.com/GovPhilScott/status/1238461415825870849 …","['wcax', 'wvnywfff', 'mynbc5', 'vermontpbs']","['https://www.vermontpbs.org/live/', 'https://twitter.com/GovPhilScott/status/1238461415825870849']",[],25,13,13,[],[],https://twitter.com/GovPhilScott/status/1238552845261160451,False,https://twitter.com/GovPhilScott/status/1238461415825870849,0,,,,,,,"[{'user_id': '545107258', 'username': 'GovPhilScott'}, {'user_id': '9625592', 'username': 'wcax'}, {'user_id': '26587516', 'username': 'WVNYWFFF'}, {'user_id': '16161622', 'username': 'MyNBC5'}, {'user_id': '44195699', 'username': 'VermontPBS'}]",,,,
1238461415825870849,1238461415825870849,1584107185000,2020-03-13,09:46:25,EDT,545107258,govphilscott,Governor Phil Scott,,Today at 5:30 I’ll be joined by public health officials & members of my cabinet to provide an update on VT’s response to COVID-19 & detail new & additional mitigation steps VT is taking to address the spread of the virus. More details on where you can watch live will be provided.,[],[],[],15,31,58,[],[],https://twitter.com/GovPhilScott/status/1238461415825870849,False,,0,,,,,,,"[{'user_id': '545107258', 'username': 'GovPhilScott'}]",,,,
1237756873182306305,1237756873182306305,1583939209000,2020-03-11,11:06:49,EDT,545107258,govphilscott,Governor Phil Scott,,Congratulations to the Caps for winning the CVSA U14 state championship. Good luck in regionals! pic.twitter.com/MtzytYhjBH,[],[],['https://pbs.twimg.com/media/ES1lUFkUUAAnebG.jpg'],0,1,13,[],[],https://twitter.com/GovPhilScott/status/1237756873182306305,False,,0,,,,,,,"[{'user_id': '545107258', 'username': 'GovPhilScott'}]",,,,
1237403790019616769,1237403790019616769,1583855028000,2020-03-10,11:43:48,EDT,545107258,govphilscott,Governor Phil Scott,,Today I had the privilege of welcoming a group of inspiring New Americans and refugees in process of obtaining citizenship to my office in the State House. Vermont is proud to welcome refugees and immigrants to our state. pic.twitter.com/dW1pWUIRXD,[],[],"['https://pbs.twimg.com/media/ESwkK10WAAAZIbY.jpg', 'https://pbs.twimg.com/media/ESwkK11XQAEmI1B.jpg']",17,7,48,[],[],https://twitter.com/GovPhilScott/status/1237403790019616769,False,,0,,,,,,,"[{'user_id': '545107258', 'username': 'GovPhilScott'}]",,,,
1237371726499020800,1237371726499020800,1583847383000,2020-03-10,09:36:23,EDT,545107258,govphilscott,Governor Phil Scott,,Today I ordered the activation of the State Emergency Operations Center to further support our COVID-19 response. The health operations center has been activated since early February. For the latest guidance on #coronavirus visit  http://healthvermont.gov/covid  pic.twitter.com/7eZUwVzNAB,[],['http://healthvermont.gov/covid'],['https://pbs.twimg.com/media/ESwHBtbWkAIb2Tl.jpg'],9,23,35,['#coronavirus'],[],https://twitter.com/GovPhilScott/status/1237371726499020800,False,,0,,,,,,,"[{'user_id': '545107258', 'username': 'GovPhilScott'}]",,,,
1236498162023632897,1236498160391983104,1583639109000,2020-03-07,22:45:09,EDT,545107258,govphilscott,Governor Phil Scott,,Please find additional details from the Vermont Department of Health here: https://www.healthvermont.gov/media/newsroom/vermont-announces-first-presumptive-case-new-coronavirus-covid-19-march-7-2020 …,[],['https://www.healthvermont.gov/media/newsroom/vermont-announces-first-presumptive-case-new-coronavirus-covid-19-march-7-2020'],[],2,6,5,[],[],https://twitter.com/GovPhilScott/status/1236498162023632897,False,,0,,,,,,,"[{'user_id': '545107258', 'username': 'GovPhilScott'}]",,,,
1236498160391983104,1236498160391983104,1583639109000,2020-03-07,22:45:09,EDT,545107258,govphilscott,Governor Phil Scott,,The Vermont Dept. of Health has announced Vermont’s first case of COVID-19. View my statement below: pic.twitter.com/Z612HLont5,[],[],['https://pbs.twimg.com/media/ESjrqLrXgAAeWLh.jpg'],6,26,21,[],[],https://twitter.com/GovPhilScott/status/1236498160391983104,False,,0,,,,,,,"[{'user_id': '545107258', 'username': 'GovPhilScott'}]",,,,
1236290881608695809,1236290881608695809,1583589690000,2020-03-07,09:01:30,EDT,545107258,govphilscott,Governor Phil Scott,,"My administration has issued a directive to health insurers so that Vermonters will not be billed for medically necessary COVID-19 testing. And for the latest guidance on #coronavirus, visit  http://healthvermont.gov/covid  https://twitter.com/VermontDFR/status/1235998198998675456 …",[],"['http://healthvermont.gov/covid', 'https://twitter.com/VermontDFR/status/1235998198998675456']",[],4,24,67,['#coronavirus'],[],https://twitter.com/GovPhilScott/status/1236290881608695809,False,https://twitter.com/VermontDFR/status/1235998198998675456,0,,,,,,,"[{'user_id': '545107258', 'username': 'GovPhilScott'}]",,,,
1235648648010055685,1235648648010055685,1583436569000,2020-03-05,14:29:29,EDT,545107258,govphilscott,Governor Phil Scott,,"Thank you, @SenatorLeahy, for your hard work on the appropriations bill that will provide the funding and flexibility we need to respond. I appreciate you, as well as Rep. @PeterWelch, taking the time to update me on Congress’s progress over the past week. https://twitter.com/SenatorLeahy/status/1235616102832467968 …","['senatorleahy', 'peterwelch']",['https://twitter.com/SenatorLeahy/status/1235616102832467968'],[],3,3,25,[],[],https://twitter.com/GovPhilScott/status/1235648648010055685,False,https://twitter.com/SenatorLeahy/status/1235616102832467968,0,,,,,,,"[{'user_id': '545107258', 'username': 'GovPhilScott'}, {'user_id': '242836537', 'username': 'SenatorLeahy'}, {'user_id': '1410590874', 'username': 'PeterWelch'}]",,,,
1235247795524661248,1235247795524661248,1583340998000,2020-03-04,11:56:38,EDT,545107258,govphilscott,Governor Phil Scott,,"On this day 229 years ago, Vermont was formally admitted to the Union, becoming the 14th state. America is stronger because of the contributions of the Green Mountain State & its people. Stella quarta decima fulgeat (May the fourteenth star shine bright). Happy Birthday, Vermont! pic.twitter.com/vbiCi0x0Pb",[],[],['https://pbs.twimg.com/media/ESR7Th6VAAAPOxY.jpg'],3,24,63,[],[],https://twitter.com/GovPhilScott/status/1235247795524661248,False,,0,,,,,,,"[{'user_id': '545107258', 'username': 'GovPhilScott'}]",,,,
1234218537251635200,1234218537251635200,1583095604000,2020-03-01,15:46:44,EDT,545107258,govphilscott,Governor Phil Scott,"Stowe, VT","Enjoyed a beautiful afternoon in the 802 cross country skiing @TrappFamily Lodge in Stowe.  Great conditions on the first day of March - in like a lion, out like a lamb! Enjoy the snow while it lasts! #ThinkVT pic.twitter.com/lG4wd6hl4K – at Stowe, VT",['trappfamily'],[],"['https://pbs.twimg.com/media/ESDTNxrWoAAbBvH.jpg', 'https://pbs.twimg.com/media/ESDTNxtXkAA7cVe.jpg', 'https://pbs.twimg.com/media/ESDTNx7X0AAWNEv.jpg']",3,6,47,['#thinkvt'],[],https://twitter.com/GovPhilScott/status/1234218537251635200,False,,0,,,,,,,"[{'user_id': '545107258', 'username': 'GovPhilScott'}, {'user_id': '44175253', 'username': 'trappfamily'}]",,,,
1233789057265754113,1233789057265754113,1582993208000,2020-02-29,11:20:08,EDT,545107258,govphilscott,Governor Phil Scott,,"It’s officially @girlscouts Cookie Weekend in VT. Vermonters can stock up on these treats and support the largest entrepreneurship program for girls in the world. See the Girl Scout Weekend proclamation here:  https://bit.ly/2I8XDY5 , and don’t forget to support your local troop! pic.twitter.com/vuTBj1ra8y",['girlscouts'],['https://bit.ly/2I8XDY5'],['https://pbs.twimg.com/media/ER9MmKRWkAQ889m.jpg'],1,3,17,[],[],https://twitter.com/GovPhilScott/status/1233789057265754113,False,,0,,,,,,,"[{'user_id': '545107258', 'username': 'GovPhilScott'}, {'user_id': '103018203', 'username': 'girlscouts'}]",,,,
1233500282425872387,1233500282425872387,1582924359000,2020-02-28,16:12:39,EDT,545107258,govphilscott,Governor Phil Scott,,"Lucy Terry's ballad, “Bars Fight,” is considered the oldest known work of poetry by an African American. After settling in Guilford, VT, Lucy – a former slave – successfully argued her family's land theft case before the Vermont Supreme Court in 1785. #BlackHistoryMonth pic.twitter.com/axdTHSqJtq",[],[],['https://pbs.twimg.com/media/ER5F9_xWoAABLki.jpg'],0,3,15,['#blackhistorymonth'],[],https://twitter.com/GovPhilScott/status/1233500282425872387,False,,0,,,,,,,"[{'user_id': '545107258', 'username': 'GovPhilScott'}]",,,,
1233441120350326784,1233441120350326784,1582910253000,2020-02-28,12:17:33,EDT,545107258,govphilscott,Governor Phil Scott,,"Today at 1 p.m., my team at @healthvermont & @vemvt  will provide an update on Coronavirus (COVID-19). While there are currently no cases of people with COVID-19 in Vermont, this team will detail our preparations for, and response to, COVID-19. Watch at:  https://www.facebook.com/vermontemergencymanagement/ …","['healthvermont', 'vemvt']",['https://www.facebook.com/vermontemergencymanagement/'],[],3,8,15,[],[],https://twitter.com/GovPhilScott/status/1233441120350326784,False,,0,,,,,,,"[{'user_id': '545107258', 'username': 'GovPhilScott'}, {'user_id': '35820178', 'username': 'healthvermont'}, {'user_id': '41622671', 'username': 'vemvt'}]",,,,
1233415682378752006,1233415682378752006,1582904189000,2020-02-28,10:36:29,EDT,545107258,govphilscott,Governor Phil Scott,,"It was a pleasure to be with Mary again today to sign a proclamation naming Feb. 29 Rare Disease Day in Vermont, raising awareness of the nearly 7,000 @NIH designated rare diseases and conditions that affect Vermonters and Americans. Thank you for you tireless advocacy, Mary!  https://twitter.com/GovPhilScott/status/1222532072104919043 … pic.twitter.com/RYsWtY94RC",['nih'],['https://twitter.com/GovPhilScott/status/1222532072104919043'],"['https://pbs.twimg.com/media/ER35BFwVAAAvW02.jpg', 'https://pbs.twimg.com/media/ER35BFvU8AAX2Bt.jpg']",1,1,11,[],[],https://twitter.com/GovPhilScott/status/1233415682378752006,False,,0,,,,,,,"[{'user_id': '545107258', 'username': 'GovPhilScott'}, {'user_id': '15134240', 'username': 'NIH'}]",,,,
1232847567601319937,1232847567601319937,1582768739000,2020-02-26,20:58:59,EDT,545107258,govphilscott,Governor Phil Scott,,"Last year, 69 Vermont senior athletes competed in the National Senior Games in New Mexico. 34 were podium finishers, collectively winning 14 gold, 8 silver and 12 bronze medals. Today I had the honor of welcoming them to the State House and congratulate them for making VT proud. pic.twitter.com/ebAiq2nLqB",[],[],['https://pbs.twimg.com/media/ERv0UmlUEAAlWAk.jpg'],0,1,11,[],[],https://twitter.com/GovPhilScott/status/1232847567601319937,False,,0,,,,,,,"[{'user_id': '545107258', 'username': 'GovPhilScott'}]",,,,
1232751953421185024,1232751953421185024,1582745943000,2020-02-26,14:39:03,EDT,545107258,govphilscott,Governor Phil Scott,,"Today I met with young author, Carter Somaini, a 4th grader from Barre whose book, “The Boy and the Bat,” shows kids with dyslexia that they can do anything they set their mind to. Thanks to Carter and his family for joining me this morning! pic.twitter.com/xaYhLRMoB2",[],[],"['https://pbs.twimg.com/media/ERudWTtXkAA2euA.jpg', 'https://pbs.twimg.com/media/ERudWT_WkAAfooA.jpg', 'https://pbs.twimg.com/media/ERudWTbX0AE-U2r.jpg']",2,6,39,[],[],https://twitter.com/GovPhilScott/status/1232751953421185024,False,,0,,,,,,,"[{'user_id': '545107258', 'username': 'GovPhilScott'}]",,,,
1232113196959518720,1232113196959518720,1582593652000,2020-02-24,20:20:52,EDT,545107258,govphilscott,Governor Phil Scott,,Glad to end our Essex County #VTCapitol4aDay at the Essex House and Tavern in Island Pond. This community is leveraging outdoor recreation to support its economy and showing what a great asset our natural resources and recreation can be. pic.twitter.com/azV97BOI79,[],[],"['https://pbs.twimg.com/media/ERlYaLnWsAUiyfQ.jpg', 'https://pbs.twimg.com/media/ERlYaLkWsAAslAp.jpg', 'https://pbs.twimg.com/media/ERlYaLtWkAACFDN.jpg', 'https://pbs.twimg.com/media/ERlYaLyWAAIsmN-.jpg']",2,3,17,['#vtcapitol4aday'],[],https://twitter.com/GovPhilScott/status/1232113196959518720,False,,0,,,,,,,"[{'user_id': '545107258', 'username': 'GovPhilScott'}]",,,,
1232098818646331393,1232098806893883393,1582590224000,2020-02-24,19:23:44,EDT,545107258,govphilscott,Governor Phil Scott,,"It’s incredibly helpful to hear from those on the ground about the benefits of better integration, helping patients navigate the system and growing the healthcare workforce.  #VTCapitol4aDay",[],[],[],1,1,5,['#vtcapitol4aday'],[],https://twitter.com/GovPhilScott/status/1232098818646331393,False,,0,,,,,,,"[{'user_id': '545107258', 'username': 'GovPhilScott'}]",,,,
1232098806893883393,1232098806893883393,1582590221000,2020-02-24,19:23:41,EDT,545107258,govphilscott,Governor Phil Scott,,Community based healthcare helps us deliver vital services in rural areas where access is especially challenging. Pleased to learn more about unique needs & strategies - including coordinated care - in Essex County from the professionals at the Island Pond Health & Dental Center. pic.twitter.com/1GcIBJvKsN,[],[],"['https://pbs.twimg.com/media/ERlLRFVXYAIVmS0.jpg', 'https://pbs.twimg.com/media/ERlLRFkW4AESVyL.jpg', 'https://pbs.twimg.com/media/ERlLRFoWoAEZd9b.jpg']",1,2,6,[],[],https://twitter.com/GovPhilScott/status/1232098806893883393,False,,0,,,,,,,"[{'user_id': '545107258', 'username': 'GovPhilScott'}]",,,,
1232043102862499840,1232043102862499840,1582576940000,2020-02-24,15:42:20,EDT,545107258,govphilscott,Governor Phil Scott,,"#VTCapitol4aDay brought us to Sweet Tree Holdings (@themapleguild) in Island Pond. This impressive, innovative operation is producing quality organic syrup, sold around the world. pic.twitter.com/VbfZgUrrU2",['themapleguild'],[],"['https://pbs.twimg.com/media/ERkYpj4X0AI_ouM.jpg', 'https://pbs.twimg.com/media/ERkYpj2WsAAOg7H.jpg', 'https://pbs.twimg.com/media/ERkYpjoXkAEJdD4.jpg', 'https://pbs.twimg.com/media/ERkYpkkX0AU1YPM.jpg']",1,5,16,['#vtcapitol4aday'],[],https://twitter.com/GovPhilScott/status/1232043102862499840,False,,0,,,,,,,"[{'user_id': '545107258', 'username': 'GovPhilScott'}, {'user_id': '4515603142', 'username': 'themapleguild'}]",,,,
1232007936601403397,1232005505670930432,1582568556000,2020-02-24,13:22:36,EDT,545107258,govphilscott,Governor Phil Scott,,"If you’re in the area, make sure to stop by April’s Maple 🍁 pic.twitter.com/1xTitqqaHb",[],[],['https://pbs.twimg.com/media/ERj4r17XkAAgQYW.jpg'],0,0,7,[],[],https://twitter.com/GovPhilScott/status/1232007936601403397,False,,0,,,,,,,"[{'user_id': '545107258', 'username': 'GovPhilScott'}]",,,,
