id,conversation_id,created_at,date,time,timezone,user_id,username,name,place,tweet,mentions,urls,photos,replies_count,retweets_count,likes_count,hashtags,cashtags,link,retweet,quote_url,video,near,geo,source,user_rt_id,user_rt,retweet_id,reply_to,retweet_date,translate,trans_src,trans_dest
1219705963692875776,1219705806918242305,1579635537000,2020-01-21,14:38:57,EDT,545107258,govphilscott,Governor Phil Scott,,"(3/4) These efforts not only benefit our state, they also signal we’re committed to the values this nation was built on. #VTBudget",['vtlabor'],[],[],1,0,4,['#vtbudget'],[],https://twitter.com/GovPhilScott/status/1219705963692875776,False,,0,,,,,,,"[{'user_id': '545107258', 'username': 'GovPhilScott'}, {'user_id': '898273962282627072', 'username': 'VTLabor'}]",,,,
1219705859695095810,1219705806918242305,1579635512000,2020-01-21,14:38:32,EDT,545107258,govphilscott,Governor Phil Scott,,(2/4) This includes funding to @VTLabor that will help communities plan for and explore refugee resettlement and opportunities to welcome more New Americans to Vermont. #VTBudget,['vtlabor'],[],[],1,0,3,['#vtbudget'],[],https://twitter.com/GovPhilScott/status/1219705859695095810,False,,0,,,,,,,"[{'user_id': '545107258', 'username': 'GovPhilScott'}, {'user_id': '898273962282627072', 'username': 'VTLabor'}]",,,,
1219705806918242305,1219705806918242305,1579635500000,2020-01-21,14:38:20,EDT,545107258,govphilscott,Governor Phil Scott,,(1/4) We’ll continue to advocate for more legal immigration as a way to bring more hardworking people to Vermont to contribute to our economy and grow our workforce. #VTBudget,[],[],[],3,3,9,['#vtbudget'],[],https://twitter.com/GovPhilScott/status/1219705806918242305,False,,0,,,,,,,"[{'user_id': '545107258', 'username': 'GovPhilScott'}]",,,,
1219705752157327360,1219705752157327360,1579635487000,2020-01-21,14:38:07,EDT,545107258,govphilscott,Governor Phil Scott,,"We’ll also continue our efforts to recruit more people to live and work here. This includes increased funding for @VTLabor's VT Relocation Assistance Program to ensure folks interested in moving here have the info they need about jobs, housing & opportunities available. #VTBudget",['vtlabor'],[],[],0,2,3,['#vtbudget'],[],https://twitter.com/GovPhilScott/status/1219705752157327360,False,,0,,,,,,,"[{'user_id': '545107258', 'username': 'GovPhilScott'}, {'user_id': '898273962282627072', 'username': 'VTLabor'}]",,,,
1219705629570490368,1219705629570490368,1579635457000,2020-01-21,14:37:37,EDT,545107258,govphilscott,Governor Phil Scott,,We hear about our growing labor shortage in every sector on a daily basis... I ask you to work with me on a $1M incentive to keep graduates from our registered nurse and licensed practical nurse programs right here... filling positions desperately needed by employers. #VTBudget,[],[],[],0,1,4,['#vtbudget'],[],https://twitter.com/GovPhilScott/status/1219705629570490368,False,,0,,,,,,,"[{'user_id': '545107258', 'username': 'GovPhilScott'}]",,,,
1219705402687926278,1219705324132806656,1579635403000,2020-01-21,14:36:43,EDT,545107258,govphilscott,Governor Phil Scott,,"(2/2) If you’re willing to look at things differently and move with urgency, we can have a unified, statewide training program next year. #VTBudget","['vtlabor', 'vteducation', 'vsc_edu', 'ccv_vt', 'vttech']",[],[],0,1,2,['#vtbudget'],[],https://twitter.com/GovPhilScott/status/1219705402687926278,False,,0,,,,,,,"[{'user_id': '545107258', 'username': 'GovPhilScott'}, {'user_id': '898273962282627072', 'username': 'VTLabor'}, {'user_id': '113102632', 'username': 'VTEducation'}, {'user_id': '262789147', 'username': 'VSC_edu'}, {'user_id': '34665127', 'username': 'CCV_VT'}, {'user_id': '72907197', 'username': 'vttech'}]",,,,
1219705324132806656,1219705324132806656,1579635384000,2020-01-21,14:36:24,EDT,545107258,govphilscott,Governor Phil Scott,,"(1/2) I’ve also asked @VTLabor and @VTEducation to work with @VSC_edu to align our Adult Ed and Adult CTE system with @CCV_VT, @vttech, our tech centers and regional stakeholders. This will create a seamless pathway from school to training to work. #VTBudget","['vtlabor', 'vteducation', 'vsc_edu', 'ccv_vt', 'vttech']",[],[],1,3,5,['#vtbudget'],[],https://twitter.com/GovPhilScott/status/1219705324132806656,False,,0,,,,,,,"[{'user_id': '545107258', 'username': 'GovPhilScott'}, {'user_id': '898273962282627072', 'username': 'VTLabor'}, {'user_id': '113102632', 'username': 'VTEducation'}, {'user_id': '262789147', 'username': 'VSC_edu'}, {'user_id': '34665127', 'username': 'CCV_VT'}, {'user_id': '72907197', 'username': 'vttech'}]",,,,
1219705186106691584,1219705026811252736,1579635352000,2020-01-21,14:35:52,EDT,545107258,govphilscott,Governor Phil Scott,,(3/3) That’s why I’ve directed @VTLabor to work with @VSC_edu and tech centers throughout the state to double the number of apprentices by 2023. #VTBudget,"['vtlabor', 'vsc_edu']",[],[],1,1,4,['#vtbudget'],[],https://twitter.com/GovPhilScott/status/1219705186106691584,False,,0,,,,,,,"[{'user_id': '545107258', 'username': 'GovPhilScott'}, {'user_id': '898273962282627072', 'username': 'VTLabor'}, {'user_id': '262789147', 'username': 'VSC_edu'}]",,,,
1219705133417869313,1219705026811252736,1579635339000,2020-01-21,14:35:39,EDT,545107258,govphilscott,Governor Phil Scott,,"(2/3) Apprenticeships are great opportunities for Vermonters to earn while they learn... These programs are industry-driven, allowing employers to recruit for good jobs they have available. But there’s an opportunity and need to do more. #VTBudget",[],[],[],1,1,3,['#vtbudget'],[],https://twitter.com/GovPhilScott/status/1219705133417869313,False,,0,,,,,,,"[{'user_id': '545107258', 'username': 'GovPhilScott'}]",,,,
1219705026811252736,1219705026811252736,1579635314000,2020-01-21,14:35:14,EDT,545107258,govphilscott,Governor Phil Scott,,"(1/3) Over the last four years, we’ve added more than 700 apprentices to our workforce, which includes a 36% increase in the number of women in these important programs. #VTBudget",[],[],[],1,3,4,['#vtbudget'],[],https://twitter.com/GovPhilScott/status/1219705026811252736,False,,0,,,,,,,"[{'user_id': '545107258', 'username': 'GovPhilScott'}]",,,,
1219704676729393153,1219704623117656064,1579635230000,2020-01-21,14:33:50,EDT,545107258,govphilscott,Governor Phil Scott,,"(2/2) Let’s build on this success with an additional $3 million for childcare assistance, and let’s also expand the lottery and commit these new revenues to this initiative each year moving forward. #VTBudget",[],[],[],1,0,4,['#vtbudget'],[],https://twitter.com/GovPhilScott/status/1219704676729393153,False,,0,,,,,,,"[{'user_id': '545107258', 'username': 'GovPhilScott'}]",,,,
1219704623117656064,1219704623117656064,1579635217000,2020-01-21,14:33:37,EDT,545107258,govphilscott,Governor Phil Scott,,"(1/2) We know the benefits of accessible, affordable childcare for parents, kids and our economy, which is why we’ve worked together to increase funding by 30%—about $10 million—over the last three years, and these investments are working. #VTBudget",[],[],[],1,0,4,['#vtbudget'],[],https://twitter.com/GovPhilScott/status/1219704623117656064,False,,0,,,,,,,"[{'user_id': '545107258', 'username': 'GovPhilScott'}]",,,,
1219704472336764928,1219704472336764928,1579635181000,2020-01-21,14:33:01,EDT,545107258,govphilscott,Governor Phil Scott,,To recognize the incredible importance of our larger anchor employers... I propose a $3M VT Capital Investment Incentive Program which encourages these companies to make new upgrades at local facilities & in exchange... they’ll commit to maintain certain payroll levels. #VTBudget,[],[],[],0,0,2,['#vtbudget'],[],https://twitter.com/GovPhilScott/status/1219704472336764928,False,,0,,,,,,,"[{'user_id': '545107258', 'username': 'GovPhilScott'}]",,,,
1219704377507753984,1219704377507753984,1579635159000,2020-01-21,14:32:39,EDT,545107258,govphilscott,Governor Phil Scott,,"To support more small business growth, I’m proposing a $1 million incentive program through the Vermont Economic Development Authority (VEDA) to provide low-cost loans that convert to no-cost grants after meeting expansion and payroll goals. #VTBudget",[],[],[],1,0,2,['#vtbudget'],[],https://twitter.com/GovPhilScott/status/1219704377507753984,False,,0,,,,,,,"[{'user_id': '545107258', 'username': 'GovPhilScott'}]",,,,
1219704321086050304,1219704271853228034,1579635145000,2020-01-21,14:32:25,EDT,545107258,govphilscott,Governor Phil Scott,,"(2/2) And when they’re successful, we’ll provide a match to the federal grant to help them grow and create jobs. #VTBudget",[],[],[],0,0,3,['#vtbudget'],[],https://twitter.com/GovPhilScott/status/1219704321086050304,False,,0,,,,,,,"[{'user_id': '545107258', 'username': 'GovPhilScott'}]",,,,
1219704271853228034,1219704271853228034,1579635134000,2020-01-21,14:32:14,EDT,545107258,govphilscott,Governor Phil Scott,,(1/2) We’ll also support our small technology businesses with an investment of $1M to help them secure federal Small Business Innovation grants for groundbreaking work done right here in Vermont and to tap into the research capabilities at our colleges and universities. #VTBudget,[],[],[],1,0,4,['#vtbudget'],[],https://twitter.com/GovPhilScott/status/1219704271853228034,False,,0,,,,,,,"[{'user_id': '545107258', 'username': 'GovPhilScott'}]",,,,
1219704193113563136,1219704193113563136,1579635115000,2020-01-21,14:31:55,EDT,545107258,govphilscott,Governor Phil Scott,,"Let’s make it easier to start, register and operate a business here. Working with @VermontSOS, my budget includes $1 million for a streamlined and online business portal which will make it much easier for them to navigate state government. #VTBudget",['vermontsos'],[],[],1,0,5,['#vtbudget'],[],https://twitter.com/GovPhilScott/status/1219704193113563136,False,,0,,,,,,,"[{'user_id': '545107258', 'username': 'GovPhilScott'}, {'user_id': '3946773623', 'username': 'VermontSOS'}]",,,,
1219703987664052233,1219703987664052233,1579635066000,2020-01-21,14:31:06,EDT,545107258,govphilscott,Governor Phil Scott,,"As another part of my Community Investment Package, my budget includes $1M for incentives to rehabilitate old homes into decent, affordable, energy efficient rental properties [and] reforms to the Renter Rebate Program... resulting in about $800K more in rebates. #VTBudget",[],[],[],0,0,2,['#vtbudget'],[],https://twitter.com/GovPhilScott/status/1219703987664052233,False,,0,,,,,,,"[{'user_id': '545107258', 'username': 'GovPhilScott'}]",,,,
1219703717747924992,1219703594703904771,1579635001000,2020-01-21,14:30:01,EDT,545107258,govphilscott,Governor Phil Scott,,"(2/2) Let’s couple the most beautiful state in the nation with an increased investment to remind the 70 million people who live within a six-hour drive that we’re not only a great place to visit but also to live, work, play and, hopefully, invest in. #VTBudget",[],[],[],0,1,11,['#vtbudget'],[],https://twitter.com/GovPhilScott/status/1219703717747924992,False,,0,,,,,,,"[{'user_id': '545107258', 'username': 'GovPhilScott'}]",,,,
1219703594703904771,1219703594703904771,1579634972000,2020-01-21,14:29:32,EDT,545107258,govphilscott,Governor Phil Scott,,"(1/2) Tourism is a top contributor to our economy. But we’re investing far less than every other state in the region & we compete with them for visitors every single day. My budget includes an additional $1M investment in tourism, economic dev & outdoor rec marketing. #VTBudget",[],[],[],5,4,31,['#vtbudget'],[],https://twitter.com/GovPhilScott/status/1219703594703904771,False,,0,,,,,,,"[{'user_id': '545107258', 'username': 'GovPhilScott'}]",,,,
1219703471835881473,1219703471835881473,1579634943000,2020-01-21,14:29:03,EDT,545107258,govphilscott,Governor Phil Scott,,"To further strengthen Vermont’s small towns, agriculture and other businesses, I’ve budgeted $750,000 for the Working Lands initiative which will help expand production of quality food, forest products and jobs. #VTBudget",[],[],[],0,0,2,['#vtbudget'],[],https://twitter.com/GovPhilScott/status/1219703471835881473,False,,0,,,,,,,"[{'user_id': '545107258', 'username': 'GovPhilScott'}]",,,,
1219703414688567296,1219703414688567296,1579634929000,2020-01-21,14:28:49,EDT,545107258,govphilscott,Governor Phil Scott,,"I also propose a $2.8M investment that will leverage another $11.3M in federal funds to complete the Lamoille Valley Rail Trail.... When complete, the activity it will create—along with cross promotion—will strengthen businesses, economies & the quality of life. #VTBudget",[],[],[],1,3,6,['#vtbudget'],[],https://twitter.com/GovPhilScott/status/1219703414688567296,False,,0,,,,,,,"[{'user_id': '545107258', 'username': 'GovPhilScott'}]",,,,
1219703122127396864,1219703122127396864,1579634859000,2020-01-21,14:27:39,EDT,545107258,govphilscott,Governor Phil Scott,,The City of Newport is now poised for a once-in-a-generation redevelopment... The capital bill now includes $1.5M to begin the process of helping to revitalize Main St... bring[ing] public & private investment together to implement a larger vision for Newport & the NEK. #VTBudget,[],[],[],0,0,2,['#vtbudget'],[],https://twitter.com/GovPhilScott/status/1219703122127396864,False,,0,,,,,,,"[{'user_id': '545107258', 'username': 'GovPhilScott'}]",,,,
1219702877033246722,1219702877033246722,1579634801000,2020-01-21,14:26:41,EDT,545107258,govphilscott,Governor Phil Scott,,"Tax Increment Financing [districts] not only create economic growth but also empower communities to shape their own future... I’ll continue to support expanding them across Vermont, including a proposal to make them available to smaller communities. #VTBudget",[],[],[],0,0,4,['#vtbudget'],[],https://twitter.com/GovPhilScott/status/1219702877033246722,False,,0,,,,,,,"[{'user_id': '545107258', 'username': 'GovPhilScott'}]",,,,
1219702655347494915,1219702655347494915,1579634748000,2020-01-21,14:25:48,EDT,545107258,govphilscott,Governor Phil Scott,,"Today, I propose increasing the downtown & village center tax credits to $4 million—a $1.4 million increase. These dollars support important projects like Springfield’s Woolson Block & Bennington’s Putnam Block that are often the first step in community revitalization. #VTBudget",[],[],[],0,0,2,['#vtbudget'],[],https://twitter.com/GovPhilScott/status/1219702655347494915,False,,0,,,,,,,"[{'user_id': '545107258', 'username': 'GovPhilScott'}]",,,,
1219702402481369088,1219702402481369088,1579634688000,2020-01-21,14:24:48,EDT,545107258,govphilscott,Governor Phil Scott,,"To put all Vermonters on a better path, we must increase economic opportunity in each of our 14 counties. That’s why this budget includes more investments in downtowns and regional economic centers, and tools to help employers survive and create more good paying jobs. #VTBudget",[],[],[],0,0,3,['#vtbudget'],[],https://twitter.com/GovPhilScott/status/1219702402481369088,False,,0,,,,,,,"[{'user_id': '545107258', 'username': 'GovPhilScott'}]",,,,
1219702259174510594,1219702259174510594,1579634654000,2020-01-21,14:24:14,EDT,545107258,govphilscott,Governor Phil Scott,,"We’re one of only 4 states moving forward with a prescription importation program… Our estimates show this could save millions… My budget includes resources to continue this important effort, because lowering the costs of prescription drugs is the right thing to do. #VTBudget",[],[],[],0,0,2,['#vtbudget'],[],https://twitter.com/GovPhilScott/status/1219702259174510594,False,,0,,,,,,,"[{'user_id': '545107258', 'username': 'GovPhilScott'}]",,,,
1219702057176834050,1219701676925423616,1579634606000,2020-01-21,14:23:26,EDT,545107258,govphilscott,Governor Phil Scott,,(2/2) I recommend we continue to support this work by asking you to authorize the $5.7M for delivery system reforms proposed in budget adjustment on the condition the ACO operate as a non-profit or meet those same transparency standards. #VTBudget,[],[],[],0,0,3,['#vtbudget'],[],https://twitter.com/GovPhilScott/status/1219702057176834050,False,,0,,,,,,,"[{'user_id': '545107258', 'username': 'GovPhilScott'}]",,,,
1219701676925423616,1219701676925423616,1579634515000,2020-01-21,14:21:55,EDT,545107258,govphilscott,Governor Phil Scott,,"(1/2) In 2018, the providers the state paid through the ACO reduced the amount of money spent on healthcare services by $7.7M. In the same year, providers who were not paid through the ACO spent $1.5M more than expected. Early results for 2019 show a similar pattern. #VTBudget",[],[],[],1,0,2,['#vtbudget'],[],https://twitter.com/GovPhilScott/status/1219701676925423616,False,,0,,,,,,,"[{'user_id': '545107258', 'username': 'GovPhilScott'}]",,,,
1219701284254769153,1219701284254769153,1579634421000,2020-01-21,14:20:21,EDT,545107258,govphilscott,Governor Phil Scott,,"We’ll be able to triple the number of barracks where we embed [social workers], which will reduce the volume of emergency calls, hospitalizations and court involvement for some of our most vulnerable Vermonters, all within existing resources. #VTBudget",[],[],[],1,0,5,['#vtbudget'],[],https://twitter.com/GovPhilScott/status/1219701284254769153,False,,0,,,,,,,"[{'user_id': '545107258', 'username': 'GovPhilScott'}]",,,,
1219701125324197890,1219701125324197890,1579634383000,2020-01-21,14:19:43,EDT,545107258,govphilscott,Governor Phil Scott,,"I’d like to pilot a new mental health Mobile Response Unit. In other states, this model has reduced emergency room visits and hospital admissions, saved many hours of law enforcement time and helped foster kids find stability. #VTBudget",[],[],[],1,0,3,['#vtbudget'],[],https://twitter.com/GovPhilScott/status/1219701125324197890,False,,0,,,,,,,"[{'user_id': '545107258', 'username': 'GovPhilScott'}]",,,,
1219701003949428737,1219701003949428737,1579634354000,2020-01-21,14:19:14,EDT,545107258,govphilscott,Governor Phil Scott,,"Tragically, suicide is a growing risk around the country, and we know all too well Vermont is not immune. Our approach must focus on early intervention for those at risk. That’s why my budget invests over $1 million more in suicide prevention & mental health services. #VTBudget",[],[],[],0,1,6,['#vtbudget'],[],https://twitter.com/GovPhilScott/status/1219701003949428737,False,,0,,,,,,,"[{'user_id': '545107258', 'username': 'GovPhilScott'}]",,,,
1219700820373131266,1219700686277029889,1579634311000,2020-01-21,14:18:31,EDT,545107258,govphilscott,Governor Phil Scott,,"(3/3) Coupled with the universal afterschool network I proposed in the State of the State and expanding mental health services in schools, we can prevent serious problems before they develop and give every child the hope and opportunity they need and deserve. #VTBudget",[],[],[],0,0,5,['#vtbudget'],[],https://twitter.com/GovPhilScott/status/1219700820373131266,False,,0,,,,,,,"[{'user_id': '545107258', 'username': 'GovPhilScott'}]",,,,
1219700746029010945,1219700686277029889,1579634293000,2020-01-21,14:18:13,EDT,545107258,govphilscott,Governor Phil Scott,,"(2/3) ...reduced costs of child protection, special education, substance abuse and criminal justice services down the road and put families on a path to economic self-sufficiency. #VTBudget",[],[],[],1,0,2,['#vtbudget'],[],https://twitter.com/GovPhilScott/status/1219700746029010945,False,,0,,,,,,,"[{'user_id': '545107258', 'username': 'GovPhilScott'}]",,,,
1219700686277029889,1219700686277029889,1579634279000,2020-01-21,14:17:59,EDT,545107258,govphilscott,Governor Phil Scott,,"(1/3) By investing $1M more in our newborn home visiting program, we can cover roughly 1/4 of all the babies born each year, giving these parents the support they need to build a better foundation for their kids. This model has improved the health of babies and moms... #VTBudget",[],[],[],1,0,3,['#vtbudget'],[],https://twitter.com/GovPhilScott/status/1219700686277029889,False,,0,,,,,,,"[{'user_id': '545107258', 'username': 'GovPhilScott'}]",,,,
1219700570635808770,1219700570635808770,1579634251000,2020-01-21,14:17:31,EDT,545107258,govphilscott,Governor Phil Scott,,"My budget prioritizes spending to prevent root causes rather than just treat consequences... to find efficiencies, make structural changes & create savings in order to reinvest in areas that prevent problems in the first place which will further reduce costs over time. #VTBudget",[],[],[],0,1,3,['#vtbudget'],[],https://twitter.com/GovPhilScott/status/1219700570635808770,False,,0,,,,,,,"[{'user_id': '545107258', 'username': 'GovPhilScott'}]",,,,
1219700216695312387,1219700216695312387,1579634167000,2020-01-21,14:16:07,EDT,545107258,govphilscott,Governor Phil Scott,,"Our demographic crisis is without question the greatest challenge we face as a state... But here’s the thing: We can fix it, so long as we resist the temptation to ignore it, get distracted by politics or become deterred by hard work. #VTBudget",[],[],[],0,2,8,['#vtbudget'],[],https://twitter.com/GovPhilScott/status/1219700216695312387,False,,0,,,,,,,"[{'user_id': '545107258', 'username': 'GovPhilScott'}]",,,,
1219699911152762887,1219699846577295360,1579634094000,2020-01-21,14:14:54,EDT,545107258,govphilscott,Governor Phil Scott,,"(2/2) And even with consistent revenue growth, each year we’ve had to make difficult decisions with reductions to agencies, departments, programs and services. #VTBudget",[],[],[],0,0,2,['#vtbudget'],[],https://twitter.com/GovPhilScott/status/1219699911152762887,False,,0,,,,,,,"[{'user_id': '545107258', 'username': 'GovPhilScott'}]",,,,
1219699846577295360,1219699846577295360,1579634079000,2020-01-21,14:14:39,EDT,545107258,govphilscott,Governor Phil Scott,,"(1/2) The General Fund budget I’m presenting spends $1.7 billion, which is an increase of 2.8% or $46 million over the current year. Here’s the frustrating part: Even with organic revenue growth, we still started building our General Fund budget with a $70 million gap. #VTBudget",[],[],[],1,0,2,['#vtbudget'],[],https://twitter.com/GovPhilScott/status/1219699846577295360,False,,0,,,,,,,"[{'user_id': '545107258', 'username': 'GovPhilScott'}]",,,,
1219699743049289728,1219699678490611712,1579634054000,2020-01-21,14:14:14,EDT,545107258,govphilscott,Governor Phil Scott,,"(2/2) ...student performance and the number of kids continue to decrease. Since Act 60 was passed, we’ve lost 26,000 students from our K-12 public schools while education spending has more than doubled. #VTBudget",[],[],[],0,0,2,['#vtbudget'],[],https://twitter.com/GovPhilScott/status/1219699743049289728,False,,0,,,,,,,"[{'user_id': '545107258', 'username': 'GovPhilScott'}]",,,,
1219699678490611712,1219699678490611712,1579634038000,2020-01-21,14:13:58,EDT,545107258,govphilscott,Governor Phil Scott,,"(1/2) In the Education Fund... we project spending to total over $1.8 billion, an $87 million, 5% increase over the current year. Unfortunately, we’re seeing spending, property taxes, as well as inequity, continue to increase while educational opportunities... #VTBudget",[],[],[],1,0,4,['#vtbudget'],[],https://twitter.com/GovPhilScott/status/1219699678490611712,False,,0,,,,,,,"[{'user_id': '545107258', 'username': 'GovPhilScott'}]",,,,
1219699553315774465,1219699553315774465,1579634009000,2020-01-21,14:13:29,EDT,545107258,govphilscott,Governor Phil Scott,,We’re now in the second year of the $124 million capital bill. I’ll propose a few changes... but we remain on target in most areas. #VTBudget,[],[],[],0,0,3,['#vtbudget'],[],https://twitter.com/GovPhilScott/status/1219699553315774465,False,,0,,,,,,,"[{'user_id': '545107258', 'username': 'GovPhilScott'}]",,,,
1219699495392497665,1219699360562401281,1579633995000,2020-01-21,14:13:15,EDT,545107258,govphilscott,Governor Phil Scott,,"(2/2) This includes $100M for roads and paving, major projects like the new draw bridge in Grand Isle & our rail project in Middlebury... It provides for 158 new park and ride spaces, investments in bike and ped projects and so much more. #VTBudget",[],[],[],0,0,4,['#vtbudget'],[],https://twitter.com/GovPhilScott/status/1219699495392497665,False,,0,,,,,,,"[{'user_id': '545107258', 'username': 'GovPhilScott'}]",,,,
1219699360562401281,1219699360562401281,1579633963000,2020-01-21,14:12:43,EDT,545107258,govphilscott,Governor Phil Scott,,"(1/2) The transportation budget includes $276.7M in state funds... leveraging another $335.6M in federal funds. This amounts to a $25.5M increase... the largest transportation budget since the Irene recovery, without raising additional taxes or fees. #VTBudget",[],[],[],1,0,4,['#vtbudget'],[],https://twitter.com/GovPhilScott/status/1219699360562401281,False,,0,,,,,,,"[{'user_id': '545107258', 'username': 'GovPhilScott'}]",,,,
1219699238386442240,1219699238386442240,1579633934000,2020-01-21,14:12:14,EDT,545107258,govphilscott,Governor Phil Scott,,"This is the approach we took, and in the upcoming fiscal year, across all funds, our budget totals $6.3 billion. With $4.2 billion of state revenue sources and $2.1 billion in federal dollars, this is an increase of about 2% over the current year. #VTBudget",[],[],[],0,0,2,['#vtbudget'],[],https://twitter.com/GovPhilScott/status/1219699238386442240,False,,0,,,,,,,"[{'user_id': '545107258', 'username': 'GovPhilScott'}]",,,,
1219699154345172993,1219699154345172993,1579633913000,2020-01-21,14:11:53,EDT,545107258,govphilscott,Governor Phil Scott,,"With each budget proposal, I’ve focused on our fiscal fundamentals, to balance what we want with what we need and to set us on a path where our capacity to solve problems and help people grows while the burden on taxpayers shrinks. #VTBudget",[],[],[],0,0,3,['#vtbudget'],[],https://twitter.com/GovPhilScott/status/1219699154345172993,False,,0,,,,,,,"[{'user_id': '545107258', 'username': 'GovPhilScott'}]",,,,
